epic,desc,pd,pd12,charge,spread
0005997,Aberdeen New Thai Investment Trust plc (ANW) Ordinary 25p Shares Share Price | ANW,-14.34,-15.40,1.35,2.12
0006655,Aberforth Smaller Companies Trust (ASL) Ordinary 1p Shares Share Price | ASL,-9.62,-12.59,0.76,0.28
0010076,Aberdeen Asian Smaller Companies Investment Trust (AAS) Ordinary 25p Share Price | AAS,-15.80,-14.10,1.17,1.40
0017505,F&C Global Smaller Companies plc (FCS) Ordinary 25p Shares Share Price | FCS,-2.76,-0.15,0.61,0.36
0019772,Jupiter Euro Opportunities Trust (JEO) Ordinary 1p Shares Share Price | JEO,-1.13,-1.56,0.99,0.39
0029362,North American Income Trust plc (NAIT) Ordinary 25p Shares Share Price | NAIT,-4.30,-7.35,0.98,1.53
0035392,City Natural Resources High Yield Trust plc (CYN) Ordinary 25p Shares Share Price | CYN,-18.72,-17.91,1.74,1.61
0038551,Biotech Growth Trust (The) (BIOG) Ordinary 25p Share Price | BIOG,-6.12,-5.19,1.10,0.27
0048583,Baillie Gifford Japan Trust plc (BGFD) Ordinary 5p Shares Share Price | BGFD,2.57,5.11,0.78,0.47
0060929,Athelney Trust (ATY) Ordinary 25p Share Price | ATY,-9.59,-7.60,2.76,8.40
0063326,Aurora Investment Trust plc (ARR) Ordinary 25p Share Price | ARR,3.35,1.56,0.54,1.82
0065311,British & American Investment Trust plc (BAF) Ordinary Shares GBP1 Share Price | BAF,69.97,95.20,7.49,12.50
0068417,SVM UK Emerging Fund plc (SVM) Ordinary 5p Share Price | SVM,-22.26,-25.34,1.26,5.15
0076700,Bankers Investment Trust plc (BNKR) Ordinary 25p Shares Share Price | BNKR,-1.02,-1.92,0.44,0.22
0081168,Independent Investment Trust plc (IIT) Ordinary 25p Share Price | IIT,11.67,7.73,0.25,2.37
0121600,Henderson Alternative Strategies Trust (HAST) Ordinary 25p Shares Share Price | HAST,-15.46,-15.01,1.06,1.08
0129756,Aberdeen Diversified Income And Growth Trust (ADIG) Ordinary 25p Share Price | ADIG,-1.92,-4.44,0.38,1.63
0132077,JPMorgan Asian Investment Trust (JAI) Ordinary 25p Share Price | JAI,-10.96,-9.32,0.73,1.08
0133508,British Empire Trust plc (BTEM) Ordinary 10p Share Price | BTEM,-9.67,-10.28,0.86,0.13
0149000,Brunner Investment Trust plc (BUT) Ordinary 25p Shares Share Price | BUT,-8.33,-10.61,0.73,1.98
0163992,Caledonia Investments plc (CLDN) Ordinary 5p Share Price | CLDN,-19.32,-17.07,1.14,0.54
0170710,Canadian General Investments (CGI) Nil Par Value (CDI) Share Price | CGI,,,,3.50
0173861,Capital Gearing Trust plc (CGT) Ordinary 25p Shares Share Price | CGT,1.66,1.69,0.86,0.50
0174002,JPMorgan Japanese Investment Trust (JFJ) Ordinary 25p Share Price | JFJ,-10.66,-9.94,0.69,0.65
0199049,City Of London Investment Trust (CTY) Ordinary 25p Shares Share Price | CTY,1.98,1.78,0.42,0.23
0225847,Manchester & London Inv Tst plc (MNL) Ordinary 25p Share Price | MNL,-4.33,-8.11,0.96,2.69
0230852,Tiger Resource Finance (TIR) Ordinary 0.1p Share Price | TIR,-40.76,-24.60,25.50,66.67
0235761,JPMorgan Mid Cap Investment Trust plc (JMF) Ordinary 25p Shares Share Price | JMF,-4.89,-8.37,0.86,0.78
0262134,Chelverton Growth Trust (CGW) Ordinary 1p Share Price | CGW,-17.13,-17.17,4.04,10.77
0263104,New Star Investment Trust plc (NSI) Ordinary 1p Share Price | NSI,-30.71,-28.31,0.90,8.77
0291633,Edinburgh Worldwide Investment Trust (EWI) Ordinary 5p Share Price | EWI,2.38,-2.11,0.87,0.45
0294502,Edinburgh Dragon Trust plc (EFM) 20p Ordinary Shares Share Price | EFM,-13.43,-12.16,1.03,0.53
0295958,Standard Life UK Smaller Companies Trust plc (SLS) Ordinary 25p Shares Share Price | SLS,-6.58,-4.38,1.08,0.40
0305233,Edinburgh Investment Trust plc (EDIN) Ordinary 25p Shares Share Price | EDIN,-9.56,-7.51,0.60,0.29
0308544,Electra Private Equity plc (ELTA) Ordinary 25p Share Price | ELTA,-15.60,-18.61,3.70,1.26
0316581,JPMorgan Japan Smaller Companies Trust plc (JPS) Ordinary 10p Share Price | JPS,-13.04,-11.31,1.31,1.36
0329200,ICG Enterprise Trust plc (ICGT) Ordinary 10p Shares Share Price | ICGT,-14.30,-15.38,1.55,0.72
0329501,European Investment Trust plc (EUT) Ordinary 25p Shares Share Price | EUT,-10.69,-10.39,0.59,0.43
0332231,Fidelity Asian Values (FAS) Ordinary 25p Share Price | FAS,-4.41,-5.08,1.29,0.73
0332855,Fidelity Japan Trust plc (FJV) Ordinary 25p Share Price | FJV,-8.72,-10.63,1.31,1.22
0338530,Worldwide Healthcare Trust plc (WWH) Ordinary 25p Share Price | WWH,0.16,0.62,1.38,0.38
0339072,Allianz Technology Trust (ATT) Ordinary 25p Share Price | ATT,0.76,-2.59,1.15,1.38
0340609,Dunedin Income Growth Investment Trust (DIG) Ordinary 25p Share Price | DIG,-10.79,-9.98,0.62,1.15
0341895,JPMorgan Emerging Markets IT plc (JMG) Ordinary 25p Share Price | JMG,-12.08,-12.20,1.07,0.23
0342218,JPMorgan Claverhouse Investment Trust plc (JCH) Ordinary 25p Share Price | JCH,-0.21,-5.53,0.79,0.51
0343501,JPMorgan Chinese Investment Trust plc (JMC) Ordinary 25p Share Price | JMC,-14.37,-12.25,1.38,2.16
0345035,JPMorgan Indian Investment Trust (JII) Ordinary 25p Share Price | JII,-14.48,-11.64,1.19,0.28
0346328,F & C Capital and Income Inv Trust (FCI) Ordinary 25p Shares Share Price | FCI,1.12,0.97,0.61,1.74
0346340,Jupiter US Smaller Companies plc (JUS) Ordinary 25p Shares Share Price | JUS,-7.66,-8.84,1.01,0.40
0346607,Foreign & Colonial Investment Trust plc (FRCL) Ordinary 25p Share Price | FRCL,-1.45,-4.68,0.53,0.29
0358572,INVESCO Income Growth Trust (IVI) Ordinary 25p Share Price | IVI,-13.79,-10.77,0.80,1.37
0365602,Witan Pacific Investment Trust (WPC) Ordinary 25p Shares Share Price | WPC,-14.74,-13.12,1.01,0.60
0370866,Troy Income & Growth Trust plc (TIGT) Ordinary 25p Share Price | TIGT,-1.66,0.25,0.94,1.28
0388728,Gresham House (GHE) Ordinary 25p Share Price | GHE,4.46,0.00,6.91,0.90
0392075,Aberdeen Japan Investment Trust plc (AJIT) Ordinary 10p Share Price | AJIT,-11.45,-11.17,1.25,1.61
0392105,HG Capital Trust plc (HGT) Ordinary 25p Share Price | HGT,-1.90,-7.73,0.42,0.53
0414850,Pantheon International (PIN) 67p Ordinary Shares Share Price | PIN,-15.07,-16.32,1.13,0.50
0419929,Henderson Eurotrust plc (HNE) Ordinary 5p Share Price | HNE,-7.43,-3.97,0.87,1.75
0422002,Polar Capital Technology Trust plc (PCT) Ordinary 25p Share Price | PCT,-2.10,-0.68,1.01,0.16
0422864,Herald Investment Trust (HRI) Ordinary 25p Share Price | HRI,-12.33,-15.23,1.08,0.77
0435594,Artemis Alpha Trust plc (ATS) Ordinary 1p Share Price | ATS,-15.13,-18.67,0.91,1.15
0453530,Invesco Asia Trust plc (IAT) Ordinary 10p Share Price | IAT,-12.07,-11.66,1.02,1.36
0454351,Montanaro European Smaller Companies Trust plc (MTE) Ordinary 50p Share Price | MTE,-13.47,-11.32,1.25,2.29
0455934,International Biotechnology Trust (IBT) Ordinary 25p Shares Share Price | IBT,-4.92,-4.08,1.49,0.67
0465825,Investment Co plc (INV) Ordinary 50p Share Price | INV,-6.99,-10.30,2.55,4.07
0482943,Acorn Income Fund (AIF) Ordinary 25p Share Price | AIF,-1.98,-4.13,2.30,1.67
0491206,Keystone Investment Trust plc (KIT) Ordinary 50p Shares Share Price | KIT,-11.97,-10.78,0.62,0.85
0505840,BlackRock Latin American Investment Trust (BRLA) Ordinary Shares $0.10 Share Price | BRLA,-14.54,-13.25,1.19,1.21
0526885,Henderson European Focus Trust plc (HEFT) Ordinary 50p Shares Share Price | HEFT,-8.04,-0.47,0.10,1.59
0532707,Blue Planet Investment Trust (BLP) Ordinary 1p Share Price | BLP,-6.33,-11.19,3.68,10.00
0536806,Lowland Investment Company plc (LWI) Ordinary 25p Shares Share Price | LWI,-7.63,-6.26,0.69,0.97
0537241,Martin Currie Global Portfolio Trust (MNP) Ordinary 5p Shares Share Price | MNP,-0.92,-0.79,0.69,1.20
0555522,Majedie Investments plc (MAJE) Ordinary 10p Shares Share Price | MAJE,-12.75,-11.08,1.07,1.72
0569512,Martin Currie Asia Unconstrained Trust plc (MCP) Ordinary 50p Shares Share Price | MCP,-12.46,-12.20,1.13,1.23
0577485,BlackRock World Mining Trust (BRWM) Ordinary 5p Share Price | BRWM,-12.03,-11.31,1.00,0.25
0577656,Dunedin Enterprise Investment Trust (DNE) Ordinary 25p Share Price | DNE,-14.65,-22.17,0.62,6.60
0580007,Merchants Trust plc (MRCH) Ordinary 25p Share Price | MRCH,-3.99,-5.35,0.58,0.75
0596286,Mithras Investment Trust plc (MTH) Ordinary 2p Share Price | MTH,-2.99,-6.46,3.43,4.69
0600756,Montanaro UK Smaller Cos Inv Tst plc (MTU) Ordinary 10p Share Price | MTU,-19.72,-19.11,1.24,1.35
0603959,Standard Life Equity Income Trust Plc (SLET) Ordinary 25p Shares Share Price | SLET,-0.34,-3.06,0.88,0.81
0604877,Aberdeen New India Investment Trust (ANII) Ordinary 25p Share Price | ANII,-14.60,-11.93,1.30,1.09
0610841,Schroder UK Mid Cap Fund (SCP) Ordinary 25p Share Price | SCP,-14.56,-16.04,0.93,0.70
0611112,Murray Income Trust plc (MUT) Ordinary 25p Shares Share Price | MUT,-8.90,-8.20,0.72,1.01
0611190,Murray International Trust plc (MYI) Ordinary 25p Shares Share Price | MYI,0.50,2.61,0.64,0.34
0643610,BlackRock Smaller Companies Trust (BRSC) Ordinary 25p Shares Share Price | BRSC,-7.19,-11.77,0.93,1.33
0643900,North Atlantic Smaller Cos Inv Tst (NAS) Ordinary 5p Share Price | NAS,-22.04,-20.79,1.60,0.71
0661582,Chelverton Small Companies Dividend Trust plc (SDV) Ordinary 25p Share Price | SDV,1.59,-0.33,2.00,2.28
0666747,Pacific Horizon Investment Trust plc (PHI) Ordinary 10p Shares Share Price | PHI,2.44,-6.38,1.07,0.77
0667438,Pacific Assets Trust (PAC) Ordinary 12.5p Share Price | PAC,-7.32,-3.07,1.25,1.89
0679842,Perpetual Income & Growth Inv Tst (PLI) Ordinary 10p Share Price | PLI,-10.76,-8.73,0.65,0.41
0682754,Personal Assets Trust plc (PNL) GBP12.50 Ordinary Shares Share Price | PNL,1.53,1.20,0.95,0.25
0736639,RIT Capital Partners plc (RCP) Ordinary GBP1 Share Price | RCP,7.95,6.27,1.05,0.24
0739207,Rights & Issues Investment Trust plc (RIII) Inc 25p Share Price | RIII,-9.05,-10.12,0.45,0.45
0741600,JPMorgan Smaller Companies Investment Trust (JMI) Ordinary 25p Shares Share Price | JMI,-13.29,-17.08,1.12,1.62
0781606,Finsbury Growth & Income Trust plc (FGT) Ordinary 25p Shares Share Price | FGT,0.87,0.60,0.71,0.12
0782609,Scottish Investment Trust plc (SCIN) Ordinary 25p Shares Share Price | SCIN,-8.87,-8.75,0.47,0.12
0783613,Scottish Oriental Smaller Cos Trust (SST) Ordinary 25p Share Price | SST,-14.68,-11.49,1.18,0.99
0787369,Scottish American Investment Co plc (SCAM) Ordinary 25p Shares Share Price | SCAM,3.31,4.35,0.80,1.07
0787972,Hansa Trust plc (HAN) Ordinary 5p Share Price | HAN,-28.65,-27.68,1.09,2.97
0787983,Hansa Trust plc (HANA) A Non Voting Ordinary 5p Share Price | HANA,-29.55,-29.22,1.09,2.51
0791348,Schroder UK Growth Fund (SDU) Ordinary 25p Share Price | SDU,-7.07,-11.80,0.63,1.01
0791586,Schroder Income Growth Fund (SCF) Ordinary 10p Share Price | SCF,-9.32,-7.82,0.95,0.99
0791887,Schroder Asia Pacific Fund (SDP) Ordinary 10p Share Price | SDP,-11.03,-10.78,0.99,0.21
0802284,Schroder Japan Growth Fund (SJG) Ordinary 10p Share Price | SJG,-9.17,-7.04,1.00,1.36
0805250,Shires Income (SHRS) Ordinary 50p Shares Share Price | SHRS,-4.11,-4.78,1.04,0.74
0806372,Aberdeen Smaller Companies Income Trust plc (ASCI) Ordinary 50p Share Price | ASCI,-14.41,-16.10,1.39,3.02
0848471,Value & Income Trust plc (VIN) Ordinary 10p Shares Share Price | VIN,-20.24,-16.54,1.42,2.19
0852814,JPMorgan Elect Plc (JPE) Managed Growth Shares 0.00429578p Share Price | JPE,-1.70,-2.41,0.55,1.76
0853657,Henderson Opportunities Trust Plc (HOT) Ordinary 25p Share Price | HOT,-16.39,-17.35,1.88,1.86
0871079,Schroder Asian Total Return Investment Company plc (ATR) Ordinary 5p Share Price | ATR,2.30,0.77,2.68,1.07
0876999,Seneca Global Income & Growth Trust plc (SIGT) Ordinary 25p Share Price | SIGT,2.00,1.31,1.59,1.14
0882532,Temple Bar Investment Trust plc (TMPL) Ordinary 25p Shares Share Price | TMPL,-6.08,-5.05,0.49,0.30
0882929,Templeton Emerging Markets Inv Tst plc (TEM) Ordinary 25p Share Price | TEM,-15.08,-12.27,1.21,0.27
0891055,BlackRock Throgmorton Trust plc (THRG) Ordinary 5p Shares Share Price | THRG,-9.92,-14.31,2.16,0.72
0906409,TR Property Investment Trust plc (TRY) Ordinary 25p Share Price | TRY,-1.16,-4.33,0.87,0.12
0906506,Henderson Smaller Cos Investment Trust plc (HSL) Ordinary 25p Shares Share Price | HSL,-7.31,-12.51,1.01,1.23
0906692,TR European Growth Trust (TRG) Ordinary 12.5p Share Price | TRG,-11.00,-3.57,1.55,0.39
0958057,Henderson High Income Trust plc (HHI) Ordinary 5p Shares Share Price | HHI,-4.47,-1.07,0.75,0.82
0974406,Witan Investment Trust (WTAN) Ordinary 25p Share Price | WTAN,-1.09,-2.01,0.86,0.18
0981536,Lazard World Trust Fund (WTR) Shs USD0.20 Share Price | WTR,-4.03,-7.95,1.35,2.56
3047468,Standard Life Private Equity Trust plc (SLPE) Ordinary 0.002 Share Price | SLPE,-16.08,-13.01,1.17,1.19
3051726,Monks Investment Trust (MNKS) Ordinary 5p Share Price | MNKS,2.69,1.32,0.59,0.24
3073827,F & C Private Equity Trust (FPEO) Ordinary 1p Share Price | FPEO,2.04,-2.83,2.00,0.85
3096169,BlackRock Income & Growth Investment Trust plc (BRIG) Ordinary 1p Share Price | BRIG,-5.07,-2.68,1.08,1.90
3123249,Impax Environmental Markets plc (IEM) Ordinary 10p Share Price | IEM,-4.59,-8.31,1.05,1.47
3133691,Establishment Investment Trust (The) (ET.) Ordinary 25p Share Price | ET.,-15.98,-17.52,1.22,2.83
3142921,Law Debenture Corporation (LWDB) Ordinary 5p Share Price | LWDB,-11.29,-8.93,0.43,0.65
3197794,Lindsell Train Investment Trust plc (The) (LTI) Ordinary 75p Share Price | LTI,34.02,22.08,3.68,0.95
3216473,JPMorgan Russian Securities (JRS) Ordinary 1p Share Price | JRS,-15.31,-15.41,1.26,0.77
3227334,Baring Emerging Europe (BEE) Ordinary 10p Share Price | BEE,-13.55,-11.63,1.42,0.82
3353790,Premier Global Infrastructure plc (PGIT) Ordinary 1p Share Price | PGIT,-5.48,-9.03,7.01,2.21
3369872,Conygar Investment Company plc (CIC) Ordinary 5p Share Price | CIC,-11.21,0.00,7.54,4.65
3386257,EP Global Opportunities Trust (EPG) Ord GBP0.01 Share Price | EPG,-5.97,-5.81,0.92,1.58
3408009,JPMorgan Elect Plc (JPEC) Managed Cash Shares 0.01p Share Price | JPEC,-1.57,-1.34,0.02,4.85
3408021,JPMorgan Elect Plc (JPEI) Managed Income Shares 0.003p Share Price | JPEI,-1.59,-2.61,0.71,3.36
3436594,Miton Global Opportunities plc (MIGO) Ord 1p Share Price | MIGO,0.66,-0.41,1.34,1.06
B018CS4,Ruffer Investment Co Ltd (RICA) Red Ptg Preference Shares Share Price | RICA,2.32,2.14,1.16,0.43
B01RDH7,BlackRock Greater Europe Investment Trust (BRGE) Ord 0.1p Shares Share Price | BRGE,-6.23,-4.56,1.10,1.72
B05NYM3,INVESCO Perpetual Enhanced Income Limited (IPE) Ordinary 5p Share Price | IPE,-0.66,4.59,2.16,2.45
B06CZD7,Energiser Investments Plc (ENGI) Ord 0.1p Share Price | ENGI,-19.58,12.74,6.94,23.08
B06GJ37,Dolphin Capital Investors Ltd (DCI) Common Shares EUR0.01 Share Price | DCI,-62.03,-67.50,0.00,5.41
B08N4M0,Livermore Investments Group Ltd (LIV) Ord NPV Share Price | LIV,-45.77,-31.85,3.68,6.54
B08S4K3,Northern Investors Company (NRI) Ord 25p Share Price | NRI,-3.49,7.39,5.75,5.22
B09G3N2,Securities Trust of Scotland (STS) Ord Red 1p Share Price | STS,-7.75,-6.67,0.96,0.58
B0BDCB2,Strategic Equity Capital plc (SEC) Ordinary GBP 0.10 Share Price | SEC,-15.87,-13.57,2.42,0.44
B0BN1P9,BlackRock Emerging Europe plc (BEEP) Ordinary USD0.10 Share Price | BEEP,-5.40,-6.39,1.16,1.78
B0CRWN5,Schroder Oriental Income Fund (SOI) Ordinary 1p Share Price | SOI,-1.07,0.82,1.95,1.53
B0HW536,Real Estate Credit Investments Ltd (RECI) Ord NPV Share Price | RECI,0.86,2.19,2.29,0.61
B0LCW20,Picton Property Income Limited (PCTN) Ord NPV Share Price | PCTN,0.08,-3.83,2.47,0.44
B0N8MF9,BlackRock Commodities Income Investment Trust (BRCI) Ordinary 1p Share Price | BRCI,-8.29,-4.73,1.36,0.97
B0P6J83,Aberdeen Asian Income Fund (AAIF) Ordinary NPV Shares Share Price | AAIF,-10.14,-7.59,1.09,0.93
B0P8RJ6,India Capital Growth Fund Ltd (IGC) Ord GBp0.01 Share Price | IGC,-17.60,-13.84,2.21,2.03
B0T4LH6,HICL Infrastructure Company Ltd (HICL) Ordinary GBP 0.0001 Share Price | HICL,-4.69,-3.03,1.18,0.14
B0XLRJ7,B.P Marsh & Partners (BPM) Ord GBP0.10 Share Price | BPM,-11.51,-23.85,3.51,2.14
B11V7W9,Alliance Trust plc (ATST) Ordinary 2.5p Shares Share Price | ATST,-6.15,-5.64,0.62,0.27
B120GL7,Jupiter Green Investment Trust (JGC) Ord Shares GBP0.1 Share Price | JGC,-5.25,-4.80,1.57,1.55
B12MHD2,LMS Capital plc (LMS) Ordinary 10p Share Price | LMS,-36.22,-35.02,3.85,3.14
B13VDP2,Alpha Real Trust Limited (ARTL) ORD NPV Share Price | ARTL,-24.71,-21.87,10.81,4.62
B13YVW4,Highbridge Multi-Strategy Fund Limited (HMSF) Ordinary NPV GBP Share Price | HMSF,0.64,-0.96,0.31,0.66
B1436N6,Macau Property Opportunities Fund (MPO) Ord Usd0.01 Share Price | MPO,-26.38,-28.77,5.03,4.55
B15FW33,Geiger Counter Ltd (GCL) NPV Share Price | GCL,10.45,2.37,3.12,2.44
B15PV03,Middlefield Canadian Inc - GBP PC (MCT) Part Pref Shs Npv Share Price | MCT,-12.18,-10.76,1.24,2.04
B17XWW4,JPMorgan European Investment Trust (JETI) 2.06155p Income Shares Share Price | JETI,-10.28,-8.12,1.10,2.78
B188SR5,International Public Partnerships Limited (INPP) Ord GBP0.01 Share Price | INPP,1.18,8.51,1.14,0.14
B18JK16,JPMorgan European Investment Trust (JETG) 3.97p Growth Shares Share Price | JETG,-9.72,-8.88,1.07,0.32
B19Z2J5,UK Commercial Property Trust (UKCM) Ordinary 25p Shares Share Price | UKCM,-5.93,-1.84,1.93,0.12
B1DPVL6,Invesco Perpetual Select Trust (IVPU) UK Equity Shares 1p Share Price | IVPU,-1.33,-1.35,1.38,3.17
B1DQ647,Invesco Perpetual Select Trust (IVPG) Global Equity Income Shares 1p Share Price | IVPG,-2.52,-1.17,0.98,3.85
B1DQ669,Invesco Perpetual Select Trust (IVPB) Balanced Risk Shares 1p Share Price | IVPB,-2.14,-1.25,1.20,3.52
B1DQ670,Invesco Perpetual Select Trust (IVPM) Managed Liquidity Shares 1p Share Price | IVPM,-1.44,-1.41,0.40,1.94
B1DVQL9,MedicX Fund Ltd (MXF) Ord Npv Share Price | MXF,16.08,27.13,3.47,0.50
B1FL3C7,Invesco Perpetual UK Smaller Cos Inv Tst (IPU) Ord 20p Share Price | IPU,-5.10,-5.24,2.03,1.53
B1G9T99,Golden Prospect Precious Metals Ltd (GPM) Ord Gbp0.001 Share Price | GPM,-24.67,-16.32,3.16,3.69
B1GCL25,Dunedin Smaller Companies Investment Trust (DNDL) Ordinary 5p Share Price | DNDL,-18.31,-17.64,1.36,2.11
B1GJQ98,Global Fixed Income Realisation Ltd (GFIR) Ordinary NPV GBP Share Price | GFIR,-37.03,-46.70,2.48,20.00
B1GXH75,Henderson Far East Income Ltd (HFEL) Ordinary NPV Share Price | HFEL,1.14,1.77,1.12,0.79
B1LZS51,CQS New City High Yield Fund Ltd (NCYF) Ord NPV Share Price | NCYF,4.89,5.47,1.21,1.63
B1N4G29,F&C UK High Income Trust (FHI) Ordinary 0.1p Shares Share Price | FHI,-7.18,-6.98,1.09,1.89
B1N4H59,F&C UK High Income Trust (FHIB) Ordinary 0.1p B Shares Share Price | FHIB,-6.29,-6.88,1.09,1.87
B1N4H93,F&C UK High Income Trust (FHIU) Units (3 Ord 0.1p Shares and 1 Ord B Share) Share Price | FHIU,-8.50,-6.99,1.02,1.91
B1NNWQ2,Cambium Global Timberland Ltd (TREE) Ord NPV Share Price | TREE,-43.03,-54.72,0.20,3.59
B1NP514,BH Macro Ltd (GBP) (BHMG) Ord NPV Share Price | BHMG,-9.21,-8.91,4.75,0.72
B1NPGV1,BH Macro Ltd (USD) (BHMU) Ordinary NPV Share Price | BHMU,-9.01,-6.57,4.75,2.83
B1W59J1,Aberdeen Frontier Markets Investment Company Ltd (AFMC) Ordinary NPV Share Price | AFMC,-10.15,-8.21,2.01,1.71
B1XH2B9,Dragon Ukrainian Properties & Development plc (DUPD) Ordinary 1p Share Price | DUPD,-57.74,-58.04,5.08,20.14
B1YQ6R9,Third Point Offshore Investors Ltd (TPOG) Ordinary NPV GBP Share Price | TPOG,-14.77,-15.52,7.27,1.91
B1YQ721,Third Point Offshore Investors Ltd (TPOU) Ordinary NPV USD Share Price | TPOU,-15.34,-11.92,7.27,0.90
B1YW440,3i Group Plc (III) Ordinary 73 19/22p Share Price | III,30.24,31.67,1.79,0.04
B1Z2SL4,Crystal Amber Fund Ltd (CRS) Ordinary 1p Share Price | CRS,-9.29,-2.41,3.08,4.39
B23DL39,Oakley Capital Investments Ltd (OCI) Ordinary 1p Share Price | OCI,-24.45,-30.51,1.34,1.35
B28Y104,Volta Finance Ltd (VTA) NPV Share Price | VTA,,,,1.73
B28ZZS3,Tetragon Financial Group Ltd (TFG) USD0.001 Share Price | TFG,,,,0.39
B28ZZX8,NB Private Equity Partners Ltd (NBPE) Ordinary USD0.01 Share Price | NBPE,-23.74,-18.69,2.85,0.99
B29LSW5,Juridica Investments LD (JIL) Ord NPV Share Price | JIL,-22.66,-43.03,7.36,2.25
B2PP252,F&C Managed Portfolio Trust plc (FMPG) Growth Shares 10p Share Price | FMPG,1.69,1.12,0.95,1.89
B2PP3J3,F&C Managed Portfolio Trust Plc (FMPI) Income Shares 10p Share Price | FMPI,2.25,1.62,1.10,2.14
B2QQPS8,BH Global Ltd (BHGU) Ordinary Shares USD NPV Share Price | BHGU,-6.58,-6.15,3.04,2.08
B2QQPT9,BH Global Ltd (BHGG) Ord GBP NPV Share Price | BHGG,-7.12,-8.24,3.04,0.70
B39VMM0,Boussard & Gavaudan Holding Ltd (BGHS) Ord Eur0.0001 (Stg) Share Price | BGHS,-16.89,-17.77,2.98,9.34
B3BTVQ9,Oryx International Growth Fund (OIG) Ordinary 50p Share Price | OIG,-13.05,-16.70,1.65,1.83
B3KX4Q3,NB Global Floating Rate Income Fund Ltd (NBLS) Redeemable Ordinary NPV GBP Share Price | NBLS,-2.39,-3.02,0.92,0.11
B3P7S35,NB Global Floating Rate Income Fund Ltd (NBLU) Redeemable Ordinary NPV USD Share Price | NBLU,-3.18,-2.16,0.92,0.00
B3PHCS8,Henderson International Income Trust plc (HINT) Ord GBP0.01 Share Price | HINT,1.43,0.94,0.90,1.20
B3SXM83,BlackRock Frontiers Investment Trust (BRFI) Ordinary 1p Share Price | BRFI,2.84,3.05,1.64,1.30
B3Z6252,Doric Nimrod Air Two Ltd (DNA2) Ordinary Preference NPV Share Price | DNA2,23.77,25.11,14.20,1.92
B403HK5,JZ Capital Partners Ltd (JZCP) Ordinary NPV Shares Share Price | JZCP,-36.14,-32.09,4.78,1.71
B44ZTP6,Aberdeen Latin American Income Fund (ALAI) Ord NPV Share Price | ALAI,-15.55,-12.90,1.99,2.55
B45L2K9,Aberdeen Emerging Markets Investment Company Ltd (AEMC) Ordinary 1p Shares Share Price | AEMC,-13.56,-12.47,1.08,0.32
B4L0PD4,Genesis Emerging Markets Fund Ltd (GSS) Ptg NPV Share Price | GSS,-13.46,-12.72,1.43,0.28
B4MF389,Doric Nimrod Air One Ltd (DNA) Ordinary Preference NPV Share Price | DNA,0.40,6.17,1.37,4.81
B4MFKH7,LXB Retail Properties Plc (LXB) Ord NPV Share Price | LXB,-23.95,-4.73,99.00,3.93
B4N1RV7,Better Capital PCC Ltd (BC12) Ordinary GBP1.00 (2012) Share Price | BC12,-45.99,-25.04,0.28,4.00
B4ZPCJ0,F&C Commercial Property Trust Ltd (FCPT) Ord 1p Share Price | FCPT,1.76,1.09,1.22,0.14
B4ZWPH0,John Laing Infrastructure Fund Ltd (JLIF) Ord GBP0.0001 Share Price | JLIF,-3.52,-0.23,1.48,0.17
B5ZZY91,JPMorgan Global Emerging Markets Income Trust (JEMI) Ord 1p Share Price | JEMI,-6.57,-3.19,1.30,1.18
B602HS4,JPMorgan Brazil Investment Trust (JPB) Ordinary 1p Share Price | JPB,-16.04,-14.64,1.99,4.35
B6116N8,Alcentra European Floating Rate Income Fund (AEFS) Red Ord Npv Gbp Share Price | AEFS,-5.25,-4.53,0.98,0.60
B6173J1,GCP Infrastructure Investments Ltd (GCP) Ordinary 1p Share Price | GCP,8.06,13.32,1.09,0.33
B61ND55,Atlantis Japan Growth Fund (AJG) Ordinary NPV Share Price | AJG,-10.56,-8.26,1.53,1.68
B62Z3C7,Fidelity China Special Situations PLC (FCSS) Ordinary Shares 1p Share Price | FCSS,-13.43,-13.18,1.16,0.38
B65TLW2,Diverse Income Trust plc (The) (DIVI) Ordinary 0.1p Share Price | DIVI,1.65,-0.84,1.17,1.83
B6686L2,Baker Steel Resources Trust Ltd (BSRT) Ord Npv Share Price | BSRT,-21.21,-19.63,2.16,8.09
B6832P1,Polar Capital Global Healthcare Trust plc (PCGH) Ordinary 25p Shares Share Price | PCGH,-7.67,-2.55,1.50,0.75
B6QWXM4,BBGI Sicav SA (BBGI) Ord NPV (DI) Share Price | BBGI,5.79,10.10,1.28,1.12
B6RMDP6,City Merchants High Yield Trust Ltd (CMHY) Ordinary NPV Share Price | CMHY,2.56,0.54,1.03,0.52
B6T0TM7,,,,,0.52
B6VTTK0,Mid Wynd International Investment Trust Plc (MWY) ORD GBP0.05 Share Price | MWY,4.46,1.43,0.67,0.96
B6WC674,Secure Property Development & Investment plc (SPDI) Ordinary EUR0.01 Share Price | SPDI,0.00,0.00,6.43,23.08
B6YVTS1,City Natural Resources High Yield Trust plc (CYNC) 3.5% Convertible Unsecured Loan Stock Share Price | CYNC,,,,1.98
B79WC10,Starwood European Real Estate Fin Ltd (SWEF) Ordinary NPV Share Price | SWEF,4.46,7.17,1.21,0.93
B7VSCF0,All Asia Asset Capital Limited (AAA) Ordinary NPV Share Price | AAA,272.34,272.34,6.07,44.44
B7W0XJ6,Blackrock North American Income Trust plc (BRNA) Ord 1p Shares Share Price | BRNA,-1.98,-6.29,1.08,1.77
B8C23S8,ICG-Longbow Senior Secured UK Property Debt Invest (LBOW) Ordinary NPV Share Price | LBOW,3.65,2.22,1.98,1.43
B8P59C0,Syncona Limited (SYNC) Ordinary NPV Share Price | SYNC,43.66,24.95,1.45,0.22
B8SC6K5,Greencoat UK Wind plc (UKW) Ordinary 1p Share Price | UKW,6.78,8.87,1.94,0.16
B90J5Z9,Twentyfour Income Fund Ltd (TFIF) Ordinary GBP 0.01 Share Price | TFIF,1.35,2.22,1.01,1.26
B92LHN5,Doric Nimrod Air Three Ltd (DNA3) Ordinary Preference Shares NPV Share Price | DNA3,49.53,41.73,0.81,1.98
B96SW59,JPMorgan Global Convertibles Income Fund Limited (JGCI) Ordinary NPV Share Price | JGCI,-2.60,-2.20,0.99,0.21
B986V54,Adams Plc (ADA) Ordinary Eur0.01 Share Price | ADA,53.58,92.04,88.27,50.00
B99R1Q7,Inland ZDP plc (INLZ) Zero Dividend Preference Shares 2019 10p Share Price | INLZ,0.00,0.00,7.41,2.63
B9MRHZ5,CVC Credit Partners European Opportunities Ltd (CCPG) Ordinary NPV GBP Share Price | CCPG,-2.02,0.84,0.59,1.35
B9XQT11,Polar Capital Global Financials Trust (PCFT) Ordinary Shares Share Price | PCFT,-5.40,-4.93,1.00,0.73
BB0RDB9,Bluefield Solar Income Fund Limited (BSIF) Ordinary Shares NPV Share Price | BSIF,9.38,5.83,1.12,0.84
BBHX2H9,The Renewables Infrastructure Group Limited (TRIG) Ordinary Shares NPV Share Price | TRIG,4.93,8.59,0.08,0.19
BBM56V2,Aberdeen New Dawn Investment Trust plc (ABD) Ordinary 5p Shares Share Price | ABD,-13.58,-12.75,0.93,1.24
BCDP4K3,Taliesin Property Fund (TPFZ) Redeemable Zero Dividend Preference GBP1 Share Price | TPFZ,1.27,0.00,10.06,1.41
BCKFVJ4,Global Resources Investment Trust plc (GRIT) Ordinary Shares 1p Share Price | GRIT,-48.37,-42.48,12.76,10.48
BD0BSY3,European Assets Trust (EAT) EUR0.10 Share Price | EAT,-3.52,1.04,1.06,1.19
BD0FRW6,NB Private Equity Partners Ltd (NBPP) 2022 Zero Dividend Preference Shares Share Price | NBPP,6.16,0.00,2.85,0.88
BD2YGN5,UIL Finance Limited ZDP 2022 (UTLF) RED ZERO DIV PREF 31/10/2022 GBP 0.0531 Share Price | UTLF,10.72,12.24,1.55,1.59
BD3QJR5,Foresight Solar Fund Ltd (FSFL) Ordinary NPV Share Price | FSFL,2.47,3.46,1.17,0.92
BD45S96,Utilico Emerging Markets Trust plc (UEM) Ordinary GBP 0.01 Share Price | UEM,-10.24,-11.99,2.82,0.36
BD9PXH4,Aberdeen Standard European Logistics Income (ASLI) Ordinary Shares Share Price | ASLI,7.85,2.03,0.00,0.95
