epic,desc,pd,pd12,charge,spread
0005997,Aberdeen New Thai Investment Trust plc (ANW) Ordinary 25p Shares Share Price | ANW,-15.06,-15.39,1.41,2.11
0006655,Aberforth Smaller Companies Trust (ASL) Ordinary 1p Shares Share Price | ASL,-11.20,-12.71,0.76,0.15
0010076,Aberdeen Asian Smaller Companies Investment Trust (AAS) Ordinary 25p Share Price | AAS,-12.42,-14.01,1.17,0.49
0017505,F&C Global Smaller Companies plc (FCS) Ordinary 25p Shares Share Price | FCS,-2.17,0.18,0.61,0.76
0019772,Jupiter Euro Opportunities Trust (JEO) Ordinary 1p Shares Share Price | JEO,-2.24,-2.03,0.99,0.28
0029362,North American Income Trust plc (NAIT) Ordinary 25p Shares Share Price | NAIT,-7.32,-7.72,1.05,1.23
0035392,City Natural Resources High Yield Trust plc (CYN) Ordinary 25p Shares Share Price | CYN,-16.50,-17.31,1.74,2.20
0038551,Biotech Growth Trust (The) (BIOG) Ordinary 25p Share Price | BIOG,-5.22,-5.33,1.10,0.58
0048583,Baillie Gifford Japan Trust plc (BGFD) Ordinary 5p Shares Share Price | BGFD,3.66,5.19,0.78,0.37
0060929,Athelney Trust (ATY) Ordinary 25p Share Price | ATY,-5.45,-7.37,2.76,7.75
0063326,Aurora Investment Trust plc (ARR) Ordinary 25p Share Price | ARR,0.75,1.56,0.80,0.97
0065311,British & American Investment Trust plc (BAF) Ordinary Shares GBP1 Share Price | BAF,105.37,108.93,6.63,13.33
0068417,SVM UK Emerging Fund plc (SVM) Ordinary 5p Share Price | SVM,-18.53,-26.43,1.26,4.30
0070627,Baillie Gifford Shin Nippon plc (BGS) Ordinary 10p Shares Share Price | BGS,11.01,6.62,0.96,0.41
0076700,Bankers Investment Trust plc (BNKR) Ordinary 25p Shares Share Price | BNKR,-0.17,-2.46,0.44,0.24
0081168,Independent Investment Trust plc (IIT) Ordinary 25p Share Price | IIT,16.17,4.72,0.25,1.67
0121600,Henderson Alternative Strategies Trust (HAST) Ordinary 25p Shares Share Price | HAST,-18.03,-14.66,1.06,1.10
0129756,Aberdeen Diversified Income And Growth Trust (ADIG) Ordinary 25p Share Price | ADIG,-3.73,-5.04,0.23,1.23
0132077,JPMorgan Asian Investment Trust (JAI) Ordinary 25p Share Price | JAI,-10.29,-9.28,0.73,0.85
0133508,British Empire Trust plc (BTEM) Ordinary 10p Share Price | BTEM,-10.01,-10.42,0.86,0.29
0149000,Brunner Investment Trust plc (BUT) Ordinary 25p Shares Share Price | BUT,-7.47,-10.98,0.73,1.60
0163992,Caledonia Investments plc (CLDN) Ordinary 5p Share Price | CLDN,-17.87,-16.78,1.14,0.19
0170710,Canadian General Investments (CGI) Nil Par Value (CDI) Share Price | CGI,,,,2.99
0173861,Capital Gearing Trust plc (CGT) Ordinary 25p Shares Share Price | CGT,1.87,1.66,0.86,1.03
0174002,JPMorgan Japanese Investment Trust (JFJ) Ordinary 25p Share Price | JFJ,-6.43,-10.40,0.69,0.45
0199049,City Of London Investment Trust (CTY) Ordinary 25p Shares Share Price | CTY,2.05,1.77,0.42,0.24
0225847,Manchester & London Inv Tst plc (MNL) Ordinary 25p Share Price | MNL,-3.81,-9.44,0.96,1.57
0230852,Tiger Resource Finance (TIR) Ordinary 0.1p Share Price | TIR,-33.84,-22.01,32.18,66.67
0235761,JPMorgan Mid Cap Investment Trust plc (JMF) Ordinary 25p Shares Share Price | JMF,-3.77,-9.29,0.86,1.24
0262134,Chelverton Growth Trust (CGW) Ordinary 1p Share Price | CGW,-16.98,-16.32,4.04,10.14
0263104,New Star Investment Trust plc (NSI) Ordinary 1p Share Price | NSI,-26.41,-28.55,0.90,8.77
0291633,Edinburgh Worldwide Investment Trust (EWI) Ordinary 5p Share Price | EWI,1.03,-3.53,0.87,0.53
0294502,Edinburgh Dragon Trust plc (EFM) 20p Ordinary Shares Share Price | EFM,-12.56,-12.13,1.04,0.27
0295958,Standard Life UK Smaller Companies Trust plc (SLS) Ordinary 25p Shares Share Price | SLS,-2.34,-4.66,1.08,1.21
0305233,Edinburgh Investment Trust plc (EDIN) Ordinary 25p Shares Share Price | EDIN,-8.18,-6.95,0.60,0.30
0308544,Electra Private Equity plc (ELTA) Ordinary 25p Share Price | ELTA,-25.94,-12.33,3.70,0.48
0316581,JPMorgan Japan Smaller Companies Trust plc (JPS) Ordinary 10p Share Price | JPS,-11.42,-11.36,1.31,0.47
0322566,European Assets Trust Nv (EAT) EUR 0.46 (Regd) Share Price | EAT,1.10,0.72,1.06,1.61
0329200,ICG Enterprise Trust plc (ICGT) Ordinary 10p Shares Share Price | ICGT,-12.57,-15.38,1.28,0.75
0329501,European Investment Trust plc (EUT) Ordinary 25p Shares Share Price | EUT,-10.86,-10.54,0.59,1.55
0332231,Fidelity Asian Values (FAS) Ordinary 25p Share Price | FAS,-3.89,-4.92,1.29,1.02
0332855,Fidelity Japanese Values plc (FJV) Ordinary 25p Share Price | FJV,-14.29,-11.41,1.46,1.02
0338530,Worldwide Healthcare Trust plc (WWH) Ordinary 25p Share Price | WWH,0.84,0.52,1.38,0.21
0339072,Allianz Technology Trust (ATT) Ordinary 25p Share Price | ATT,3.67,-3.44,1.15,1.20
0340609,Dunedin Income Growth Investment Trust (DIG) Ordinary 25p Share Price | DIG,-10.28,-9.91,0.65,1.20
0341895,JPMorgan Emerging Markets IT plc (JMG) Ordinary 25p Share Price | JMG,-11.81,-12.28,1.07,0.24
0342218,JPMorgan Claverhouse Investment Trust plc (JCH) Ordinary 25p Share Price | JCH,-1.52,-6.02,0.79,0.83
0343501,JPMorgan Chinese Investment Trust plc (JMC) Ordinary 25p Share Price | JMC,-14.04,-12.24,1.38,2.68
0345035,JPMorgan Indian Investment Trust (JII) Ordinary 25p Share Price | JII,-12.15,-11.21,1.19,0.43
0346328,F & C Capital and Income Inv Trust (FCI) Ordinary 25p Shares Share Price | FCI,1.78,0.90,0.61,1.56
0346340,Jupiter US Smaller Companies plc (JUS) Ordinary 25p Shares Share Price | JUS,-8.06,-8.87,1.01,0.69
0346607,Foreign & Colonial Investment Trust plc (FRCL) Ordinary 25p Share Price | FRCL,-2.25,-5.47,0.53,0.32
0358572,INVESCO Income Growth Trust (IVI) Ordinary 25p Share Price | IVI,-12.58,-10.58,0.80,0.73
0365602,Witan Pacific Investment Trust (WPC) Ordinary 25p Shares Share Price | WPC,-14.10,-12.90,0.88,0.94
0370866,Troy Income & Growth Trust plc (TIGT) Ordinary 25p Share Price | TIGT,-0.18,0.36,0.94,1.86
0388728,Gresham House (GHE) Ordinary 25p Share Price | GHE,4.46,0.00,6.91,0.98
0392075,Aberdeen Japan Investment Trust plc (AJIT) Ordinary 10p Share Price | AJIT,-12.57,-11.37,1.25,0.84
0392105,HG Capital Trust plc (HGT) Ordinary 25p Share Price | HGT,-5.45,-7.79,0.42,0.84
0414850,Pantheon International (PIN) 67p Ordinary Shares Share Price | PIN,-12.78,-16.86,1.13,0.53
0419929,Henderson Eurotrust plc (HNE) Ordinary 5p Share Price | HNE,-6.23,-3.65,0.87,0.90
0422002,Polar Capital Technology Trust plc (PCT) Ordinary 25p Share Price | PCT,-2.65,-0.37,1.01,0.36
0422864,Herald Investment Trust (HRI) Ordinary 25p Share Price | HRI,-14.97,-16.14,1.08,0.43
0435594,Artemis Alpha Trust plc (ATS) Ordinary 1p Share Price | ATS,-19.95,-19.08,0.91,3.08
0453530,Invesco Asia Trust plc (IAT) Ordinary 10p Share Price | IAT,-12.85,-11.58,1.02,1.08
0454351,Montanaro European Smaller Companies Trust plc (MTE) Ordinary 50p Share Price | MTE,-12.28,-11.08,1.25,1.26
0455934,International Biotechnology Trust (IBT) Ordinary 25p Shares Share Price | IBT,-3.67,-4.29,1.49,2.86
0465825,Investment Co plc (INV) Ordinary 50p Share Price | INV,-13.76,-10.06,2.55,4.91
0482943,Acorn Income Fund (AIF) Ordinary 25p Share Price | AIF,-6.37,-4.98,1.63,2.33
0491206,Keystone Investment Trust plc (KIT) Ordinary 50p Shares Share Price | KIT,-11.76,-10.58,0.62,0.59
0505840,BlackRock Latin American Investment Trust (BRLA) Ordinary Shares $0.10 Share Price | BRLA,-13.21,-13.11,1.19,1.48
0526885,Henderson European Focus Trust plc (HEFT) Ordinary 50p Shares Share Price | HEFT,-4.57,0.11,0.87,1.61
0532707,Blue Planet Investment Trust (BLP) Ordinary 1p Share Price | BLP,-5.29,-12.46,3.68,8.16
0536806,Lowland Investment Company plc (LWI) Ordinary 25p Shares Share Price | LWI,-6.15,-6.13,0.69,1.34
0537241,Martin Currie Global Portfolio Trust (MNP) Ordinary 5p Shares Share Price | MNP,-0.72,-0.72,0.69,0.43
0555522,Majedie Investments plc (MAJE) Ordinary 10p Shares Share Price | MAJE,-8.35,-10.69,1.09,2.41
0569512,Martin Currie Asia Unconstrained Trust plc (MCP) Ordinary 50p Shares Share Price | MCP,-12.92,-12.19,1.13,1.55
0577485,BlackRock World Mining Trust (BRWM) Ordinary 5p Share Price | BRWM,-11.45,-11.36,1.00,0.67
0577656,Dunedin Enterprise Investment Trust (DNE) Ordinary 25p Share Price | DNE,-15.53,-23.52,2.66,3.24
0579403,Mercantile Investment Trust Plc (MRC) Ordinary 25p Shares Share Price | MRC,-9.11,-9.67,0.50,0.24
0580007,Merchants Trust plc (MRCH) Ordinary 25p Share Price | MRCH,-3.58,-5.41,0.58,0.40
0596286,Mithras Investment Trust plc (MTH) Ordinary 2p Share Price | MTH,2.39,-8.26,3.43,5.38
0600756,Montanaro UK Smaller Cos Inv Tst plc (MTU) Ordinary 10p Share Price | MTU,-19.16,-19.21,1.24,1.43
0603959,Standard Life Equity Income Trust Plc (SLET) Ordinary 25p Shares Share Price | SLET,-0.25,-3.66,0.88,1.30
0604877,Aberdeen New India Investment Trust (ANII) Ordinary 25p Share Price | ANII,-13.72,-11.39,1.30,1.59
0610841,Schroder UK Mid Cap Fund (SCP) Ordinary 25p Share Price | SCP,-16.03,-16.08,0.93,1.14
0611112,Murray Income Trust plc (MUT) Ordinary 25p Shares Share Price | MUT,-8.61,-8.13,0.72,0.27
0611190,Murray International Trust plc (MYI) Ordinary 25p Shares Share Price | MYI,4.28,2.64,0.64,0.17
0643610,BlackRock Smaller Companies Trust (BRSC) Ordinary 25p Shares Share Price | BRSC,-9.75,-12.36,0.97,0.37
0643900,North Atlantic Smaller Cos Inv Tst (NAS) Ordinary 5p Share Price | NAS,-22.67,-18.93,1.12,2.24
0661582,Chelverton Small Companies Dividend Trust plc (SDV) Ordinary 25p Share Price | SDV,-0.60,-1.29,1.89,2.11
0666747,Pacific Horizon Investment Trust plc (PHI) Ordinary 10p Shares Share Price | PHI,-3.64,-8.14,1.07,0.29
0667438,Pacific Assets Trust (PAC) Ordinary 12.5p Share Price | PAC,-5.69,-2.48,1.25,0.79
0679842,Perpetual Income & Growth Inv Tst (PLI) Ordinary 10p Share Price | PLI,-9.99,-8.46,0.65,0.28
0682754,Personal Assets Trust plc (PNL) GBP12.50 Ordinary Shares Share Price | PNL,1.09,1.20,0.95,0.38
0736639,RIT Capital Partners plc (RCP) Ordinary GBP1 Share Price | RCP,5.75,6.21,1.05,0.11
0739207,Rights & Issues Investment Trust plc (RIII) Inc 25p Share Price | RIII,-9.38,-10.08,0.45,2.37
0741600,JPMorgan Smaller Companies Investment Trust (JMI) Ordinary 25p Shares Share Price | JMI,-13.53,-17.88,1.12,0.88
0781606,Finsbury Growth & Income Trust plc (FGT) Ordinary 25p Shares Share Price | FGT,0.91,0.59,0.73,0.13
0782609,Scottish Investment Trust plc (SCIN) Ordinary 25p Shares Share Price | SCIN,-7.91,-8.78,0.47,0.25
0783613,Scottish Oriental Smaller Cos Trust (SST) Ordinary 25p Share Price | SST,-13.17,-11.43,1.18,2.01
0787369,Scottish American Investment Co plc (SCAM) Ordinary 25p Shares Share Price | SCAM,4.23,4.41,0.80,0.84
0787972,Hansa Trust plc (HAN) Ordinary 5p Share Price | HAN,-27.90,-28.21,1.09,3.00
0787983,Hansa Trust plc (HANA) A Non Voting Ordinary 5p Share Price | HANA,-28.44,-29.69,1.09,1.52
0791348,Schroder UK Growth Fund (SDU) Ordinary 25p Share Price | SDU,-12.67,-12.38,0.63,0.87
0791586,Schroder Income Growth Fund (SCF) Ordinary 10p Share Price | SCF,-8.30,-7.81,0.95,0.70
0791887,Schroder Asia Pacific Fund (SDP) Ordinary 10p Share Price | SDP,-10.95,-10.87,0.99,0.45
0802284,Schroder Japan Growth Fund (SJG) Ordinary 10p Share Price | SJG,-5.87,-7.00,1.00,0.94
0805250,Shires Income (SHRS) Ordinary 50p Shares Share Price | SHRS,-0.57,-6.11,1.04,2.21
0806372,Aberdeen Smaller Companies Income Trust plc (ASCI) Ordinary 50p Share Price | ASCI,-13.56,-16.92,1.39,3.10
0848471,Value & Income Trust plc (VIN) Ordinary 10p Shares Share Price | VIN,-16.03,-17.12,1.42,1.89
0852814,JPMorgan Elect Plc (JPE) Managed Growth Shares 0.00431577p Share Price | JPE,-2.07,-2.42,0.55,1.91
0853657,Henderson Opportunities Trust Plc (HOT) Ordinary 25p Share Price | HOT,-17.29,-17.15,1.88,2.22
0871079,Schroder Asian Total Return Investment Company plc (ATR) Ordinary 5p Share Price | ATR,2.24,-0.05,2.68,1.14
0876999,Seneca Global Income & Growth Trust plc (SIGT) Ordinary 25p Share Price | SIGT,1.03,1.27,1.59,0.88
0882532,Temple Bar Investment Trust plc (TMPL) Ordinary 25p Shares Share Price | TMPL,-4.63,-4.78,0.49,0.32
0882929,Templeton Emerging Markets Inv Tst plc (TEM) Ordinary 25p Share Price | TEM,-12.92,-12.31,1.21,0.28
0891055,BlackRock Throgmorton Trust plc (THRG) Ordinary 5p Shares Share Price | THRG,-9.32,-15.46,2.16,1.16
0906409,TR Property Investment Trust plc (TRY) Ordinary 25p Share Price | TRY,-3.21,-5.48,0.87,0.13
0906506,Henderson Smaller Cos Investment Trust plc (HSL) Ordinary 25p Shares Share Price | HSL,-10.33,-13.29,1.01,1.15
0906692,TR European Growth Trust (TRG) Ordinary 12.5p Share Price | TRG,-6.25,-4.06,1.55,1.34
0958057,Henderson High Income Trust plc (HHI) Ordinary 5p Shares Share Price | HHI,-2.82,-0.61,0.75,1.14
0974406,Witan Investment Trust (WTAN) Ordinary 25p Share Price | WTAN,-1.27,-2.07,0.86,0.20
0981536,Lazard World Trust Fund (WTR) Shs USD0.20 Share Price | WTR,-6.56,-8.82,1.35,0.56
3047468,Standard Life Private Equity Trust plc (SLPE) Ordinary 0.002 Share Price | SLPE,-15.61,-12.34,1.29,0.31
3051726,Monks Investment Trust (MNKS) Ordinary 5p Share Price | MNKS,3.46,0.91,0.59,0.26
3073827,F & C Private Equity Trust (FPEO) Ordinary 1p Share Price | FPEO,2.57,-4.74,2.11,2.20
3096169,BlackRock Income & Growth Investment Trust plc (BRIG) Ordinary 1p Share Price | BRIG,-4.54,-2.46,1.08,1.03
3123249,Impax Environmental Markets plc (IEM) Ordinary 10p Share Price | IEM,-4.91,-9.46,1.05,0.79
3133691,Establishment Investment Trust (The) (ET.) Ordinary 25p Share Price | ET.,-17.08,-18.50,1.22,2.91
3142921,Law Debenture Corporation (LWDB) Ordinary 5p Share Price | LWDB,-11.83,-8.63,0.43,1.04
3197794,Lindsell Train Investment Trust plc (The) (LTI) Ordinary 75p Share Price | LTI,38.83,20.31,3.68,0.95
3216473,JPMorgan Russian Securities (JRS) Ordinary 1p Share Price | JRS,-15.60,-15.58,1.26,0.88
3227334,Baring Emerging Europe (BEE) Ordinary 10p Share Price | BEE,-11.80,-11.82,1.42,2.45
3353790,Premier Global Infrastructure plc (PGIT) Ordinary 1p Share Price | PGIT,-16.23,-8.41,7.01,3.33
3369872,Conygar Investment Company plc (CIC) Ordinary 5p Share Price | CIC,-11.21,0.00,7.54,1.32
3386257,EP Global Opportunities Trust (EPG) Ord GBP0.01 Share Price | EPG,-8.05,-5.62,0.92,0.99
3408009,JPMorgan Elect Plc (JPEC) Managed Cash Shares 0.01p Share Price | JPEC,-1.53,-1.28,0.02,4.85
3408021,JPMorgan Elect Plc (JPEI) Managed Income Shares 0.003p Share Price | JPEI,-2.18,-2.71,0.71,3.60
3436594,Miton Global Opportunities plc (MIGO) Ord 1p Share Price | MIGO,-2.85,-0.60,1.34,1.13
B018CS4,Ruffer Investment Co Ltd (RICA) Red Ptg Preference Shares Share Price | RICA,1.67,2.22,1.16,1.31
B01RDH7,BlackRock Greater Europe Investment Trust (BRGE) Ord 0.1p Shares Share Price | BRGE,-5.64,-4.44,1.10,1.87
B05NYM3,INVESCO Perpetual Enhanced Income Limited (IPE) Ordinary 5p Share Price | IPE,7.57,4.64,2.16,2.24
B06CZD7,Energiser Investments Plc (ENGI) Ord 0.1p Share Price | ENGI,-24.66,28.42,6.94,33.33
B06GJ37,Dolphin Capital Investors Ltd (DCI) Common Shares EUR0.01 Share Price | DCI,-64.13,-71.43,0.00,6.67
B073G36,Trading Emissions plc (TRE) Ordinary 1p Share Price | TRE,-17.89,-60.57,11.85,27.23
B08N4M0,Livermore Investments Group Ltd (LIV) Ord NPV Share Price | LIV,-35.96,-24.06,4.90,10.87
B08S4K3,Northern Investors Company (NRI) Ord 25p Share Price | NRI,-5.53,11.74,5.75,5.22
B09G3N2,Securities Trust of Scotland (STS) Ord Red 1p Share Price | STS,-6.06,-6.56,0.96,0.31
B0BDCB2,Strategic Equity Capital plc (SEC) Ordinary GBP 0.10 Share Price | SEC,-13.35,-13.68,2.42,2.23
B0BN1P9,BlackRock Emerging Europe plc (BEEP) Ordinary USD0.10 Share Price | BEEP,-2.81,-6.81,1.16,2.81
B0CRWN5,Schroder Oriental Income Fund (SOI) Ordinary 1p Share Price | SOI,0.50,0.81,1.95,0.79
B0HW536,Real Estate Credit Investments Ltd (RECI) Ord NPV Share Price | RECI,-0.77,2.56,2.29,0.62
B0LCW20,Picton Property Income Limited (PCTN) Ord NPV Share Price | PCTN,0.31,-2.67,2.47,0.79
B0N8MF9,BlackRock Commodities Income Investment Trust (BRCI) Ordinary 1p Share Price | BRCI,-2.70,-4.50,1.36,1.34
B0P6J83,Aberdeen Asian Income Fund (AAIF) Ordinary NPV Shares Share Price | AAIF,-9.63,-7.31,1.19,0.97
B0P8RJ6,India Capital Growth Fund Ltd (IGC) Ord GBp0.01 Share Price | IGC,-15.44,-14.29,0.64,2.01
B0T4LH6,HICL Infrastructure Company Ltd (HICL) Ordinary GBP 0.0001 Share Price | HICL,-8.97,3.10,1.18,0.07
B0XLRJ7,B.P Marsh & Partners (BPM) Ord GBP0.10 Share Price | BPM,-17.76,-23.85,3.51,1.57
B11V7W9,Alliance Trust plc (ATST) Ordinary 2.5p Shares Share Price | ATST,-5.43,-5.56,0.62,0.14
B120GL7,Jupiter Green Investment Trust (JGC) Ord Shares GBP0.1 Share Price | JGC,-3.80,-4.92,1.57,2.70
B12MHD2,LMS Capital plc (LMS) Ordinary 10p Share Price | LMS,-34.11,-37.48,3.85,4.76
B13YVW4,Highbridge Multi-Strategy Fund Limited (HMSF) Ordinary NPV GBP Share Price | HMSF,0.35,-1.39,0.39,0.45
B1436N6,Macau Property Opportunities Fund (MPO) Ord Usd0.01 Share Price | MPO,-17.66,-32.50,5.03,2.02
B15FW33,Geiger Counter Ltd (GCL) NPV Share Price | GCL,12.01,0.95,3.12,4.74
B15PV03,Middlefield Canadian Inc - GBP PC (MCT) Part Pref Shs Npv Share Price | MCT,-12.68,-10.18,1.26,1.94
B16GQJ9,South African Property Opportunities PLC (SAPO) Ord 1p Share Price | SAPO,999.00,62.50,37.71,96.67
B17XWW4,JPMorgan European Investment Trust (JETI) 2.06155p Income Shares Share Price | JETI,-9.88,-7.81,1.10,2.87
B188SR5,International Public Partnerships Limited (INPP) Ord GBP0.01 Share Price | INPP,-3.11,8.51,1.14,0.14
B18JK16,JPMorgan European Investment Trust (JETG) 3.97p Growth Shares Share Price | JETG,-9.38,-8.72,1.07,1.01
B19Z2J5,UK Commercial Property Trust (UKCM) Ordinary 25p Shares Share Price | UKCM,-2.37,-1.06,1.43,0.11
B1DPVL6,Invesco Perpetual Select Trust (IVPU) UK Equity Shares 1p Share Price | IVPU,-2.49,-1.28,1.38,0.57
B1DQ647,Invesco Perpetual Select Trust (IVPG) Global Equity Income Shares 1p Share Price | IVPG,-2.27,-1.13,0.98,3.00
B1DQ669,Invesco Perpetual Select Trust (IVPB) Balanced Risk Shares 1p Share Price | IVPB,-0.53,-1.30,1.20,3.57
B1DQ670,Invesco Perpetual Select Trust (IVPM) Managed Liquidity Shares 1p Share Price | IVPM,-1.28,-1.49,0.40,1.94
B1DVQL9,MedicX Fund Ltd (MXF) Ord Npv Share Price | MXF,21.34,32.68,3.47,0.75
B1FL3C7,Invesco Perpetual UK Smaller Cos Inv Tst (IPU) Ord 20p Share Price | IPU,-5.81,-5.37,1.27,1.18
B1G9T99,Golden Prospect Precious Metals Ltd (GPM) Ord Gbp0.001 Share Price | GPM,-13.96,-15.31,3.16,6.45
B1GCL25,Dunedin Smaller Companies Investment Trust (DNDL) Ordinary 5p Share Price | DNDL,-19.40,-17.99,1.36,1.53
B1GJQ98,Global Fixed Income Realisation Ltd (GFIR) Ordinary NPV GBP Share Price | GFIR,-30.51,-46.88,2.48,16.00
B1GXH75,Henderson Far East Income Ltd (HFEL) Ordinary NPV Share Price | HFEL,1.02,1.73,1.12,1.91
B1LZS51,CQS New City High Yield Fund Ltd (NCYF) Ord NPV Share Price | NCYF,6.04,5.48,1.21,0.66
B1N4G29,F&C UK High Income Trust (FHI) Ordinary 0.1p Shares Share Price | FHI,-8.20,-6.62,1.09,2.06
B1N4H59,F&C UK High Income Trust (FHIB) Ordinary 0.1p B Shares Share Price | FHIB,-8.15,-6.57,1.09,2.06
B1N4H93,F&C UK High Income Trust (FHIU) Units (3 Ord 0.1p Shares and 1 Ord B Share) Share Price | FHIU,-7.71,-6.73,1.02,1.55
B1NNWQ2,Cambium Global Timberland Ltd (TREE) Ord NPV Share Price | TREE,-44.64,-53.32,0.20,2.56
B1NP514,BH Macro Ltd (GBP) (BHMG) Ord NPV Share Price | BHMG,-8.24,-8.23,4.75,0.51
B1NPGV1,BH Macro Ltd (USD) (BHMU) Ordinary NPV Share Price | BHMU,-9.38,-5.82,4.75,2.00
B1W59J1,Aberdeen Frontier Markets Investment Company Ltd (AFMC) Ordinary NPV Share Price | AFMC,-11.81,-7.53,2.01,2.50
B1XH2B9,Dragon Ukrainian Properties & Development plc (DUPD) Ordinary 1p Share Price | DUPD,-62.90,-58.04,5.08,16.67
B1YQ6R9,Third Point Offshore Investors Ltd (TPOG) Ordinary NPV GBP Share Price | TPOG,-13.22,-16.80,2.45,2.45
B1YQ721,Third Point Offshore Investors Ltd (TPOU) Ordinary NPV USD Share Price | TPOU,-16.37,-12.04,2.45,0.91
B1YW440,3i Group Plc (III) Ordinary 73 19/22p Share Price | III,25.65,36.88,2.15,0.09
B1Z2SL4,Crystal Amber Fund Ltd (CRS) Ordinary 1p Share Price | CRS,-4.45,-1.33,3.08,0.96
B23DL39,Oakley Capital Investments Ltd (OCI) Ordinary 1p Share Price | OCI,-30.75,-30.51,1.34,0.29
B28Y104,Volta Finance Ltd (VTA) NPV Share Price | VTA,,,,1.13
B28ZZS3,Tetragon Financial Group Ltd (TFG) USD0.001 Share Price | TFG,,,,1.15
B28ZZX8,NB Private Equity Partners Ltd (NBPE) Ordinary USD0.01 Share Price | NBPE,-19.32,-17.63,2.85,1.05
B29LSW5,Juridica Investments LD (JIL) Ord NPV Share Price | JIL,-26.71,-43.03,7.36,6.61
B2PP252,F&C Managed Portfolio Trust plc (FMPG) Growth Shares 10p Share Price | FMPG,1.09,1.24,0.95,1.51
B2PP3J3,F&C Managed Portfolio Trust Plc (FMPI) Income Shares 10p Share Price | FMPI,1.22,1.71,1.10,2.96
B2QQPS8,BH Global Ltd (BHGU) Ordinary Shares USD NPV Share Price | BHGU,-6.27,-5.85,3.17,2.88
B2QQPT9,BH Global Ltd (BHGG) Ord GBP NPV Share Price | BHGG,-6.97,-8.56,3.17,0.73
B39VMM0,Boussard & Gavaudan Holding Ltd (BGHS) Ord Eur0.0001 (Stg) Share Price | BGHS,-17.40,-18.38,3.32,9.89
B3BTVQ9,Oryx International Growth Fund (OIG) Ordinary 50p Share Price | OIG,-16.98,-18.01,1.65,2.60
B3KX4Q3,NB Global Floating Rate Income Fund Ltd (NBLS) Redeemable Ordinary NPV GBP Share Price | NBLS,-3.66,-2.53,0.94,0.11
B3P7S35,NB Global Floating Rate Income Fund Ltd (NBLU) Redeemable Ordinary NPV USD Share Price | NBLU,-3.60,-1.49,0.94,2.06
B3PHCS8,Henderson International Income Trust plc (HINT) Ord GBP0.01 Share Price | HINT,0.65,0.90,0.90,0.95
B3SXM83,BlackRock Frontiers Investment Trust (BRFI) Ordinary 1p Share Price | BRFI,2.86,3.11,1.68,1.23
B3Z6252,Doric Nimrod Air Two Ltd (DNA2) Ordinary Preference NPV Share Price | DNA2,25.78,25.11,1.03,2.75
B403HK5,JZ Capital Partners Ltd (JZCP) Ordinary NPV Shares Share Price | JZCP,-31.74,-30.78,4.78,0.82
B44ZTP6,Aberdeen Latin American Income Fund (ALAI) Ord NPV Share Price | ALAI,-12.71,-12.84,1.99,2.51
B45L2K9,Aberdeen Emerging Markets Investment Company Ltd (AEMC) Ordinary 1p Shares Share Price | AEMC,-11.49,-12.67,1.08,1.32
B4L0PD4,Genesis Emerging Markets Fund Ltd (GSS) Ptg NPV Share Price | GSS,-13.08,-12.67,1.43,0.15
B4MF389,Doric Nimrod Air One Ltd (DNA) Ordinary Preference NPV Share Price | DNA,-1.31,6.17,1.37,3.85
B4MFKH7,LXB Retail Properties Plc (LXB) Ord NPV Share Price | LXB,-23.10,-4.73,99.00,4.35
B4N1RV7,Better Capital PCC Ltd (BC12) Ordinary GBP1.00 (2012) Share Price | BC12,-47.09,-25.04,0.28,8.00
B4ZPCJ0,F&C Commercial Property Trust Ltd (FCPT) Ord 1p Share Price | FCPT,0.93,1.95,1.07,0.42
B4ZWPH0,John Laing Infrastructure Fund Ltd (JLIF) Ord GBP0.0001 Share Price | JLIF,-7.55,3.72,1.48,0.35
B5ZZY91,JPMorgan Global Emerging Markets Income Trust (JEMI) Ord 1p Share Price | JEMI,-5.02,-2.85,1.30,2.72
B602HS4,JPMorgan Brazil Investment Trust (JPB) Ordinary 1p Share Price | JPB,-13.45,-14.71,1.99,4.44
B6116N8,Alcentra European Floating Rate Income Fund (AEFS) Red Ord Npv Gbp Share Price | AEFS,-4.71,-4.16,0.98,0.40
B6173J1,GCP Infrastructure Investments Ltd (GCP) Ordinary 1p Share Price | GCP,6.93,14.73,1.09,0.17
B61ND55,Atlantis Japan Growth Fund (AJG) Ordinary NPV Share Price | AJG,-6.16,-8.34,1.53,1.72
B62Z3C7,Fidelity China Special Situations PLC (FCSS) Ordinary Shares 1p Share Price | FCSS,-13.16,-12.41,1.16,0.21
B65TLW2,Diverse Income Trust plc (The) (DIVI) Ordinary 0.1p Share Price | DIVI,0.76,-1.12,1.17,2.43
B6686L2,Baker Steel Resources Trust Ltd (BSRT) Ord Npv Share Price | BSRT,-16.10,-21.10,2.17,2.22
B6832P1,Polar Capital Global Healthcare Trust plc (PCGH) Ordinary 25p Shares Share Price | PCGH,-7.37,-1.84,1.50,2.22
B6QWXM4,BBGI Sicav SA (BBGI) Ord NPV (DI) Share Price | BBGI,5.40,9.98,0.95,0.37
B6RMDP6,City Merchants High Yield Trust Ltd (CMHY) Ordinary NPV Share Price | CMHY,-1.85,0.53,1.03,0.53
B6T0TM7,,,,,0.53
B6VTTK0,Mid Wynd International Investment Trust Plc (MWY) ORD GBP0.05 Share Price | MWY,2.69,1.27,0.67,0.84
B6WC674,Secure Property Development & Investment plc (SPDI) Ordinary EUR0.01 Share Price | SPDI,0.00,0.00,6.43,23.08
B6YVTS1,City Natural Resources High Yield Trust plc (CYNC) 3.5% Convertible Unsecured Loan Stock Share Price | CYNC,,,,2.94
B79WC10,Starwood European Real Estate Fin Ltd (SWEF) Ordinary NPV Share Price | SWEF,4.46,7.88,1.21,0.48
B7VSCF0,All Asia Asset Capital Limited (AAA) Ordinary NPV Share Price | AAA,31.10,0.00,6.07,44.44
B7W0XJ6,Blackrock North American Income Trust plc (BRNA) Ord 1p Shares Share Price | BRNA,-7.26,-6.48,1.08,0.66
B7ZMLM8,Aberdeen Asian Smaller Companies Investment Trust (AASC) 3.5% Convertible Unsecured Loan Stock Share Price | AASC,,,,2.44
B8C23S8,ICG-Longbow Senior Secured UK Property Debt Invest (LBOW) Ordinary NPV Share Price | LBOW,1.90,0.73,1.62,0.49
B8P59C0,Syncona Limited (SYNC) Ordinary NPV Share Price | SYNC,25.00,22.68,1.45,0.11
B8SC6K5,Greencoat UK Wind plc (UKW) Ordinary 1p Share Price | UKW,10.21,10.38,1.94,0.17
B90J5Z9,Twentyfour Income Fund Ltd (TFIF) Ordinary GBP 0.01 Share Price | TFIF,2.09,2.33,1.01,0.41
B92LHN5,Doric Nimrod Air Three Ltd (DNA3) Ordinary Preference Shares NPV Share Price | DNA3,45.10,41.73,0.81,0.98
B96SW59,JPMorgan Global Convertibles Income Fund Limited (JGCI) Ordinary NPV Share Price | JGCI,-2.58,-2.55,0.99,1.86
B986V54,Adams Plc (ADA) Ordinary Eur0.01 Share Price | ADA,53.58,91.39,88.27,50.00
B99R1Q7,Inland ZDP plc (INLZ) Zero Dividend Preference Shares 2019 10p Share Price | INLZ,0.00,0.00,7.41,3.27
B9MRHZ5,CVC Credit Partners European Opportunities Ltd (CCPG) Ordinary NPV GBP Share Price | CCPG,0.82,0.89,0.52,1.33
B9XQT11,Polar Capital Global Financials Trust (PCFT) Ordinary Shares Share Price | PCFT,-2.92,-5.14,1.00,1.10
BB0RDB9,Bluefield Solar Income Fund Limited (BSIF) Ordinary Shares NPV Share Price | BSIF,5.79,5.83,1.12,0.43
BBHX2H9,The Renewables Infrastructure Group Limited (TRIG) Ordinary Shares NPV Share Price | TRIG,4.19,8.59,0.12,0.19
BBM56V2,Aberdeen New Dawn Investment Trust plc (ABD) Ordinary 5p Shares Share Price | ABD,-13.17,-12.77,0.93,1.29
BCDP4K3,Taliesin Property Fund (TPFZ) Redeemable Zero Dividend Preference GBP1 Share Price | TPFZ,1.27,0.00,10.06,2.11
BCKFVJ4,Global Resources Investment Trust plc (GRIT) Ordinary Shares 1p Share Price | GRIT,-36.85,-42.54,7.56,4.76
BD0FRW6,NB Private Equity Partners Ltd (NBPP) 2022 Zero Dividend Preference Shares Share Price | NBPP,6.29,0.00,2.85,1.75
