BD2YGN5,UIL Finance Limited ZDP 2022 (UTLF) RED ZERO DIV PREF 31/10/2022 GBP 0.0531 Share Price | UTLF,13.02,11.63,1.24,2.34
BD3QJR5,Foresight Solar Fund Ltd (FSFL) Ordinary NPV Share Price | FSFL,0.94,4.62,1.17,0.93
BD45S96,Utilico Emerging Markets Trust plc (UEM) Ordinary GBP 0.01 Share Price | UEM,-13.03,-11.76,2.82,1.52
BD5G638,,,,,1.52
BD9PXH4,Aberdeen Standard European Logistics Income (ASLI) Ordinary Shares Share Price | ASLI,7.21,2.03,0.00,0.47
BD9X204,Vietnam Enterprise Investments Ltd (VEIL) Ord USD0.01(DI) Share Price | VEIL,-18.28,-12.85,2.23,0.22
BDG13K8,River & Mercantile UK Micro Cap Investment Company (RMMC) Redeemable Ord NPV (NOV 2017) Share Price | RMMC,-12.24,0.39,5.52,4.95
BDGKMY2,BioPharma Credit Investments (BPCR) Ord Share Price | BPCR,4.04,8.21,0.00,0.96
BDHXP96,Polar Capital Global Healthcare Trust plc (PGHZ) ZDP Share Price | PGHZ,2.42,0.00,1.48,1.89
BDR0575,Jupiter Emerging & Frontier Income Investment Tst (JEFI) Ord Share Price | JEFI,-2.26,2.62,0.00,2.31
BDZTXY7,UIL Finance Ltd ZDP 2024 (UTLG) RED ZDP 31/10/24 GBP(DI) Share Price | UTLG,3.58,4.23,1.24,1.62
BF03YC3,Henderson Diversified Income (HDIV) GBP0.01 Share Price | HDIV,5.36,3.49,1.62,1.50
BF0SCX5,Downing Strat Micro-Cap Investment Trust plc (DSM) Ord GBP0.001 Share Price | DSM,0.88,4.99,0.00,1.09
BF1F1F0,JPEL Private Equity Ltd USD Equity Shares of NPV Share Price,-11.48,-12.89,1.86,3.33
BF5FX16,,,,,3.33
BFD3V96,Jupiter UK Growth Investment Trust plc (JUKG) Ordinary 5p Share Price | JUKG,-3.98,-2.24,1.20,0.61
BFWJJT1,JPMorgan Multi-Asset Trust (MATE) Ordinary Shares Share Price | MATE,-5.76,0.00,0.00,5.15
BH7JH18,NB Distressed Debt Investment Fund (NBDG) Global Shares Share Price | NBDG,-15.74,-15.61,2.48,1.23
BJ0JVY0,NextEnergy Solar Fund Ltd (NESF) Ordinary NPV Share Price | NESF,7.18,7.92,1.28,0.90
BJL5F34,JPMorgan US Smaller Companies Investment Trust (JUSC) Ordinary 2.5p Shares Share Price | JUSC,-1.71,-2.48,1.33,0.34
BJL5FH8,John Laing Environmental Asset Group (JLEN) NPV Share Price | JLEN,5.13,9.96,1.46,0.98
BJVDZ94,TwentyFour Select Monthly Income Fund Limited (SMIF) Ordinary 1p Share Price | SMIF,4.81,3.30,1.20,1.09
BK1PKQ9,Fidelity European Values plc (FEV) Ordinary 2.5p Share Price | FEV,-11.35,-8.67,0.93,0.46
BKZGVH6,JPMorgan American Investment Trust plc (JAM) Ordinary 5p Share Price | JAM,-6.96,-5.05,0.55,0.25
BLDYK61,Scottish Mortgage Investment Trust (SMT) Ordinary Shares 5p Share Price | SMT,2.97,1.67,0.44,0.08
BLSNND1,Fundsmith Emerging Equities Trust PLC (FEET) Ordinary Shares GBP0.01 Share Price | FEET,2.89,0.51,1.91,0.80
BMPHJ80,Sanditon Investment Trust plc (SIT) Ordinary 1p Share Price | SIT,-9.06,-4.06,1.21,2.84
BMTS0Z3,JPMorgan European Smaller Co IT plc (JESC) Ordinary 5p Share Price | JESC,-9.38,-8.87,1.13,1.45
BN56JF1,SQN Asset Finance Income Fund Ltd (SQN) Ordinary NPV Share Price | SQN,-5.72,-1.75,1.90,0.43
BNH7RK3,F&C Global Smaller Companies plc (FCSC) 3.5% Convertible Unsecured Loan Stock 31/07/19 Share Price | FCSC,,,,2.18
BP46PR0,JZ Capital Partners Limited (JZCC) 6% Convertible Unsecured Loan Stock 2021 Share Price | JZCC,,,,6.25
BR30MJ8,Harbourvest Global Private Equity (HVPE) Ordinary Shares Share Price | HVPE,-18.33,-16.69,0.34,0.16
BTLJYS4,Gabelli Value Plus + Trust plc (GVP) Ordinary 1p Share Price | GVP,-7.74,-4.62,1.33,2.42
BVFCRP1,Catco Reinsurance Opportunities Fund (CAT) Ord USD0.00013716 (DI) Share Price | CAT,-14.53,0.00,3.20,1.37
BVG1CF2,Woodford Patient Capital Trust PLC (WPCT) Ordinary Shares GBP 0.01 Share Price | WPCT,-9.44,-6.21,0.18,0.54
BWFGQ08,Miton UK Microcap Trust plc (MINI) Ordinary Shares 0.1p Share Price | MINI,-6.10,-3.92,1.58,2.73
BWXC7Y9,Fidelity Special Values (FSV) Ordinary 5p Share Price | FSV,-1.11,-3.73,1.06,0.74
BY7R8K7,Schroder European Real Estate Investment Trust (SERE) Ordinary 10p Share Price | SERE,-4.22,-3.26,8.86,1.79
BYMJ7X4,Acorn Income Fund (AIFZ) Red Zero Div Pref GBP0.01 2022 Share Price | AIFZ,4.71,0.00,2.30,1.96
BYMKY69,JPMorgan Global Growth & Income plc (JPGI) Ordinary 5p Share Price | JPGI,0.11,1.22,1.23,0.64
BYP98L6,PGIT Securities 2020 plc (PGIZ) GBP0.01 ZDP Share Price | PGIZ,3.20,6.07,7.01,3.42
BYPBD39,Aberforth Split Level Income Trust plc (ASIT) Ord GBP0.01 Share Price | ASIT,-6.00,-4.09,0.00,5.69
BYPBD51,Aberforth Split Level Income Trust plc (ASIZ) ZDP GBP0.01 Share Price | ASIZ,6.02,0.05,0.00,2.73
BYRH498,Gresham House Strategic plc (GHS) Ordinary 50p Share Price | GHS,-30.64,-24.20,3.69,2.35
BYSRMH1,CC Japan Income & Growth Trust plc (CCJI) Ordinary Shares 1p Share Price | CCJI,2.85,2.79,1.25,3.64
BYT2554,Scotgems plc (SGEM) Ord GBP0.01 Share Price | SGEM,-9.37,1.96,0.77,3.23
BYTRG23,Marwyn Value Investors Ltd (MVI) Ordinary Shares GBP0.000001 Share Price | MVI,-36.31,-28.59,3.90,1.55
BYWWMM7,Leaf Clean Energy Co (LEAF) Ordinary  GBP0.0001 (DI) Share Price | LEAF,-66.14,-44.09,0.00,10.00
BYWYZ46,Sure Ventures (SURE) Ordinary Shares Share Price | SURE,,,,9.09
BYXP9G8,Better Capital PCC Ltd (BCAP) ORD GBP1.00 (POST RED 2009) Share Price | BCAP,-43.66,-50.89,0.21,6.06
BYXVT88,VinaCapital Vietnam Opportunity Fund Ltd (VOF) USD0.01 Share Price | VOF,-18.30,-18.43,4.44,0.29
BYXX8B0,GCP Asset Backed Income Fund Limited (GABI) Ordinary NPV Share Price | GABI,2.54,4.62,3.10,0.49
BYYJCZ9,Funding Circle SME (FCIF) NPV Share Price | FCIF,4.34,3.38,0.88,1.43
BYZV3G2,Honeycomb Investment Trust plc (HONY) Ordinary 1p Share Price | HONY,10.96,15.07,2.28,0.89
BZ0RY03,JZ Capital Partners (JZCZ) Zero Div Red Pref NPV (2022) Share Price | JZCZ,9.85,0.00,4.78,2.28
BZ0XWD0,Menhaden Capital plc (MHN) Ordinary 100p Share Price | MHN,-27.64,-23.97,2.09,7.25
BZ3C3B9,Sherborne Investors C (SIGC) Ord NPV Share Price | SIGC,,,,2.83
BZ4BVN3,UIL Ltd (UTL) Ord 10 (DI) Share Price | UTL,-39.01,-39.38,1.24,2.94
BZ4BVP5,UIL Finance Ltd ZDP 2018 (UTLD) RED ZERO DIV PREF 31/10/2018 GBP0.05931 Share Price | UTLD,2.55,4.72,1.24,1.25
BZ4BVT9,UIL Finance Ltd ZDP 2020 (UTLE) Zero Dividend Preference 31/10/2020 Share Price | UTLE,9.94,12.97,1.24,1.39
BZ7MQD8,SDV 2025 ZDP PLC (SDVP) 0% DIV PREF GBP100 Share Price | SDVP,4.21,0.00,1.89,2.80
BZCNLL9,BB Healthcare Trust plc (BBH) Ord GBP0.01 Share Price | BBH,-1.61,2.55,1.38,1.35
