BD2YGN5,UIL Finance Limited ZDP 2022 (UTLF) RED ZERO DIV PREF 31/10/2022 GBP 0.0531 Share Price | UTLF,12.12,11.07,1.24,1.60
BD3QJR5,Foresight Solar Fund Ltd (FSFL) Ordinary NPV Share Price | FSFL,-1.82,4.62,1.17,0.48
BD45S96,Utilico Emerging Markets Trust plc (UEM) Ordinary GBP 0.01 Share Price | UEM,-11.05,-11.57,2.82,0.70
BD9PXH4,Aberdeen Standard European Logistics Income (ASLI) Ordinary Shares Share Price | ASLI,8.07,2.03,0.00,0.95
BD9X204,Vietnam Enterprise Investments Ltd (VEIL) Ord USD0.01(DI) Share Price | VEIL,-18.35,-13.16,0.00,0.62
BDG13K8,River & Mercantile UK Micro Cap Investment Company (RMMC) Redeemable Ord NPV (NOV 2017) Share Price | RMMC,-11.82,0.24,5.52,4.65
BDGKMY2,BioPharma Credit Investments (BPCR) Ord Share Price | BPCR,2.13,6.99,0.00,0.97
BDHXP96,Polar Capital Global Healthcare Trust plc (PGHZ) ZDP Share Price | PGHZ,2.62,0.00,1.48,1.89
BDR0575,Jupiter Emerging & Frontier Income Investment Tst (JEFI) Ord Share Price | JEFI,1.82,2.62,0.00,2.68
BDZTXY7,UIL Finance Ltd ZDP 2024 (UTLG) RED ZDP 31/10/24 GBP(DI) Share Price | UTLG,3.89,4.23,1.24,0.94
BF03YC3,Henderson Diversified Income (HDIV) GBP0.01 Share Price | HDIV,5.21,3.34,1.62,1.74
BF0SCX5,Downing Strat Micro-Cap Investment Trust plc (DSM) Ord GBP0.001 Share Price | DSM,-0.73,4.99,0.00,2.21
BF5FX16,,,,,2.21
BFD3V96,Jupiter UK Growth Investment Trust plc (JUKG) Ordinary 5p Share Price | JUKG,-2.10,-2.19,1.20,2.56
BFWJJT1,JPMorgan Multi-Asset Trust (MATE) Ordinary Shares Share Price | MATE,-2.30,0.00,0.00,5.10
BH7JH18,NB Distressed Debt Investment Fund (NBDG) Global Shares Share Price | NBDG,-13.81,-15.79,2.48,1.89
BJ0JVY0,NextEnergy Solar Fund Ltd (NESF) Ordinary NPV Share Price | NESF,7.67,7.92,1.28,0.45
BJL5F34,JPMorgan US Smaller Companies Investment Trust (JUSC) Ordinary 2.5p Shares Share Price | JUSC,-3.53,-2.65,1.33,0.72
BJL5FH8,John Laing Environmental Asset Group (JLEN) NPV Share Price | JLEN,4.10,9.96,1.46,1.96
BJVDZ94,TwentyFour Select Monthly Income Fund Limited (SMIF) Ordinary 1p Share Price | SMIF,4.80,3.31,1.20,0.60
BK1PKQ9,Fidelity European Values plc (FEV) Ordinary 2.5p Share Price | FEV,-10.95,-8.54,0.93,0.24
BKZGVH6,JPMorgan American Investment Trust plc (JAM) Ordinary 5p Share Price | JAM,-4.86,-5.01,0.55,0.26
BLDYK61,Scottish Mortgage Investment Trust (SMT) Ordinary Shares 5p Share Price | SMT,0.12,1.70,0.44,0.09
BLSNND1,Fundsmith Emerging Equities Trust PLC (FEET) Ordinary Shares GBP0.01 Share Price | FEET,1.21,0.61,1.91,0.82
BMPHJ80,Sanditon Investment Trust plc (SIT) Ordinary 1p Share Price | SIT,-8.83,-3.62,1.21,2.87
BMTS0Z3,JPMorgan European Smaller Co IT plc (JESC) Ordinary 5p Share Price | JESC,-9.61,-9.05,1.13,0.75
BN56JF1,SQN Asset Finance Income Fund Ltd (SQN) Ordinary NPV Share Price | SQN,-7.76,-0.95,1.90,0.42
BNH7RK3,F&C Global Smaller Companies plc (FCSC) 3.5% Convertible Unsecured Loan Stock 31/07/19 Share Price | FCSC,,,,1.87
BP46PR0,JZ Capital Partners Limited (JZCC) 6% Convertible Unsecured Loan Stock 2021 Share Price | JZCC,,,,5.32
BR30MJ8,Harbourvest Global Private Equity (HVPE) Ordinary Shares Share Price | HVPE,-20.01,-16.17,0.34,0.34
BTLJYS4,Gabelli Value Plus + Trust plc (GVP) Ordinary 1p Share Price | GVP,-7.63,-4.41,1.33,1.68
BVFCRP1,Catco Reinsurance Opportunities Fund (CAT) Ord USD0.00013716 (DI) Share Price | CAT,-14.52,1.11,3.20,2.74
BVG1CF2,Woodford Patient Capital Trust PLC (WPCT) Ordinary Shares GBP 0.01 Share Price | WPCT,-5.52,-6.11,0.18,0.59
BWFGQ08,Miton UK Microcap Trust plc (MINI) Ordinary Shares 0.1p Share Price | MINI,-5.02,-3.86,1.58,2.48
BWXC7Y9,Fidelity Special Values (FSV) Ordinary 5p Share Price | FSV,-1.55,-3.87,1.06,0.39
BY7R8K7,Schroder European Real Estate Investment Trust (SERE) Ordinary 10p Share Price | SERE,-8.51,-3.26,8.86,3.17
BYMJ7X4,Acorn Income Fund (AIFZ) Red Zero Div Pref GBP0.01 2022 Share Price | AIFZ,4.97,0.00,1.63,1.96
BYMKY69,JPMorgan Global Growth & Income plc (JPGI) Ordinary 5p Share Price | JPGI,3.62,0.84,1.23,0.97
BYP98L6,PGIT Securities 2020 plc (PGIZ) GBP0.01 ZDP Share Price | PGIZ,3.51,6.15,7.01,3.42
BYPBD39,Aberforth Split Level Income Trust plc (ASIT) Ord GBP0.01 Share Price | ASIT,-2.20,-4.09,0.00,4.91
BYPBD51,Aberforth Split Level Income Trust plc (ASIZ) ZDP GBP0.01 Share Price | ASIZ,5.78,0.05,0.00,1.83
BYRH498,Gresham House Strategic plc (GHS) Ordinary 50p Share Price | GHS,-30.00,-23.75,3.69,2.98
BYSRMH1,CC Japan Income & Growth Trust plc (CCJI) Ordinary Shares 1p Share Price | CCJI,3.70,2.83,1.25,3.70
BYT2554,Scotgems plc (SGEM) Ord GBP0.01 Share Price | SGEM,-5.65,1.96,0.77,4.30
BYTRG23,Marwyn Value Investors Ltd (MVI) Ordinary Shares GBP0.000001 Share Price | MVI,-33.81,-29.03,3.90,3.85
BYW1DN2,GCP Asset Backed Income Fund Limited (GABC) C Shares Share Price | GABC,0.36,0.00,0.00,2.00
BYWWMM7,Leaf Clean Energy Co (LEAF) Ordinary  GBP0.0001 (DI) Share Price | LEAF,-51.66,-44.09,0.00,7.41
BYWYZ46,Sure Ventures (SURE) Ordinary Shares Share Price | SURE,,,,7.27
BYXP9G8,Better Capital PCC Ltd (BCAP) ORD GBP1.00 (POST RED 2009) Share Price | BCAP,-45.41,-50.89,0.21,7.69
BYXVT88,VinaCapital Vietnam Opportunity Fund Ltd (VOF) USD0.01 Share Price | VOF,-20.13,-18.41,4.44,0.29
BYXX8B0,GCP Asset Backed Income Fund Limited (GABI) Ordinary NPV Share Price | GABI,3.19,4.62,1.89,1.46
BYYJCZ9,Funding Circle SME (FCIF) NPV Share Price | FCIF,4.90,3.31,0.88,1.91
BYZV3G2,Honeycomb Investment Trust plc (HONY) Ordinary 1p Share Price | HONY,13.16,14.35,2.28,0.88
BZ0RY03,JZ Capital Partners (JZCZ) Zero Div Red Pref NPV (2022) Share Price | JZCZ,10.19,0.00,4.78,2.28
BZ0XWD0,Menhaden Capital plc (MHN) Ordinary 100p Share Price | MHN,-24.74,-24.62,2.09,7.14
BZ3C3B9,Sherborne Investors C (SIGC) Ord NPV Share Price | SIGC,,,,1.87
BZ4BVN3,UIL Ltd (UTL) Ord 10 (DI) Share Price | UTL,-37.25,-39.54,1.24,4.76
BZ4BVP5,UIL Finance Ltd ZDP 2018 (UTLD) RED ZERO DIV PREF 31/10/2018 GBP0.05931 Share Price | UTLD,2.37,5.12,1.24,1.26
BZ4BVT9,UIL Finance Ltd ZDP 2020 (UTLE) Zero Dividend Preference 31/10/2020 Share Price | UTLE,10.06,12.77,1.24,2.08
BZ7MQD8,SDV 2025 ZDP PLC (SDVP) 0% DIV PREF GBP100 Share Price | SDVP,4.47,0.00,1.89,2.80
BZCNLL9,BB Healthcare Trust plc (BBH) Ord GBP0.01 Share Price | BBH,1.90,2.59,1.38,1.89
