BD9X204,Vietnam Enterprise Investments Ltd (VEIL) Ord USD0.01(DI) Share Price | VEIL,-10.41,-12.53,2.23,0.22
BDFGHW4,Baillie Gifford US Growth Trust (USA) Ordinary Shares Share Price | USA,1.21,0.00,0.00,0.17
BDG13K8,River & Mercantile UK Micro Cap Investment Company (RMMC) Redeemable Ord NPV (NOV 2017) Share Price | RMMC,-12.84,0.53,5.52,3.30
BDGKMY2,BioPharma Credit Investments (BPCR) Ord Share Price | BPCR,3.90,8.43,0.00,1.92
BDHXP96,Polar Capital Global Healthcare Trust plc (PGHZ) ZDP Share Price | PGHZ,2.20,0.00,1.48,1.89
BDR0575,Jupiter Emerging & Frontier Income Investment Tst (JEFI) Ord Share Price | JEFI,2.36,2.64,0.00,2.29
BDZTXY7,UIL Finance Ltd ZDP 2024 (UTLG) RED ZDP 31/10/24 GBP(DI) Share Price | UTLG,3.21,4.23,1.55,1.85
BF03YC3,Henderson Diversified Income (HDIV) GBP0.01 Share Price | HDIV,1.59,3.62,1.62,1.78
BF0SCX5,Downing Strat Micro-Cap Investment Trust plc (DSM) Ord GBP0.001 Share Price | DSM,-0.43,4.54,1.48,2.20
BF1F1F0,JPEL Private Equity Ltd (JPEL) USD Equity Shares of NPV Share Price | JPEL,-14.34,-12.67,1.86,0.69
BF4JDH5,Mercantile Investment Trust Plc (MRC) Ordinary 2.5p Shares Share Price | MRC,-8.54,-9.51,0.47,0.16
BF5FX16,3i Infrastructure plc (3IN) Ord NPV Share Price | 3IN,7.47,8.14,7.00,0.11
BFD3V96,Jupiter UK Growth Investment Trust plc (JUKG) Ordinary 5p Share Price | JUKG,-0.82,-2.24,1.20,2.91
BFNS016,Aberdeen Private Equity Fund Ltd (APEF) Sterling Shares of NPV Share Price | APEF,-5.55,-1.66,2.79,50.00
BFWJJT1,JPMorgan Multi-Asset Trust (MATE) Ordinary Shares Share Price | MATE,-5.98,0.00,0.00,5.15
BFXYH24,Baillie Gifford Shin Nippon plc (BGS) Ordinary 2p Shares Share Price | BGS,6.83,7.48,0.90,2.28
BFZ0WT2,Aberdeen Asian Smaller Companies Investment Trust (AASC) 2.25% Convertible Unsecured Loan Stock Share Price | AASC,,,,1.96
BG0P0V7,Gore Street Energy (GSF) Ord Share Price | GSF,3.11,0.00,0.00,0.50
BJ0JVY0,NextEnergy Solar Fund Ltd (NESF) Ordinary NPV Share Price | NESF,7.89,7.92,1.28,0.91
BJL5F34,JPMorgan US Smaller Companies Investment Trust (JUSC) Ordinary 2.5p Shares Share Price | JUSC,1.07,-2.08,1.33,0.31
BJL5FH8,John Laing Environmental Asset Group (JLEN) NPV Share Price | JLEN,1.66,9.96,1.46,0.97
BJVDZ94,TwentyFour Select Monthly Income Fund Limited (SMIF) Ordinary 1p Share Price | SMIF,4.53,3.34,1.20,1.60
BK1PKQ9,Fidelity European Values plc (FEV) Ordinary 2.5p Share Price | FEV,-11.79,-8.85,0.93,0.46
BKZGVH6,JPMorgan American Investment Trust plc (JAM) Ordinary 5p Share Price | JAM,-4.70,-5.07,0.55,0.24
BLDYK61,Scottish Mortgage Investment Trust (SMT) Ordinary Shares 5p Share Price | SMT,2.91,1.69,0.37,0.10
BLSNND1,Fundsmith Emerging Equities Trust PLC (FEET) Ordinary Shares GBP0.01 Share Price | FEET,1.08,0.49,1.91,1.18
BMPHJ80,Sanditon Investment Trust plc (SIT) Ordinary 1p Share Price | SIT,-8.86,-4.59,1.21,2.35
BMTS0Z3,JPMorgan European Smaller Co IT plc (JESC) Ordinary 5p Share Price | JESC,-11.05,-8.76,1.13,0.95
BN56JF1,SQN Asset Finance Income Fund Ltd (SQN) Ordinary NPV Share Price | SQN,-6.73,-2.87,1.90,0.87
BNH7RK3,F&C Global Smaller Companies plc (FCSC) 3.5% Convertible Unsecured Loan Stock 31/07/19 Share Price | FCSC,,,,2.46
BP46PR0,JZ Capital Partners Limited (JZCC) 6% Convertible Unsecured Loan Stock 2021 Share Price | JZCC,,,,5.45
BR30MJ8,Harbourvest Global Private Equity (HVPE) Ordinary Shares Share Price | HVPE,-21.34,-17.87,0.68,0.48
BTLJYS4,Gabelli Value Plus + Trust plc (GVP) Ordinary 1p Share Price | GVP,-9.72,-4.95,1.33,1.61
BVFCRP1,Catco Reinsurance Opportunities Fund (CAT) Ord USD0.00013716 (DI) Share Price | CAT,-23.46,0.19,3.20,3.70
BVG1CF2,Woodford Patient Capital Trust PLC (WPCT) Ordinary Shares GBP 0.01 Share Price | WPCT,-11.21,-6.05,0.18,0.53
BWFGQ08,Miton UK Microcap Trust plc (MINI) Ordinary Shares 0.1p Share Price | MINI,-6.00,-3.97,1.58,2.97
BWXC7Y9,Fidelity Special Values (FSV) Ordinary 5p Share Price | FSV,1.27,-3.48,1.06,0.72
BY7R8K7,Schroder European Real Estate Investment Trust (SERE) Ordinary 10p Share Price | SERE,-1.85,-3.26,8.86,1.32
BYMJ7X4,Acorn Income Fund (AIFZ) Red Zero Div Pref GBP0.01 2022 Share Price | AIFZ,4.06,0.00,2.30,2.61
BYMKY69,JPMorgan Global Growth & Income plc (JPGI) Ordinary 5p Share Price | JPGI,0.10,1.45,1.23,0.62
BYP98L6,PGIT Securities 2020 plc (PGIZ) GBP0.01 ZDP Share Price | PGIZ,2.83,6.02,7.01,3.42
BYPBD39,Aberforth Split Level Income Trust plc (ASIT) Ord GBP0.01 Share Price | ASIT,-8.49,-4.09,0.00,5.58
BYPBD51,Aberforth Split Level Income Trust plc (ASIZ) ZDP GBP0.01 Share Price | ASIZ,5.25,0.05,0.00,1.83
BYRH498,Gresham House Strategic plc (GHS) Ordinary 50p Share Price | GHS,-23.73,-24.43,3.69,2.63
BYSRMH1,CC Japan Income & Growth Trust plc (CCJI) Ordinary Shares 1p Share Price | CCJI,1.40,2.87,1.25,1.20
BYT2554,Scotgems plc (SGEM) Ord GBP0.01 Share Price | SGEM,-5.44,1.96,0.77,4.21
BYTRG23,Marwyn Value Investors Ltd (MVI) Ordinary Shares GBP0.000001 Share Price | MVI,-34.28,-28.76,3.90,2.11
BYWWMM7,Leaf Clean Energy Co (LEAF) Ordinary  GBP0.0001 (DI) Share Price | LEAF,-63.22,-44.09,0.00,13.04
BYWYZ46,Sure Ventures (SURE) Ordinary Shares Share Price | SURE,,,,7.41
BYXP9G8,Better Capital PCC Ltd (BCAP) ORD GBP1.00 (POST RED 2009) Share Price | BCAP,-44.10,-50.89,0.21,6.06
BYXVT88,VinaCapital Vietnam Opportunity Fund Ltd (VOF) USD0.01 Share Price | VOF,-21.83,-18.23,4.44,0.59
BYXX8B0,GCP Asset Backed Income Fund Limited (GABI) Ordinary NPV Share Price | GABI,1.54,4.62,1.48,1.46
BYYJCZ9,Funding Circle SME (FCIF) NPV Share Price | FCIF,4.40,3.49,0.88,0.95
BYZQ1C9,UIL Finance Ltd ZDP 2026 (UTLH) RED ZERO DIV PREF 31/10/2026 GBP 0.10 Share Price | UTLH,2.02,0.00,1.55,2.42
BYZV3G2,Honeycomb Investment Trust plc (HONY) Ordinary 1p Share Price | HONY,9.37,15.62,2.32,0.89
BZ0RY03,JZ Capital Partners (JZCZ) Zero Div Red Pref NPV (2022) Share Price | JZCZ,9.71,0.00,4.78,1.83
BZ0XWD0,Menhaden Capital plc (MHN) Ordinary 100p Share Price | MHN,-21.82,-23.45,2.09,3.45
BZ3C3B9,Sherborne Investors C (SIGC) Ord NPV Share Price | SIGC,,,,2.94
BZ4BVN3,UIL Ltd (UTL) Ord 10 (DI) Share Price | UTL,-40.31,-39.10,1.55,2.35
BZ4BVP5,UIL Finance Ltd ZDP 2018 (UTLD) RED ZERO DIV PREF 31/10/2018 GBP0.05931 Share Price | UTLD,2.32,4.47,1.55,0.62
BZ4BVT9,UIL Finance Ltd ZDP 2020 (UTLE) Zero Dividend Preference 31/10/2020 Share Price | UTLE,8.97,13.13,1.55,1.39
BZ7MQD8,SDV 2025 ZDP PLC (SDVP) 0% DIV PREF GBP100 Share Price | SDVP,3.40,0.00,2.00,1.89
BZCNLL9,BB Healthcare Trust plc (BBH) Ord GBP0.01 Share Price | BBH,-0.07,2.53,1.38,0.40
