BNH7RK3,F&C Global Smaller Companies plc (FCSC) 3.5% Convertible Unsecured Loan Stock 31/07/19 Share Price | FCSC,,,,0.72
BP46PR0,JZ Capital Partners Limited (JZCC) 6% Convertible Unsecured Loan Stock 2021 Share Price | JZCC,,,,6.25
BR30MJ8,Harbourvest Global Private Equity (HVPE) Ordinary Shares Share Price | HVPE,-19.02,-16.26,0.34,0.32
BTLJYS4,Gabelli Value Plus + Trust plc (GVP) Ordinary 1p Share Price | GVP,-5.03,-3.45,1.33,1.52
BVG1CF2,Woodford Patient Capital Trust PLC (WPCT) Ordinary Shares GBP 0.01 Share Price | WPCT,-9.55,-4.44,0.18,0.47
BWFGQ08,Miton UK Microcap Trust plc (MINI) Ordinary Shares 0.1p Share Price | MINI,-2.10,-3.20,1.58,2.66
BWXC7Y9,Fidelity Special Values (FSV) Ordinary 5p Share Price | FSV,-5.26,-4.69,1.06,0.49
BYMJ7X4,Acorn Income Fund (AIFZ) Red Zero Div Pref GBP0.01 2022 Share Price | AIFZ,5.91,0.00,1.63,2.29
BYMKY69,JPMorgan Global Growth & Income plc (JPGI) Ordinary 5p Share Price | JPGI,2.61,-1.51,1.23,0.30
BYP98L6,PGIT Securities 2020 plc (PGIZ) GBP0.01 ZDP Share Price | PGIZ,5.32,6.70,4.04,2.56
BYPBD39,Aberforth Split Level Income Trust plc (ASIT) Ord GBP0.01 Share Price | ASIT,-7.96,-3.90,0.00,2.97
BYPBD51,Aberforth Split Level Income Trust plc (ASIZ) ZDP GBP0.01 Share Price | ASIZ,8.07,0.04,0.00,1.36
BYR8GK6,3i Infrastructure plc (3IN) Ord NPV Share Price | 3IN,19.54,10.47,1.51,0.34
BYSRMH1,CC Japan Income & Growth Trust plc (CCJI) Ordinary Shares 1p Share Price | CCJI,1.15,2.75,1.28,2.17
BYT2554,Scotgems plc (SGEM) Ord GBP0.01 Share Price | SGEM,-3.47,2.85,0.00,4.21
BYTRG23,Marwyn Value Investors Ltd (MVI) Ordinary Shares GBP0.000001 Share Price | MVI,-27.32,-30.37,3.90,3.68
BYW1DN2,GCP Asset Backed Income Fund Limited (GABC) C Shares Share Price | GABC,4.57,0.00,0.00,1.22
BYWWMM7,Leaf Clean Energy Co (LEAF) Ordinary  GBP0.0001 (DI) Share Price | LEAF,-46.94,-34.81,0.00,9.68
BYXVT88,VinaCapital Vietnam Opportunity Fund Ltd (VOF) USD0.01 Share Price | VOF,-20.24,-19.32,4.44,0.38
BYXX8B0,GCP Asset Backed Income Fund Limited (GABI) Ordinary NPV Share Price | GABI,4.39,7.18,1.89,1.19
BYYJCZ9,Funding Circle SME (FCIF) NPV Share Price | FCIF,1.63,3.40,0.88,1.45
BYZV3G2,Honeycomb Investment Trust plc (HONY) Ordinary 1p Share Price | HONY,14.36,12.28,2.28,2.98
BZ0RY03,JZ Capital Partners (JZCZ) Zero Div Red Pref NPV (2022) Share Price | JZCZ,11.24,0.00,4.78,2.52
BZ0XWD0,Menhaden Capital plc (MHN) Ordinary 100p Share Price | MHN,-23.91,-26.17,2.09,7.04
BZ3C3B9,Sherborne Investors C (SIGC) Ord NPV Share Price | SIGC,,,,1.87
BZ4BVN3,UIL Ltd (UTL) Ord 10 (DI) Share Price | UTL,-39.60,-40.86,1.24,5.36
BZ4BVP5,UIL Finance Ltd ZDP 2018 (UTLD) RED ZERO DIV PREF 31/10/2018 GBP0.05931 Share Price | UTLD,3.98,6.47,1.24,0.48
BZ4BVT9,UIL Finance Ltd ZDP 2020 (UTLE) Zero Dividend Preference 31/10/2020 Share Price | UTLE,13.22,12.48,1.24,1.72
BZCNLL9,BB Healthcare Trust plc (BBH) Ord GBP0.01 Share Price | BBH,3.32,2.13,0.00,0.85
