BBHX2H9,The Renewables Infrastructure Group Limited (TRIG) Ordinary Shares NPV Share Price | TRIG,7.66,9.44,1.09,0.39
BBM56V2,Aberdeen New Dawn Investment Trust plc (ABD) Ordinary 5p Shares Share Price | ABD,-13.48,-12.97,0.93,2.08
BCDP4K3,Taliesin Property Fund (TPFZ) Redeemable Zero Dividend Preference GBP1 Share Price | TPFZ,1.70,0.00,10.06,2.82
BCKFVJ4,Global Resources Investment Trust plc (GRIT) Ordinary Shares 1p Share Price | GRIT,-44.80,-43.59,7.56,6.86
BD0FRW6,NB Private Equity Partners Ltd (NBPP) 2022 Zero Dividend Preference Shares Share Price | NBPP,7.95,0.00,2.28,1.74
BD25J51,,,,,1.74
BD2YGN5,UIL Finance Limited ZDP 2022 (UTLF) RED ZERO DIV PREF 31/10/2022 GBP 0.0531 Share Price | UTLF,13.76,9.36,1.24,3.15
BD3QJR5,Foresight Solar Fund Ltd (FSFL) Ordinary NPV Share Price | FSFL,4.57,5.03,1.16,1.40
BD9PXH4,Aberdeen Standard European Logistics Income (ASLI) Ordinary Shares Share Price | ASLI,6.56,2.03,0.00,0.95
BD9X204,Vietnam Enterprise Investments Ltd (VEIL) Ord USD0.01(DI) Share Price | VEIL,-15.83,-13.94,0.00,0.64
BDG13K8,River & Mercantile UK Micro Cap Investment Company (RMMC) Redeemable Ord NPV (NOV 2017) Share Price | RMMC,11.42,-0.65,5.52,4.32
BDGKMY2,BioPharma Credit Investments (BPCR) Ord Share Price | BPCR,2.25,6.51,0.00,0.96
BDHXP96,Polar Capital Global Healthcare Trust plc (PGHZ) ZDP Share Price | PGHZ,2.14,0.00,1.48,1.90
BDR0575,Jupiter Emerging & Frontier Income Investment Tst (JEFI) Ord Share Price | JEFI,-2.34,2.62,0.00,3.60
BDZTXY7,UIL Finance Ltd ZDP 2024 (UTLG) RED ZDP 31/10/24 GBP(DI) Share Price | UTLG,5.22,4.23,1.24,1.86
BF03YC3,Henderson Diversified Income (HDIV) GBP0.01 Share Price | HDIV,-1.83,3.29,1.62,0.44
BF0SCX5,Downing Strat Micro-Cap Investment Trust plc (DSM) Ord GBP0.001 Share Price | DSM,-0.19,4.99,0.00,3.26
BFD3V96,Jupiter UK Growth Investment Trust plc (JUKG) Ordinary 5p Share Price | JUKG,-1.57,-2.28,1.20,2.60
BH7JH18,NB Distressed Debt Investment Fund (NBDG) Global Shares Share Price | NBDG,-13.62,-15.87,2.48,1.92
BJ0JVY0,NextEnergy Solar Fund Ltd (NESF) Ordinary NPV Share Price | NESF,6.49,7.27,1.28,0.45
BJL5F34,JPMorgan US Smaller Companies Investment Trust (JUSC) Ordinary 2.5p Shares Share Price | JUSC,2.00,-2.38,1.47,1.42
BJL5FH8,John Laing Environmental Asset Group (JLEN) NPV Share Price | JLEN,6.79,9.21,1.46,1.44
BJVDZ94,TwentyFour Select Monthly Income Fund Limited (SMIF) Ordinary 1p Share Price | SMIF,2.05,3.07,1.21,1.29
BK1PKQ9,Fidelity European Values plc (FEV) Ordinary 2.5p Share Price | FEV,-8.72,-9.11,0.99,0.66
BKZGVH6,JPMorgan American Investment Trust plc (JAM) Ordinary 5p Share Price | JAM,-2.05,-4.92,0.62,0.38
BLDYK61,Scottish Mortgage Investment Trust (SMT) Ordinary Shares 5p Share Price | SMT,0.14,2.29,0.44,0.18
BLSNND1,Fundsmith Emerging Equities Trust PLC (FEET) Ordinary Shares GBP0.01 Share Price | FEET,2.53,0.29,1.85,0.81
BMPHJ80,Sanditon Investment Trust plc (SIT) Ordinary 1p Share Price | SIT,-7.92,-1.32,1.21,2.41
BMTS0Z3,JPMorgan European Smaller Co IT plc (JESC) Ordinary 5p Share Price | JESC,-6.97,-10.26,1.13,1.45
BN56JF1,SQN Asset Finance Income Fund Ltd (SQN) Ordinary NPV Share Price | SQN,-9.11,3.46,1.90,0.89
BNH7RK3,F&C Global Smaller Companies plc (FCSC) 3.5% Convertible Unsecured Loan Stock 31/07/19 Share Price | FCSC,,,,2.16
BP46PR0,JZ Capital Partners Limited (JZCC) 6% Convertible Unsecured Loan Stock 2021 Share Price | JZCC,,,,6.25
BR30MJ8,Harbourvest Global Private Equity (HVPE) Ordinary Shares Share Price | HVPE,-17.90,-16.32,0.34,0.48
BTLJYS4,Gabelli Value Plus + Trust plc (GVP) Ordinary 1p Share Price | GVP,-2.74,-4.15,1.33,1.59
BVFCRP1,Catco Reinsurance Opportunities Fund (CAT) Ord USD0.00013716 (DI) Share Price | CAT,-12.51,1.89,3.20,2.53
BVG1CF2,Woodford Patient Capital Trust PLC (WPCT) Ordinary Shares GBP 0.01 Share Price | WPCT,-8.75,-5.21,0.18,0.76
BWFGQ08,Miton UK Microcap Trust plc (MINI) Ordinary Shares 0.1p Share Price | MINI,-3.15,-3.45,1.58,3.00
BWXC7Y9,Fidelity Special Values (FSV) Ordinary 5p Share Price | FSV,-3.35,-4.66,1.06,1.18
BY7R8K7,Schroder European Real Estate Investment Trust (SERE) Ordinary 10p Share Price | SERE,-12.35,-3.22,8.86,0.96
BYMJ7X4,Acorn Income Fund (AIFZ) Red Zero Div Pref GBP0.01 2022 Share Price | AIFZ,6.70,0.00,1.63,0.65
BYMKY69,JPMorgan Global Growth & Income plc (JPGI) Ordinary 5p Share Price | JPGI,3.21,-0.70,1.23,0.93
BYP98L6,PGIT Securities 2020 plc (PGIZ) GBP0.01 ZDP Share Price | PGIZ,6.16,6.51,4.04,3.36
BYPBD39,Aberforth Split Level Income Trust plc (ASIT) Ord GBP0.01 Share Price | ASIT,-4.24,-4.09,0.00,4.12
BYPBD51,Aberforth Split Level Income Trust plc (ASIZ) ZDP GBP0.01 Share Price | ASIZ,7.41,0.05,0.00,1.82
BYR8GK6,3i Infrastructure plc (3IN) Ord NPV Share Price | 3IN,14.92,10.47,1.51,0.30
BYRH498,Gresham House Strategic plc (GHS) Ordinary 50p Share Price | GHS,-26.21,-22.39,3.69,1.81
BYSRMH1,CC Japan Income & Growth Trust plc (CCJI) Ordinary Shares 1p Share Price | CCJI,2.88,2.89,1.25,3.73
BYT2554,Scotgems plc (SGEM) Ord GBP0.01 Share Price | SGEM,-9.37,1.96,0.00,5.49
BYTRG23,Marwyn Value Investors Ltd (MVI) Ordinary Shares GBP0.000001 Share Price | MVI,-24.16,-29.97,3.90,3.38
BYW1DN2,GCP Asset Backed Income Fund Limited (GABC) C Shares Share Price | GABC,3.41,0.00,0.00,1.96
BYWWMM7,Leaf Clean Energy Co (LEAF) Ordinary  GBP0.0001 (DI) Share Price | LEAF,-51.22,-34.81,0.00,7.41
BYWYZ46,Sure Ventures (SURE) Ordinary Shares Share Price | SURE,,,,6.25
BYXP9G8,Better Capital PCC Ltd (BCAP) ORD GBP1.00 (POST RED 2009) Share Price | BCAP,-45.41,-42.71,0.21,7.69
BYXVT88,VinaCapital Vietnam Opportunity Fund Ltd (VOF) USD0.01 Share Price | VOF,-17.05,-19.12,4.44,0.57
BYXX8B0,GCP Asset Backed Income Fund Limited (GABI) Ordinary NPV Share Price | GABI,3.69,6.48,1.89,0.96
BYYJCZ9,Funding Circle SME (FCIF) NPV Share Price | FCIF,3.47,3.04,0.88,1.44
BYZV3G2,Honeycomb Investment Trust plc (HONY) Ordinary 1p Share Price | HONY,11.49,13.40,2.28,0.88
BZ0RY03,JZ Capital Partners (JZCZ) Zero Div Red Pref NPV (2022) Share Price | JZCZ,11.07,0.00,4.78,2.28
BZ0XWD0,Menhaden Capital plc (MHN) Ordinary 100p Share Price | MHN,-22.76,-25.52,2.09,2.94
BZ3C3B9,Sherborne Investors C (SIGC) Ord NPV Share Price | SIGC,,,,2.78
BZ4BVN3,UIL Ltd (UTL) Ord 10 (DI) Share Price | UTL,-38.57,-40.40,1.24,2.96
BZ4BVP5,UIL Finance Ltd ZDP 2018 (UTLD) RED ZERO DIV PREF 31/10/2018 GBP0.05931 Share Price | UTLD,3.94,6.01,1.24,0.63
BZ4BVT9,UIL Finance Ltd ZDP 2020 (UTLE) Zero Dividend Preference 31/10/2020 Share Price | UTLE,11.01,12.70,1.24,1.40
BZ7MQD8,SDV 2025 ZDP PLC (SDVP) 0% DIV PREF GBP100 Share Price | SDVP,5.68,0.00,1.89,1.85
BZCNLL9,BB Healthcare Trust plc (BBH) Ord GBP0.01 Share Price | BBH,5.90,2.24,0.00,1.35
