epic,desc,pd,pd12,charge,spread
0005997,Aberdeen New Thai Investment Trust plc (ANW) Ordinary 25p Shares Share Price | ANW,-14.80,-15.37,1.41,0.35
0006655,Aberforth Smaller Companies Trust (ASL) Ordinary 1p Shares Share Price | ASL,-11.73,-12.68,0.76,0.14
0010076,Aberdeen Asian Smaller Companies Investment Trust (AAS) Ordinary 25p Share Price | AAS,-13.12,-13.99,1.17,0.48
0017505,F&C Global Smaller Companies plc (FCS) Ordinary 25p Shares Share Price | FCS,-1.59,0.09,0.61,0.75
0019772,Jupiter Euro Opportunities Trust (JEO) Ordinary 1p Shares Share Price | JEO,1.60,-1.94,0.99,0.53
0029362,North American Income Trust plc (NAIT) Ordinary 25p Shares Share Price | NAIT,-6.36,-7.66,0.98,1.63
0035392,City Natural Resources High Yield Trust plc (CYN) Ordinary 25p Shares Share Price | CYN,-19.86,-17.40,1.74,1.69
0038551,Biotech Growth Trust (The) (BIOG) Ordinary 25p Share Price | BIOG,-4.67,-5.32,1.10,2.03
0048583,Baillie Gifford Japan Trust plc (BGFD) Ordinary 5p Shares Share Price | BGFD,3.99,5.21,0.78,0.62
0060929,Athelney Trust (ATY) Ordinary 25p Share Price | ATY,-8.74,-7.37,2.76,7.75
0063326,Aurora Investment Trust plc (ARR) Ordinary 25p Share Price | ARR,0.56,1.55,0.80,0.95
0065311,British & American Investment Trust plc (BAF) Ordinary Shares GBP1 Share Price | BAF,90.70,108.93,6.63,13.33
0068417,SVM UK Emerging Fund plc (SVM) Ordinary 5p Share Price | SVM,-20.97,-25.86,1.26,4.76
0070627,Baillie Gifford Shin Nippon plc (BGS) Ordinary 10p Shares Share Price | BGS,9.53,6.81,0.90,0.63
0076700,Bankers Investment Trust plc (BNKR) Ordinary 25p Shares Share Price | BNKR,0.12,-2.35,0.44,0.12
0081168,Independent Investment Trust plc (IIT) Ordinary 25p Share Price | IIT,17.87,5.56,0.25,0.80
0121600,Henderson Alternative Strategies Trust (HAST) Ordinary 25p Shares Share Price | HAST,-19.77,-14.80,1.06,1.83
0129756,Aberdeen Diversified Income And Growth Trust (ADIG) Ordinary 25p Share Price | ADIG,-3.32,-4.96,0.23,1.23
0132077,JPMorgan Asian Investment Trust (JAI) Ordinary 25p Share Price | JAI,-11.04,-9.30,0.73,0.86
0133508,British Empire Trust plc (BTEM) Ordinary 10p Share Price | BTEM,-10.86,-10.40,0.86,0.14
0149000,Brunner Investment Trust plc (BUT) Ordinary 25p Shares Share Price | BUT,-10.26,-10.91,0.73,1.58
0163992,Caledonia Investments plc (CLDN) Ordinary 5p Share Price | CLDN,-19.67,-16.78,1.14,0.56
0170710,Canadian General Investments (CGI) Nil Par Value (CDI) Share Price | CGI,,,,3.70
0173861,Capital Gearing Trust plc (CGT) Ordinary 25p Shares Share Price | CGT,1.67,1.68,0.86,0.26
0174002,JPMorgan Japanese Investment Trust (JFJ) Ordinary 25p Share Price | JFJ,-7.96,-10.21,0.69,0.46
0199049,City Of London Investment Trust (CTY) Ordinary 25p Shares Share Price | CTY,2.55,1.79,0.42,0.12
0225847,Manchester & London Inv Tst plc (MNL) Ordinary 25p Share Price | MNL,-2.88,-9.24,0.96,1.97
0230852,Tiger Resource Finance (TIR) Ordinary 0.1p Share Price | TIR,-38.79,-25.74,32.18,66.67
0235761,JPMorgan Mid Cap Investment Trust plc (JMF) Ordinary 25p Shares Share Price | JMF,-4.30,-9.09,0.86,2.02
0262134,Chelverton Growth Trust (CGW) Ordinary 1p Share Price | CGW,-15.69,-16.40,4.04,10.14
0263104,New Star Investment Trust plc (NSI) Ordinary 1p Share Price | NSI,-27.57,-28.55,0.90,8.77
0291633,Edinburgh Worldwide Investment Trust (EWI) Ordinary 5p Share Price | EWI,3.02,-3.33,0.87,0.77
0294502,Edinburgh Dragon Trust plc (EFM) 20p Ordinary Shares Share Price | EFM,-12.41,-12.12,1.04,0.54
0295958,Standard Life UK Smaller Companies Trust plc (SLS) Ordinary 25p Shares Share Price | SLS,-6.14,-4.59,1.08,1.43
0305233,Edinburgh Investment Trust plc (EDIN) Ordinary 25p Shares Share Price | EDIN,-7.89,-7.05,0.60,0.30
0308544,Electra Private Equity plc (ELTA) Ordinary 25p Share Price | ELTA,-25.49,-12.33,3.70,0.36
0316581,JPMorgan Japan Smaller Companies Trust plc (JPS) Ordinary 10p Share Price | JPS,-11.73,-11.29,1.31,2.12
0322566,European Assets Trust Nv (EAT) EUR 0.46 (Regd) Share Price | EAT,0.57,0.78,1.06,1.21
0329200,ICG Enterprise Trust plc (ICGT) Ordinary 10p Shares Share Price | ICGT,-11.25,-15.38,1.28,1.48
0329501,European Investment Trust plc (EUT) Ordinary 25p Shares Share Price | EUT,-11.02,-10.53,0.59,1.09
0332231,Fidelity Asian Values (FAS) Ordinary 25p Share Price | FAS,-2.04,-4.90,1.29,1.27
0332855,Fidelity Japanese Values plc (FJV) Ordinary 25p Share Price | FJV,-7.90,-11.31,1.31,1.32
0338530,Worldwide Healthcare Trust plc (WWH) Ordinary 25p Share Price | WWH,0.98,0.54,1.38,0.21
0339072,Allianz Technology Trust (ATT) Ordinary 25p Share Price | ATT,1.51,-3.29,1.15,1.54
0340609,Dunedin Income Growth Investment Trust (DIG) Ordinary 25p Share Price | DIG,-9.60,-9.91,0.62,1.19
0341895,JPMorgan Emerging Markets IT plc (JMG) Ordinary 25p Share Price | JMG,-11.22,-12.26,1.07,0.35
0342218,JPMorgan Claverhouse Investment Trust plc (JCH) Ordinary 25p Share Price | JCH,-2.18,-5.90,0.79,0.54
0343501,JPMorgan Chinese Investment Trust plc (JMC) Ordinary 25p Share Price | JMC,-12.88,-12.23,1.38,2.39
0345035,JPMorgan Indian Investment Trust (JII) Ordinary 25p Share Price | JII,-12.71,-11.27,1.19,0.14
0346328,F & C Capital and Income Inv Trust (FCI) Ordinary 25p Shares Share Price | FCI,0.90,0.92,0.61,1.23
0346340,Jupiter US Smaller Companies plc (JUS) Ordinary 25p Shares Share Price | JUS,-11.47,-8.90,1.01,1.83
0346607,Foreign & Colonial Investment Trust plc (FRCL) Ordinary 25p Share Price | FRCL,-2.21,-5.33,0.53,0.16
0358572,INVESCO Income Growth Trust (IVI) Ordinary 25p Share Price | IVI,-12.38,-10.61,0.80,1.44
0365602,Witan Pacific Investment Trust (WPC) Ordinary 25p Shares Share Price | WPC,-14.58,-12.91,0.88,1.24
0370866,Troy Income & Growth Trust plc (TIGT) Ordinary 25p Share Price | TIGT,0.22,0.32,0.94,1.85
0388728,Gresham House (GHE) Ordinary 25p Share Price | GHE,4.46,0.00,6.91,1.46
0392075,Aberdeen Japan Investment Trust plc (AJIT) Ordinary 10p Share Price | AJIT,-13.44,-11.37,1.25,0.83
0392105,HG Capital Trust plc (HGT) Ordinary 25p Share Price | HGT,-3.92,-7.79,0.42,0.83
0414850,Pantheon International (PIN) 67p Ordinary Shares Share Price | PIN,-12.90,-16.86,1.13,0.53
0419929,Henderson Eurotrust plc (HNE) Ordinary 5p Share Price | HNE,-7.65,-3.73,0.87,1.36
0422002,Polar Capital Technology Trust plc (PCT) Ordinary 25p Share Price | PCT,-1.47,-0.43,1.01,0.18
0422864,Herald Investment Trust (HRI) Ordinary 25p Share Price | HRI,-13.06,-15.99,1.08,0.82
0435594,Artemis Alpha Trust plc (ATS) Ordinary 1p Share Price | ATS,-18.09,-18.97,0.91,2.14
0453530,Invesco Asia Trust plc (IAT) Ordinary 10p Share Price | IAT,-13.62,-11.61,1.02,1.08
0454351,Montanaro European Smaller Companies Trust plc (MTE) Ordinary 50p Share Price | MTE,-15.57,-11.12,1.25,2.52
0455934,International Biotechnology Trust (IBT) Ordinary 25p Shares Share Price | IBT,-4.68,-4.25,1.49,1.09
0465825,Investment Co plc (INV) Ordinary 50p Share Price | INV,-10.14,-10.16,2.55,4.24
0482943,Acorn Income Fund (AIF) Ordinary 25p Share Price | AIF,-6.46,-4.78,1.63,0.91
0491206,Keystone Investment Trust plc (KIT) Ordinary 50p Shares Share Price | KIT,-12.39,-10.62,0.62,0.87
0505840,BlackRock Latin American Investment Trust (BRLA) Ordinary Shares $0.10 Share Price | BRLA,-14.69,-13.16,1.19,0.84
0526885,Henderson European Focus Trust plc (HEFT) Ordinary 50p Shares Share Price | HEFT,-3.96,0.00,0.87,1.59
0532707,Blue Planet Investment Trust (BLP) Ordinary 1p Share Price | BLP,-5.31,-12.26,3.68,10.00
0536806,Lowland Investment Company plc (LWI) Ordinary 25p Shares Share Price | LWI,-6.00,-6.12,0.69,1.64
0537241,Martin Currie Global Portfolio Trust (MNP) Ordinary 5p Shares Share Price | MNP,-1.15,-0.75,0.69,0.43
0555522,Majedie Investments plc (MAJE) Ordinary 10p Shares Share Price | MAJE,-8.55,-10.67,1.09,2.70
0569512,Martin Currie Asia Unconstrained Trust plc (MCP) Ordinary 50p Shares Share Price | MCP,-13.27,-12.21,1.13,1.30
0577485,BlackRock World Mining Trust (BRWM) Ordinary 5p Share Price | BRWM,-12.31,-11.30,1.00,0.39
0577656,Dunedin Enterprise Investment Trust (DNE) Ordinary 25p Share Price | DNE,-14.39,-23.52,0.62,5.67
0579403,Mercantile Investment Trust Plc (MRC) Ordinary 25p Shares Share Price | MRC,-9.66,-9.66,0.48,0.24
0580007,Merchants Trust plc (MRCH) Ordinary 25p Share Price | MRCH,-3.31,-5.36,0.58,0.40
0596286,Mithras Investment Trust plc (MTH) Ordinary 2p Share Price | MTH,4.90,-8.26,3.43,5.26
0600756,Montanaro UK Smaller Cos Inv Tst plc (MTU) Ordinary 10p Share Price | MTU,-20.65,-19.14,1.24,1.41
0603959,Standard Life Equity Income Trust Plc (SLET) Ordinary 25p Shares Share Price | SLET,-1.40,-3.56,0.88,1.27
0604877,Aberdeen New India Investment Trust (ANII) Ordinary 25p Share Price | ANII,-14.45,-11.48,1.30,1.83
0610841,Schroder UK Mid Cap Fund (SCP) Ordinary 25p Share Price | SCP,-16.07,-16.03,0.93,1.12
0611112,Murray Income Trust plc (MUT) Ordinary 25p Shares Share Price | MUT,-7.85,-8.13,0.72,0.80
0611190,Murray International Trust plc (MYI) Ordinary 25p Shares Share Price | MYI,4.29,2.69,0.64,0.17
0643610,BlackRock Smaller Companies Trust (BRSC) Ordinary 25p Shares Share Price | BRSC,-10.23,-12.26,0.97,1.43
0643900,North Atlantic Smaller Cos Inv Tst (NAS) Ordinary 5p Share Price | NAS,-23.59,-19.46,1.12,2.24
0661582,Chelverton Small Companies Dividend Trust plc (SDV) Ordinary 25p Share Price | SDV,-5.76,-1.03,1.89,1.23
0666747,Pacific Horizon Investment Trust plc (PHI) Ordinary 10p Shares Share Price | PHI,-1.07,-7.86,1.07,0.86
0667438,Pacific Assets Trust (PAC) Ordinary 12.5p Share Price | PAC,-4.66,-2.51,1.25,1.58
0679842,Perpetual Income & Growth Inv Tst (PLI) Ordinary 10p Share Price | PLI,-10.02,-8.50,0.65,0.14
0682754,Personal Assets Trust plc (PNL) GBP12.50 Ordinary Shares Share Price | PNL,1.96,1.20,0.95,0.38
0736639,RIT Capital Partners plc (RCP) Ordinary GBP1 Share Price | RCP,5.94,5.98,1.05,0.20
0739207,Rights & Issues Investment Trust plc (RIII) Inc 25p Share Price | RIII,-8.87,-10.08,0.45,2.87
0741600,JPMorgan Smaller Companies Investment Trust (JMI) Ordinary 25p Shares Share Price | JMI,-18.00,-17.76,1.12,0.44
0781606,Finsbury Growth & Income Trust plc (FGT) Ordinary 25p Shares Share Price | FGT,1.12,0.60,0.73,0.13
0782609,Scottish Investment Trust plc (SCIN) Ordinary 25p Shares Share Price | SCIN,-8.47,-8.78,0.47,0.24
0783613,Scottish Oriental Smaller Cos Trust (SST) Ordinary 25p Share Price | SST,-12.51,-11.40,1.18,0.81
0787369,Scottish American Investment Co plc (SCAM) Ordinary 25p Shares Share Price | SCAM,4.85,4.39,0.80,1.10
0787972,Hansa Trust plc (HAN) Ordinary 5p Share Price | HAN,-28.28,-28.11,1.09,4.00
0787983,Hansa Trust plc (HANA) A Non Voting Ordinary 5p Share Price | HANA,-28.60,-29.56,1.09,1.02
0791348,Schroder UK Growth Fund (SDU) Ordinary 25p Share Price | SDU,-9.77,-12.32,0.63,0.81
0791586,Schroder Income Growth Fund (SCF) Ordinary 10p Share Price | SCF,-7.21,-7.80,0.95,1.04
0791887,Schroder Asia Pacific Fund (SDP) Ordinary 10p Share Price | SDP,-9.99,-10.83,0.99,0.67
0802284,Schroder Japan Growth Fund (SJG) Ordinary 10p Share Price | SJG,-7.28,-6.99,1.00,0.48
0805250,Shires Income (SHRS) Ordinary 50p Shares Share Price | SHRS,0.07,-5.86,1.04,1.83
0806372,Aberdeen Smaller Companies Income Trust plc (ASCI) Ordinary 50p Share Price | ASCI,-14.83,-16.72,1.39,3.06
0848471,Value & Income Trust plc (VIN) Ordinary 10p Shares Share Price | VIN,-15.50,-16.97,1.42,2.93
0852814,JPMorgan Elect Plc (JPE) Managed Growth Shares 0.00431577p Share Price | JPE,-2.86,-2.42,0.55,0.63
0853657,Henderson Opportunities Trust Plc (HOT) Ordinary 25p Share Price | HOT,-17.58,-17.25,1.88,1.94
0871079,Schroder Asian Total Return Investment Company plc (ATR) Ordinary 5p Share Price | ATR,2.79,0.14,2.68,1.42
0876999,Seneca Global Income & Growth Trust plc (SIGT) Ordinary 25p Share Price | SIGT,0.85,1.26,1.59,0.58
0882532,Temple Bar Investment Trust plc (TMPL) Ordinary 25p Shares Share Price | TMPL,-4.38,-4.83,0.49,0.31
0882929,Templeton Emerging Markets Inv Tst plc (TEM) Ordinary 25p Share Price | TEM,-13.20,-12.30,1.21,0.14
0891055,BlackRock Throgmorton Trust plc (THRG) Ordinary 5p Shares Share Price | THRG,-11.49,-15.17,2.16,1.18
0906409,TR Property Investment Trust plc (TRY) Ordinary 25p Share Price | TRY,-0.63,-5.29,0.87,0.25
0906506,Henderson Smaller Cos Investment Trust plc (HSL) Ordinary 25p Shares Share Price | HSL,-12.47,-13.19,1.01,1.36
0906692,TR European Growth Trust (TRG) Ordinary 12.5p Share Price | TRG,-9.54,-3.99,1.55,1.15
0958057,Henderson High Income Trust plc (HHI) Ordinary 5p Shares Share Price | HHI,-0.53,-0.70,0.75,1.10
0974406,Witan Investment Trust (WTAN) Ordinary 25p Share Price | WTAN,-1.72,-2.09,0.86,0.19
0981536,Lazard World Trust Fund (WTR) Shs USD0.20 Share Price | WTR,-7.05,-8.90,1.35,1.66
3047468,Standard Life Private Equity Trust plc (SLPE) Ordinary 0.002 Share Price | SLPE,-17.19,-12.34,1.29,2.17
3051726,Monks Investment Trust (MNKS) Ordinary 5p Share Price | MNKS,3.53,1.01,0.59,0.13
3073827,F & C Private Equity Trust (FPEO) Ordinary 1p Share Price | FPEO,1.83,-4.74,2.00,1.96
3096169,BlackRock Income & Growth Investment Trust plc (BRIG) Ordinary 1p Share Price | BRIG,-2.45,-2.47,1.08,2.00
3123249,Impax Environmental Markets plc (IEM) Ordinary 10p Share Price | IEM,-5.93,-9.27,1.05,0.78
3133691,Establishment Investment Trust (The) (ET.) Ordinary 25p Share Price | ET.,-15.58,-18.33,1.22,3.85
3142921,Law Debenture Corporation (LWDB) Ordinary 5p Share Price | LWDB,-9.46,-8.70,0.43,1.35
3197794,Lindsell Train Investment Trust plc (The) (LTI) Ordinary 75p Share Price | LTI,40.65,20.68,3.68,1.88
3216473,JPMorgan Russian Securities (JRS) Ordinary 1p Share Price | JRS,-14.52,-15.53,1.26,1.67
3227334,Baring Emerging Europe (BEE) Ordinary 10p Share Price | BEE,-12.16,-11.74,1.42,0.53
3353790,Premier Global Infrastructure plc (PGIT) Ordinary 1p Share Price | PGIT,-10.60,-8.65,7.01,3.10
3369872,Conygar Investment Company plc (CIC) Ordinary 5p Share Price | CIC,-11.21,0.00,7.54,1.33
3386257,EP Global Opportunities Trust (EPG) Ord GBP0.01 Share Price | EPG,-7.65,-5.73,0.92,1.62
3408009,JPMorgan Elect Plc (JPEC) Managed Cash Shares 0.01p Share Price | JPEC,-1.55,-1.30,0.02,4.85
3408021,JPMorgan Elect Plc (JPEI) Managed Income Shares 0.003p Share Price | JPEI,-2.34,-2.68,0.71,3.51
3436594,Miton Global Opportunities plc (MIGO) Ord 1p Share Price | MIGO,-0.85,-0.55,1.34,0.74
B018CS4,Ruffer Investment Co Ltd (RICA) Red Ptg Preference Shares Share Price | RICA,1.21,2.24,1.16,0.87
B01RDH7,BlackRock Greater Europe Investment Trust (BRGE) Ord 0.1p Shares Share Price | BRGE,-5.74,-4.47,1.10,1.54
B05NYM3,INVESCO Perpetual Enhanced Income Limited (IPE) Ordinary 5p Share Price | IPE,7.88,4.78,2.16,0.99
B06CZD7,Energiser Investments Plc (ENGI) Ord 0.1p Share Price | ENGI,-31.51,28.42,6.94,33.33
B06GJ37,Dolphin Capital Investors Ltd (DCI) Common Shares EUR0.01 Share Price | DCI,-64.22,-71.43,0.00,6.67
B073G36,Trading Emissions plc (TRE) Ordinary 1p Share Price | TRE,-16.84,-60.57,11.85,16.28
B08N4M0,Livermore Investments Group Ltd (LIV) Ord NPV Share Price | LIV,-36.26,-24.06,4.90,8.89
B08S4K3,Northern Investors Company (NRI) Ord 25p Share Price | NRI,-5.53,11.74,5.75,5.22
B09G3N2,Securities Trust of Scotland (STS) Ord Red 1p Share Price | STS,-6.93,-6.59,0.96,0.31
B0BDCB2,Strategic Equity Capital plc (SEC) Ordinary GBP 0.10 Share Price | SEC,-15.19,-13.65,2.42,1.35
B0BN1P9,BlackRock Emerging Europe plc (BEEP) Ordinary USD0.10 Share Price | BEEP,-6.16,-6.73,1.16,3.55
B0CRWN5,Schroder Oriental Income Fund (SOI) Ordinary 1p Share Price | SOI,1.75,0.82,1.95,1.20
B0HW536,Real Estate Credit Investments Ltd (RECI) Ord NPV Share Price | RECI,-1.89,1.84,2.29,0.93
B0LCW20,Picton Property Income Limited (PCTN) Ord NPV Share Price | PCTN,0.08,-2.67,2.47,1.01
B0N8MF9,BlackRock Commodities Income Investment Trust (BRCI) Ordinary 1p Share Price | BRCI,-4.88,-4.54,1.36,0.77
B0P6J83,Aberdeen Asian Income Fund (AAIF) Ordinary NPV Shares Share Price | AAIF,-9.53,-7.39,1.19,1.44
B0P8RJ6,India Capital Growth Fund Ltd (IGC) Ord GBp0.01 Share Price | IGC,-9.23,-14.13,2.21,0.49
B0T4LH6,HICL Infrastructure Company Ltd (HICL) Ordinary GBP 0.0001 Share Price | HICL,-4.24,3.10,1.18,0.07
B0XLRJ7,B.P Marsh & Partners (BPM) Ord GBP0.10 Share Price | BPM,-17.11,-23.85,3.51,2.34
B11V7W9,Alliance Trust plc (ATST) Ordinary 2.5p Shares Share Price | ATST,-5.73,-5.58,0.62,0.14
B120GL7,Jupiter Green Investment Trust (JGC) Ord Shares GBP0.1 Share Price | JGC,-4.55,-4.91,1.57,1.61
B12MHD2,LMS Capital plc (LMS) Ordinary 10p Share Price | LMS,-36.26,-37.48,3.85,3.60
B13YVW4,Highbridge Multi-Strategy Fund Limited (HMSF) Ordinary NPV GBP Share Price | HMSF,-0.10,-1.28,0.31,0.67
B1436N6,Macau Property Opportunities Fund (MPO) Ord Usd0.01 Share Price | MPO,-18.39,-32.50,5.03,3.55
B15FW33,Geiger Counter Ltd (GCL) NPV Share Price | GCL,4.48,1.35,3.12,2.63
B15PV03,Middlefield Canadian Inc - GBP PC (MCT) Part Pref Shs Npv Share Price | MCT,-12.16,-10.30,1.26,2.15
B16GQJ9,South African Property Opportunities PLC (SAPO) Ord 1p Share Price | SAPO,999.00,62.50,37.71,62.50
B17XWW4,JPMorgan European Investment Trust (JETI) 2.06155p Income Shares Share Price | JETI,-9.44,-7.88,1.10,2.82
B188SR5,International Public Partnerships Limited (INPP) Ord GBP0.01 Share Price | INPP,1.37,8.51,1.14,0.14
B18JK16,JPMorgan European Investment Trust (JETG) 3.97p Growth Shares Share Price | JETG,-10.62,-8.81,1.07,1.66
B19Z2J5,UK Commercial Property Trust (UKCM) Ordinary 25p Shares Share Price | UKCM,-2.37,-1.06,1.43,0.11
B1DPVL6,Invesco Perpetual Select Trust (IVPU) UK Equity Shares 1p Share Price | IVPU,-2.93,-1.32,1.38,1.09
B1DQ647,Invesco Perpetual Select Trust (IVPG) Global Equity Income Shares 1p Share Price | IVPG,-1.39,-1.20,0.98,0.99
B1DQ669,Invesco Perpetual Select Trust (IVPB) Balanced Risk Shares 1p Share Price | IVPB,-1.56,-1.30,1.20,2.84
B1DQ670,Invesco Perpetual Select Trust (IVPM) Managed Liquidity Shares 1p Share Price | IVPM,-1.31,-1.47,0.40,1.94
B1DVQL9,MedicX Fund Ltd (MXF) Ord Npv Share Price | MXF,22.24,32.68,3.47,1.00
B1FL3C7,Invesco Perpetual UK Smaller Cos Inv Tst (IPU) Ord 20p Share Price | IPU,-4.64,-5.35,1.27,1.15
B1G9T99,Golden Prospect Precious Metals Ltd (GPM) Ord Gbp0.001 Share Price | GPM,-20.18,-15.48,3.16,4.84
B1GCL25,Dunedin Smaller Companies Investment Trust (DNDL) Ordinary 5p Share Price | DNDL,-18.40,-17.95,1.36,1.82
B1GJQ98,Global Fixed Income Realisation Ltd (GFIR) Ordinary NPV GBP Share Price | GFIR,-30.51,-46.88,2.48,16.00
B1GXH75,Henderson Far East Income Ltd (HFEL) Ordinary NPV Share Price | HFEL,1.86,1.76,1.12,1.38
B1LZS51,CQS New City High Yield Fund Ltd (NCYF) Ord NPV Share Price | NCYF,5.97,5.47,1.21,0.98
B1N4G29,F&C UK High Income Trust (FHI) Ordinary 0.1p Shares Share Price | FHI,-8.41,-6.69,1.09,2.04
B1N4H59,F&C UK High Income Trust (FHIB) Ordinary 0.1p B Shares Share Price | FHIB,-8.30,-6.65,1.09,2.04
B1N4H93,F&C UK High Income Trust (FHIU) Units (3 Ord 0.1p Shares and 1 Ord B Share) Share Price | FHIU,-9.09,-6.79,1.02,1.55
B1NNWQ2,Cambium Global Timberland Ltd (TREE) Ord NPV Share Price | TREE,-43.96,-53.32,0.20,2.56
B1NP514,BH Macro Ltd (GBP) (BHMG) Ord NPV Share Price | BHMG,-9.50,-8.39,4.75,0.20
B1NPGV1,BH Macro Ltd (USD) (BHMU) Ordinary NPV Share Price | BHMU,-9.26,-5.94,4.75,2.97
B1W59J1,Aberdeen Frontier Markets Investment Company Ltd (AFMC) Ordinary NPV Share Price | AFMC,-9.56,-7.63,2.01,2.48
B1XH2B9,Dragon Ukrainian Properties & Development plc (DUPD) Ordinary 1p Share Price | DUPD,-62.91,-58.04,5.08,16.67
B1YQ6R9,Third Point Offshore Investors Ltd (TPOG) Ordinary NPV GBP Share Price | TPOG,-13.52,-16.80,2.45,3.07
B1YQ721,Third Point Offshore Investors Ltd (TPOU) Ordinary NPV USD Share Price | TPOU,-16.37,-12.19,2.45,0.91
B1YW440,3i Group Plc (III) Ordinary 73 19/22p Share Price | III,30.91,36.88,2.15,0.07
B1Z2SL4,Crystal Amber Fund Ltd (CRS) Ordinary 1p Share Price | CRS,-6.61,-1.80,3.08,1.90
B23DL39,Oakley Capital Investments Ltd (OCI) Ordinary 1p Share Price | OCI,-32.07,-30.51,1.34,2.38
B28Y104,Volta Finance Ltd (VTA) NPV Share Price | VTA,,,,1.71
B28ZZS3,Tetragon Financial Group Ltd (TFG) USD0.001 Share Price | TFG,,,,1.16
B28ZZX8,NB Private Equity Partners Ltd (NBPE) Ordinary USD0.01 Share Price | NBPE,-18.90,-17.63,2.85,1.66
B29LSW5,Juridica Investments LD (JIL) Ord NPV Share Price | JIL,-23.31,-43.03,7.36,3.33
B2PP252,F&C Managed Portfolio Trust plc (FMPG) Growth Shares 10p Share Price | FMPG,0.84,1.25,0.95,2.00
B2PP3J3,F&C Managed Portfolio Trust Plc (FMPI) Income Shares 10p Share Price | FMPI,0.63,1.72,1.10,2.22
B2QQPS8,BH Global Ltd (BHGU) Ordinary Shares USD NPV Share Price | BHGU,-7.56,-5.93,3.17,2.88
B2QQPT9,BH Global Ltd (BHGG) Ord GBP NPV Share Price | BHGG,-6.83,-8.53,3.17,0.36
B39VMM0,Boussard & Gavaudan Holding Ltd (BGHS) Ord Eur0.0001 (Stg) Share Price | BGHS,-17.83,-18.30,3.32,9.34
B3BTVQ9,Oryx International Growth Fund (OIG) Ordinary 50p Share Price | OIG,-17.04,-17.75,1.65,2.56
B3KX4Q3,NB Global Floating Rate Income Fund Ltd (NBLS) Redeemable Ordinary NPV GBP Share Price | NBLS,-3.60,-2.67,0.92,0.11
B3P7S35,NB Global Floating Rate Income Fund Ltd (NBLU) Redeemable Ordinary NPV USD Share Price | NBLU,-3.44,-1.64,0.92,1.04
B3PHCS8,Henderson International Income Trust plc (HINT) Ord GBP0.01 Share Price | HINT,-0.08,0.92,0.90,0.63
B3SXM83,BlackRock Frontiers Investment Trust (BRFI) Ordinary 1p Share Price | BRFI,0.81,3.05,1.68,2.16
B3Z6252,Doric Nimrod Air Two Ltd (DNA2) Ordinary Preference NPV Share Price | DNA2,28.57,25.11,14.20,3.67
B403HK5,JZ Capital Partners Ltd (JZCP) Ordinary NPV Shares Share Price | JZCP,-30.60,-30.78,4.78,1.61
B44ZTP6,Aberdeen Latin American Income Fund (ALAI) Ord NPV Share Price | ALAI,-13.48,-12.85,1.99,2.25
B45L2K9,Aberdeen Emerging Markets Investment Company Ltd (AEMC) Ordinary 1p Shares Share Price | AEMC,-11.54,-12.58,1.08,2.30
B4L0PD4,Genesis Emerging Markets Fund Ltd (GSS) Ptg NPV Share Price | GSS,-12.68,-12.67,1.43,0.44
B4MF389,Doric Nimrod Air One Ltd (DNA) Ordinary Preference NPV Share Price | DNA,-0.59,6.17,1.37,4.85
B4MFKH7,LXB Retail Properties Plc (LXB) Ord NPV Share Price | LXB,-23.27,-4.73,99.00,9.01
B4N1RV7,Better Capital PCC Ltd (BC12) Ordinary GBP1.00 (2012) Share Price | BC12,-47.09,-25.04,0.28,8.00
B4ZPCJ0,F&C Commercial Property Trust Ltd (FCPT) Ord 1p Share Price | FCPT,4.17,1.95,1.22,0.14
B4ZWPH0,John Laing Infrastructure Fund Ltd (JLIF) Ord GBP0.0001 Share Price | JLIF,-4.87,3.72,1.48,0.18
B5ZZY91,JPMorgan Global Emerging Markets Income Trust (JEMI) Ord 1p Share Price | JEMI,-4.72,-2.92,1.30,1.96
B602HS4,JPMorgan Brazil Investment Trust (JPB) Ordinary 1p Share Price | JPB,-14.26,-14.68,1.99,5.19
B6116N8,Alcentra European Floating Rate Income Fund (AEFS) Red Ord Npv Gbp Share Price | AEFS,-6.27,-4.26,0.98,0.61
B6173J1,GCP Infrastructure Investments Ltd (GCP) Ordinary 1p Share Price | GCP,6.81,13.32,1.09,0.17
B61ND55,Atlantis Japan Growth Fund (AJG) Ordinary NPV Share Price | AJG,-4.62,-8.25,1.53,0.88
B62Z3C7,Fidelity China Special Situations PLC (FCSS) Ordinary Shares 1p Share Price | FCSS,-13.68,-12.41,1.16,0.64
B65TLW2,Diverse Income Trust plc (The) (DIVI) Ordinary 0.1p Share Price | DIVI,-3.09,-1.07,1.17,1.39
B6686L2,Baker Steel Resources Trust Ltd (BSRT) Ord Npv Share Price | BSRT,-18.83,-21.10,2.17,2.60
B6832P1,Polar Capital Global Healthcare Trust plc (PCGH) Ordinary 25p Shares Share Price | PCGH,-8.56,-2.06,1.50,1.10
B6QWXM4,BBGI Sicav SA (BBGI) Ord NPV (DI) Share Price | BBGI,7.19,10.10,1.28,0.38
B6RMDP6,City Merchants High Yield Trust Ltd (CMHY) Ordinary NPV Share Price | CMHY,1.97,0.50,1.03,0.77
B6T0TM7,,,,,0.77
B6VTTK0,Mid Wynd International Investment Trust Plc (MWY) ORD GBP0.05 Share Price | MWY,1.10,1.24,0.67,0.82
B6WC674,Secure Property Development & Investment plc (SPDI) Ordinary EUR0.01 Share Price | SPDI,0.00,0.00,6.43,23.08
B6YVTS1,City Natural Resources High Yield Trust plc (CYNC) 3.5% Convertible Unsecured Loan Stock Share Price | CYNC,,,,2.94
B79WC10,Starwood European Real Estate Fin Ltd (SWEF) Ordinary NPV Share Price | SWEF,7.08,7.88,1.21,0.47
B7VSCF0,All Asia Asset Capital Limited (AAA) Ordinary NPV Share Price | AAA,272.34,272.34,6.07,44.44
B7W0XJ6,Blackrock North American Income Trust plc (BRNA) Ord 1p Shares Share Price | BRNA,-5.12,-6.45,1.08,1.94
B7ZMLM8,Aberdeen Asian Smaller Companies Investment Trust (AASC) 3.5% Convertible Unsecured Loan Stock Share Price | AASC,,,,2.78
B8C23S8,ICG-Longbow Senior Secured UK Property Debt Invest (LBOW) Ordinary NPV Share Price | LBOW,3.41,0.73,1.62,1.45
B8P59C0,Syncona Limited (SYNC) Ordinary NPV Share Price | SYNC,30.97,22.68,1.45,0.10
B8SC6K5,Greencoat UK Wind plc (UKW) Ordinary 1p Share Price | UKW,10.39,10.38,1.94,0.17
B90J5Z9,Twentyfour Income Fund Ltd (TFIF) Ordinary GBP 0.01 Share Price | TFIF,5.74,2.25,1.01,0.81
B92LHN5,Doric Nimrod Air Three Ltd (DNA3) Ordinary Preference Shares NPV Share Price | DNA3,51.75,41.73,0.81,2.88
B96SW59,JPMorgan Global Convertibles Income Fund Limited (JGCI) Ordinary NPV Share Price | JGCI,-1.48,-2.47,0.99,1.03
B986V54,Adams Plc (ADA) Ordinary Eur0.01 Share Price | ADA,53.58,91.97,88.27,50.00
B99R1Q7,Inland ZDP plc (INLZ) Zero Dividend Preference Shares 2019 10p Share Price | INLZ,0.00,0.00,7.41,3.27
B9MRHZ5,CVC Credit Partners European Opportunities Ltd (CCPG) Ordinary NPV GBP Share Price | CCPG,1.45,0.93,0.59,0.88
B9XQT11,Polar Capital Global Financials Trust (PCFT) Ordinary Shares Share Price | PCFT,-2.95,-5.07,1.00,1.09
BB0RDB9,Bluefield Solar Income Fund Limited (BSIF) Ordinary Shares NPV Share Price | BSIF,5.34,5.83,1.12,0.86
BBHX2H9,The Renewables Infrastructure Group Limited (TRIG) Ordinary Shares NPV Share Price | TRIG,4.61,8.59,0.12,0.19
BBM56V2,Aberdeen New Dawn Investment Trust plc (ABD) Ordinary 5p Shares Share Price | ABD,-12.53,-12.77,0.93,0.85
BCDP4K3,Taliesin Property Fund (TPFZ) Redeemable Zero Dividend Preference GBP1 Share Price | TPFZ,1.27,0.00,10.06,1.41
BCKFVJ4,Global Resources Investment Trust plc (GRIT) Ordinary Shares 1p Share Price | GRIT,-34.26,-42.44,7.56,4.76
BD0FRW6,NB Private Equity Partners Ltd (NBPP) 2022 Zero Dividend Preference Shares Share Price | NBPP,6.17,0.00,2.85,1.75
