BD2YGN5,UIL Finance Limited ZDP 2022 (UTLF) RED ZERO DIV PREF 31/10/2022 GBP 0.0531 Share Price | UTLF,12.39,11.20,1.24,2.36
BD3QJR5,Foresight Solar Fund Ltd (FSFL) Ordinary NPV Share Price | FSFL,0.08,4.62,1.17,0.47
BD45S96,Utilico Emerging Markets Trust plc (UEM) Ordinary GBP 0.01 Share Price | UEM,-11.73,-11.63,2.82,1.86
BD5G638,,,,,1.86
BD9PXH4,Aberdeen Standard European Logistics Income (ASLI) Ordinary Shares Share Price | ASLI,8.33,2.03,0.00,0.47
BD9X204,Vietnam Enterprise Investments Ltd (VEIL) Ord USD0.01(DI) Share Price | VEIL,-17.72,-13.03,2.23,0.84
BDG13K8,River & Mercantile UK Micro Cap Investment Company (RMMC) Redeemable Ord NPV (NOV 2017) Share Price | RMMC,-10.87,0.37,5.52,3.91
BDGKMY2,BioPharma Credit Investments (BPCR) Ord Share Price | BPCR,4.66,7.08,0.00,0.96
BDHXP96,Polar Capital Global Healthcare Trust plc (PGHZ) ZDP Share Price | PGHZ,2.53,0.00,1.48,1.89
BDR0575,Jupiter Emerging & Frontier Income Investment Tst (JEFI) Ord Share Price | JEFI,-0.54,2.62,0.00,2.78
BDZTXY7,UIL Finance Ltd ZDP 2024 (UTLG) RED ZDP 31/10/24 GBP(DI) Share Price | UTLG,3.76,4.23,1.24,1.40
BF03YC3,Henderson Diversified Income (HDIV) GBP0.01 Share Price | HDIV,4.66,3.37,1.62,1.94
BF0SCX5,Downing Strat Micro-Cap Investment Trust plc (DSM) Ord GBP0.001 Share Price | DSM,0.87,4.99,0.00,2.17
BF1F1F0,JPEL Private Equity Ltd PRF PERPETUAL USD 0.0001 Share Price,-12.47,-12.10,1.86,3.33
BF5FX16,,,,,3.33
BFD3V96,Jupiter UK Growth Investment Trust plc (JUKG) Ordinary 5p Share Price | JUKG,-2.56,-2.19,1.20,1.90
BFWJJT1,JPMorgan Multi-Asset Trust (MATE) Ordinary Shares Share Price | MATE,-7.58,0.00,0.00,5.15
BH7JH18,NB Distressed Debt Investment Fund (NBDG) Global Shares Share Price | NBDG,-14.06,-15.77,2.48,1.89
BJ0JVY0,NextEnergy Solar Fund Ltd (NESF) Ordinary NPV Share Price | NESF,6.70,7.92,1.28,0.90
BJL5F34,JPMorgan US Smaller Companies Investment Trust (JUSC) Ordinary 2.5p Shares Share Price | JUSC,-3.62,-2.65,1.33,0.73
BJL5FH8,John Laing Environmental Asset Group (JLEN) NPV Share Price | JLEN,4.62,9.96,1.46,0.98
BJVDZ94,TwentyFour Select Monthly Income Fund Limited (SMIF) Ordinary 1p Share Price | SMIF,4.52,3.26,1.20,0.90
BK1PKQ9,Fidelity European Values plc (FEV) Ordinary 2.5p Share Price | FEV,-11.00,-8.59,0.93,0.24
BKZGVH6,JPMorgan American Investment Trust plc (JAM) Ordinary 5p Share Price | JAM,-5.85,-5.04,0.55,0.13
BLDYK61,Scottish Mortgage Investment Trust (SMT) Ordinary Shares 5p Share Price | SMT,2.97,1.65,0.44,0.09
BLSNND1,Fundsmith Emerging Equities Trust PLC (FEET) Ordinary Shares GBP0.01 Share Price | FEET,2.20,0.56,1.91,2.02
BMPHJ80,Sanditon Investment Trust plc (SIT) Ordinary 1p Share Price | SIT,-8.94,-3.80,1.21,2.84
BMTS0Z3,JPMorgan European Smaller Co IT plc (JESC) Ordinary 5p Share Price | JESC,-9.62,-9.00,1.13,1.95
BN56JF1,SQN Asset Finance Income Fund Ltd (SQN) Ordinary NPV Share Price | SQN,-2.85,-0.95,1.90,1.26
BNH7RK3,F&C Global Smaller Companies plc (FCSC) 3.5% Convertible Unsecured Loan Stock 31/07/19 Share Price | FCSC,,,,1.50
BP46PR0,JZ Capital Partners Limited (JZCC) 6% Convertible Unsecured Loan Stock 2021 Share Price | JZCC,,,,6.25
BR30MJ8,Harbourvest Global Private Equity (HVPE) Ordinary Shares Share Price | HVPE,-18.93,-16.17,0.34,0.33
BTLJYS4,Gabelli Value Plus + Trust plc (GVP) Ordinary 1p Share Price | GVP,-8.23,-4.48,1.33,1.67
BVFCRP1,Catco Reinsurance Opportunities Fund (CAT) Ord USD0.00013716 (DI) Share Price | CAT,-13.64,0.32,3.20,1.35
BVG1CF2,Woodford Patient Capital Trust PLC (WPCT) Ordinary Shares GBP 0.01 Share Price | WPCT,-2.53,-6.16,0.18,0.59
BWFGQ08,Miton UK Microcap Trust plc (MINI) Ordinary Shares 0.1p Share Price | MINI,-4.61,-3.86,1.58,3.03
BWXC7Y9,Fidelity Special Values (FSV) Ordinary 5p Share Price | FSV,-4.48,-3.81,1.06,0.78
BY7R8K7,Schroder European Real Estate Investment Trust (SERE) Ordinary 10p Share Price | SERE,-8.86,-3.26,8.86,1.81
BYMJ7X4,Acorn Income Fund (AIFZ) Red Zero Div Pref GBP0.01 2022 Share Price | AIFZ,4.86,0.00,1.63,1.96
BYMKY69,JPMorgan Global Growth & Income plc (JPGI) Ordinary 5p Share Price | JPGI,2.81,1.01,1.23,0.32
BYP98L6,PGIT Securities 2020 plc (PGIZ) GBP0.01 ZDP Share Price | PGIZ,3.38,6.12,7.01,3.42
BYPBD39,Aberforth Split Level Income Trust plc (ASIT) Ord GBP0.01 Share Price | ASIT,-6.80,-4.09,0.00,7.63
BYPBD51,Aberforth Split Level Income Trust plc (ASIZ) ZDP GBP0.01 Share Price | ASIZ,5.68,0.05,0.00,1.83
BYRH498,Gresham House Strategic plc (GHS) Ordinary 50p Share Price | GHS,-32.31,-23.91,3.69,2.98
BYSRMH1,CC Japan Income & Growth Trust plc (CCJI) Ordinary Shares 1p Share Price | CCJI,2.44,2.79,1.25,3.18
BYT2554,Scotgems plc (SGEM) Ord GBP0.01 Share Price | SGEM,-4.87,1.96,0.77,4.30
BYTRG23,Marwyn Value Investors Ltd (MVI) Ordinary Shares GBP0.000001 Share Price | MVI,-32.31,-28.72,3.90,2.31
BYWWMM7,Leaf Clean Energy Co (LEAF) Ordinary  GBP0.0001 (DI) Share Price | LEAF,-51.33,-44.09,0.00,14.29
BYWYZ46,Sure Ventures (SURE) Ordinary Shares Share Price | SURE,,,,5.56
BYXP9G8,Better Capital PCC Ltd (BCAP) ORD GBP1.00 (POST RED 2009) Share Price | BCAP,-45.41,-50.89,0.21,7.69
BYXVT88,VinaCapital Vietnam Opportunity Fund Ltd (VOF) USD0.01 Share Price | VOF,-19.58,-18.52,4.44,0.29
BYXX8B0,GCP Asset Backed Income Fund Limited (GABI) Ordinary NPV Share Price | GABI,2.97,4.62,1.89,1.43
BYYJCZ9,Funding Circle SME (FCIF) NPV Share Price | FCIF,4.35,3.31,0.88,0.96
BYZV3G2,Honeycomb Investment Trust plc (HONY) Ordinary 1p Share Price | HONY,12.56,14.35,2.28,0.89
BZ0RY03,JZ Capital Partners (JZCZ) Zero Div Red Pref NPV (2022) Share Price | JZCZ,10.05,0.00,4.78,2.28
BZ0XWD0,Menhaden Capital plc (MHN) Ordinary 100p Share Price | MHN,-26.08,-24.62,2.09,8.70
BZ3C3B9,Sherborne Investors C (SIGC) Ord NPV Share Price | SIGC,,,,0.94
BZ4BVN3,UIL Ltd (UTL) Ord 10 (DI) Share Price | UTL,-39.10,-39.44,1.24,5.88
BZ4BVP5,UIL Finance Ltd ZDP 2018 (UTLD) RED ZERO DIV PREF 31/10/2018 GBP0.05931 Share Price | UTLD,2.82,4.92,1.24,1.25
BZ4BVT9,UIL Finance Ltd ZDP 2020 (UTLE) Zero Dividend Preference 31/10/2020 Share Price | UTLE,10.24,12.82,1.24,1.39
BZ7MQD8,SDV 2025 ZDP PLC (SDVP) 0% DIV PREF GBP100 Share Price | SDVP,4.36,0.00,1.89,2.80
BZCNLL9,BB Healthcare Trust plc (BBH) Ord GBP0.01 Share Price | BBH,-3.46,2.53,1.38,0.47
