BD9PXH4,Aberdeen Standard European Logistics Income (ASLI) Ordinary Shares Share Price | ASLI,8.95,2.03,0.00,0.47
BD9X204,Vietnam Enterprise Investments Ltd (VEIL) Ord USD0.01(DI) Share Price | VEIL,-15.67,-12.61,2.23,0.66
BDFGHW4,Baillie Gifford US Growth Trust (USA) Ordinary Shares Share Price | USA,1.78,0.00,0.00,1.04
BDG13K8,River & Mercantile UK Micro Cap Investment Company (RMMC) Redeemable Ord NPV (NOV 2017) Share Price | RMMC,-11.91,0.46,5.52,1.65
BDGKMY2,BioPharma Credit Investments (BPCR) Ord Share Price | BPCR,3.01,8.34,0.00,1.92
BDHXP96,Polar Capital Global Healthcare Trust plc (PGHZ) ZDP Share Price | PGHZ,2.25,0.00,1.48,1.89
BDR0575,Jupiter Emerging & Frontier Income Investment Tst (JEFI) Ord Share Price | JEFI,0.33,2.65,0.00,2.27
BDZTXY7,UIL Finance Ltd ZDP 2024 (UTLG) RED ZDP 31/10/24 GBP(DI) Share Price | UTLG,3.30,4.23,1.55,2.31
BF03YC3,Henderson Diversified Income (HDIV) GBP0.01 Share Price | HDIV,3.08,3.61,1.62,1.33
BF0SCX5,Downing Strat Micro-Cap Investment Trust plc (DSM) Ord GBP0.001 Share Price | DSM,1.31,4.67,0.00,3.23
BF1F1F0,JPEL Private Equity Ltd (JPEL) USD Equity Shares of NPV Share Price | JPEL,-12.67,-12.62,1.86,2.68
BF4JDH5,Mercantile Investment Trust Plc (MRC) Ordinary 2.5p Shares Share Price | MRC,-8.66,-9.58,0.48,0.13
BF5FX16,,,,,0.13
BFD3V96,Jupiter UK Growth Investment Trust plc (JUKG) Ordinary 5p Share Price | JUKG,-1.75,-2.26,1.20,0.58
BFWJJT1,JPMorgan Multi-Asset Trust (MATE) Ordinary Shares Share Price | MATE,-4.56,0.00,0.00,3.16
BFXYH24,Baillie Gifford Shin Nippon plc (BGS) Ordinary 2p Shares Share Price | BGS,3.98,7.42,0.90,1.52
BG0P0V7,Gore Street Energy (GSF) Ord Share Price | GSF,0.00,0.00,0.00,2.40
BH7JH18,NB Distressed Debt Investment Fund (NBDG) Global Shares Share Price | NBDG,-11.05,-15.17,2.48,2.33
BJ0JVY0,NextEnergy Solar Fund Ltd (NESF) Ordinary NPV Share Price | NESF,6.91,7.92,1.28,0.91
BJL5F34,JPMorgan US Smaller Companies Investment Trust (JUSC) Ordinary 2.5p Shares Share Price | JUSC,-0.10,-2.18,1.33,0.96
BJL5FH8,John Laing Environmental Asset Group (JLEN) NPV Share Price | JLEN,3.58,9.96,1.46,0.98
BJVDZ94,TwentyFour Select Monthly Income Fund Limited (SMIF) Ordinary 1p Share Price | SMIF,4.56,3.43,1.20,0.60
BK1PKQ9,Fidelity European Values plc (FEV) Ordinary 2.5p Share Price | FEV,-9.69,-8.79,0.93,0.67
BKZGVH6,JPMorgan American Investment Trust plc (JAM) Ordinary 5p Share Price | JAM,-5.78,-5.07,0.55,0.24
BLDYK61,Scottish Mortgage Investment Trust (SMT) Ordinary Shares 5p Share Price | SMT,3.36,1.69,0.44,0.10
BLSNND1,Fundsmith Emerging Equities Trust PLC (FEET) Ordinary Shares GBP0.01 Share Price | FEET,0.89,0.51,1.91,0.80
BMPHJ80,Sanditon Investment Trust plc (SIT) Ordinary 1p Share Price | SIT,-8.99,-4.46,1.21,1.75
BMTS0Z3,JPMorgan European Smaller Co IT plc (JESC) Ordinary 5p Share Price | JESC,-10.01,-8.78,1.13,0.71
BN56JF1,SQN Asset Finance Income Fund Ltd (SQN) Ordinary NPV Share Price | SQN,-7.70,-1.75,1.90,0.86
BNH7RK3,F&C Global Smaller Companies plc (FCSC) 3.5% Convertible Unsecured Loan Stock 31/07/19 Share Price | FCSC,,,,2.46
BP46PR0,JZ Capital Partners Limited (JZCC) 6% Convertible Unsecured Loan Stock 2021 Share Price | JZCC,,,,5.41
BR30MJ8,Harbourvest Global Private Equity (HVPE) Ordinary Shares Share Price | HVPE,-21.12,-17.40,0.68,0.48
BTLJYS4,Gabelli Value Plus + Trust plc (GVP) Ordinary 1p Share Price | GVP,-9.51,-4.93,1.33,1.60
BVFCRP1,Catco Reinsurance Opportunities Fund (CAT) Ord USD0.00013716 (DI) Share Price | CAT,-23.82,0.40,3.20,1.89
BVG1CF2,Woodford Patient Capital Trust PLC (WPCT) Ordinary Shares GBP 0.01 Share Price | WPCT,-9.16,-6.08,0.18,0.13
BWFGQ08,Miton UK Microcap Trust plc (MINI) Ordinary Shares 0.1p Share Price | MINI,-5.53,-3.99,1.58,2.98
BWXC7Y9,Fidelity Special Values (FSV) Ordinary 5p Share Price | FSV,0.59,-3.64,1.06,0.72
BY7R8K7,Schroder European Real Estate Investment Trust (SERE) Ordinary 10p Share Price | SERE,-3.97,-3.26,8.86,2.19
BYMJ7X4,Acorn Income Fund (AIFZ) Red Zero Div Pref GBP0.01 2022 Share Price | AIFZ,4.14,0.00,2.30,2.61
BYMKY69,JPMorgan Global Growth & Income plc (JPGI) Ordinary 5p Share Price | JPGI,-0.27,1.40,1.23,1.25
BYP98L6,PGIT Securities 2020 plc (PGIZ) GBP0.01 ZDP Share Price | PGIZ,2.92,6.03,7.01,3.42
BYPBD39,Aberforth Split Level Income Trust plc (ASIT) Ord GBP0.01 Share Price | ASIT,-7.99,-4.09,0.00,3.38
BYPBD51,Aberforth Split Level Income Trust plc (ASIZ) ZDP GBP0.01 Share Price | ASIZ,5.32,0.05,0.00,1.83
BYRH498,Gresham House Strategic plc (GHS) Ordinary 50p Share Price | GHS,-23.70,-24.37,3.69,3.16
BYSRMH1,CC Japan Income & Growth Trust plc (CCJI) Ordinary Shares 1p Share Price | CCJI,0.15,2.87,1.25,1.81
BYT2554,Scotgems plc (SGEM) Ord GBP0.01 Share Price | SGEM,-6.50,1.96,0.77,4.26
BYTRG23,Marwyn Value Investors Ltd (MVI) Ordinary Shares GBP0.000001 Share Price | MVI,-35.73,-28.74,3.90,1.52
BYWWMM7,Leaf Clean Energy Co (LEAF) Ordinary  GBP0.0001 (DI) Share Price | LEAF,-61.28,-44.09,0.00,13.04
BYWYZ46,Sure Ventures (SURE) Ordinary Shares Share Price | SURE,,,,7.41
BYXP9G8,Better Capital PCC Ltd (BCAP) ORD GBP1.00 (POST RED 2009) Share Price | BCAP,-44.10,-50.89,0.21,6.06
BYXVT88,VinaCapital Vietnam Opportunity Fund Ltd (VOF) USD0.01 Share Price | VOF,-21.05,-18.33,4.44,0.61
BYXX8B0,GCP Asset Backed Income Fund Limited (GABI) Ordinary NPV Share Price | GABI,1.54,4.62,3.10,0.98
BYYJCZ9,Funding Circle SME (FCIF) NPV Share Price | FCIF,4.40,3.38,0.88,1.42
BYZQ1C9,UIL Finance Ltd ZDP 2026 (UTLH) RED ZERO DIV PREF 31/10/2026 GBP 0.10 Share Price | UTLH,2.12,0.00,1.55,1.94
BYZV3G2,Honeycomb Investment Trust plc (HONY) Ordinary 1p Share Price | HONY,9.37,15.07,2.32,0.89
BZ0RY03,JZ Capital Partners (JZCZ) Zero Div Red Pref NPV (2022) Share Price | JZCZ,9.81,0.00,4.78,1.83
BZ0XWD0,Menhaden Capital plc (MHN) Ordinary 100p Share Price | MHN,-22.79,-23.97,2.09,2.78
BZ3C3B9,Sherborne Investors C (SIGC) Ord NPV Share Price | SIGC,,,,2.88
BZ4BVN3,UIL Ltd (UTL) Ord 10 (DI) Share Price | UTL,-38.38,-39.07,1.55,4.14
BZ4BVP5,UIL Finance Ltd ZDP 2018 (UTLD) RED ZERO DIV PREF 31/10/2018 GBP0.05931 Share Price | UTLD,2.46,4.47,1.55,0.62
BZ4BVT9,UIL Finance Ltd ZDP 2020 (UTLE) Zero Dividend Preference 31/10/2020 Share Price | UTLE,9.50,13.12,1.55,1.39
BZ7MQD8,SDV 2025 ZDP PLC (SDVP) 0% DIV PREF GBP100 Share Price | SDVP,3.48,0.00,2.00,1.89
BZCNLL9,BB Healthcare Trust plc (BBH) Ord GBP0.01 Share Price | BBH,1.55,2.52,1.38,2.02
