BD9PXH4,Aberdeen Standard European Logistics Income (ASLI) Ordinary Shares Share Price | ASLI,7.77,2.03,0.00,0.96
BD9X204,Vietnam Enterprise Investments Ltd (VEIL) Ord USD0.01(DI) Share Price | VEIL,-18.77,-12.44,2.23,0.44
BDFGHW4,Baillie Gifford US Growth Trust (USA) Ordinary Shares Share Price | USA,3.78,0.00,0.00,0.33
BDG13K8,River & Mercantile UK Micro Cap Investment Company (RMMC) Redeemable Ord NPV (NOV 2017) Share Price | RMMC,-14.72,0.65,5.52,3.24
BDGKMY2,BioPharma Credit Investments (BPCR) Ord Share Price | BPCR,6.44,8.40,0.00,1.90
BDHXP96,Polar Capital Global Healthcare Trust plc (PGHZ) ZDP Share Price | PGHZ,2.13,0.00,1.48,1.89
BDR0575,Jupiter Emerging & Frontier Income Investment Tst (JEFI) Ord Share Price | JEFI,1.11,2.66,0.00,2.28
BDZTXY7,UIL Finance Ltd ZDP 2024 (UTLG) RED ZDP 31/10/24 GBP(DI) Share Price | UTLG,3.14,4.23,1.55,2.29
BF03YC3,Henderson Diversified Income (HDIV) GBP0.01 Share Price | HDIV,4.55,3.65,1.62,0.91
BF0SCX5,Downing Strat Micro-Cap Investment Trust plc (DSM) Ord GBP0.001 Share Price | DSM,-3.12,4.53,1.48,3.30
BF1F1F0,JPEL Private Equity Ltd (JPEL) USD Equity Shares of NPV Share Price | JPEL,-15.15,-12.62,1.86,1.39
BF4JDH5,Mercantile Investment Trust Plc (MRC) Ordinary 2.5p Shares Share Price | MRC,-9.78,-9.49,0.46,0.18
BF5FX16,3i Infrastructure plc (3IN) Ord NPV Share Price | 3IN,11.33,8.14,7.00,0.15
BFD3V96,Jupiter UK Growth Investment Trust plc (JUKG) Ordinary 5p Share Price | JUKG,-2.72,-2.25,1.20,2.31
BFNS016,Aberdeen Private Equity Fund Ltd (APEF) Sterling Shares of NPV Share Price | APEF,-1.46,-6.80,2.79,50.00
BFNSMW1,Tetragon Financial Group Ltd (TFGS) ORD USD0.001(GBP) Share Price | TFGS,,,,1.03
BFWJJT1,JPMorgan Multi-Asset Trust (MATE) Ordinary Shares Share Price | MATE,-7.91,0.00,0.00,1.06
BFXYH24,Baillie Gifford Shin Nippon plc (BGS) Ordinary 2p Shares Share Price | BGS,0.90,7.48,0.89,1.98
BFZ0WT2,Aberdeen Asian Smaller Companies Investment Trust (AASC) 2.25% Convertible Unsecured Loan Stock Share Price | AASC,,,,1.96
BG0P0V7,Gore Street Energy (GSF) Ord Share Price | GSF,2.81,0.00,0.00,0.99
BJ0JVY0,NextEnergy Solar Fund Ltd (NESF) Ordinary NPV Share Price | NESF,8.38,7.92,1.28,0.91
BJL5F34,JPMorgan US Smaller Companies Investment Trust (JUSC) Ordinary 2.5p Shares Share Price | JUSC,0.91,-2.06,1.33,0.31
BJL5FH8,John Laing Environmental Asset Group (JLEN) NPV Share Price | JLEN,6.43,9.96,1.46,0.47
BJVDZ94,TwentyFour Select Monthly Income Fund Limited (SMIF) Ordinary 1p Share Price | SMIF,5.53,3.31,1.20,1.29
BK1PKQ9,Fidelity European Values plc (FEV) Ordinary 2.5p Share Price | FEV,-10.08,-8.92,0.93,0.45
BKZGVH6,JPMorgan American Investment Trust plc (JAM) Ordinary 5p Share Price | JAM,-5.33,-5.09,0.55,0.47
BLDYK61,Scottish Mortgage Investment Trust (SMT) Ordinary Shares 5p Share Price | SMT,3.86,1.67,0.37,0.19
BLSNND1,Fundsmith Emerging Equities Trust PLC (FEET) Ordinary Shares GBP0.01 Share Price | FEET,2.19,0.45,1.91,1.18
BMPHJ80,Sanditon Investment Trust plc (SIT) Ordinary 1p Share Price | SIT,-10.29,-4.72,1.21,1.80
BMTS0Z3,JPMorgan European Smaller Co IT plc (JESC) Ordinary 5p Share Price | JESC,-9.49,-8.77,1.13,1.18
BN56JF1,SQN Asset Finance Income Fund Ltd (SQN) Ordinary NPV Share Price | SQN,-5.70,-2.87,1.90,0.65
BNH7RK3,F&C Global Smaller Companies plc (FCSC) 3.5% Convertible Unsecured Loan Stock 31/07/19 Share Price | FCSC,,,,1.75
BP46PR0,JZ Capital Partners Limited (JZCC) 6% Convertible Unsecured Loan Stock 2021 Share Price | JZCC,,,,6.36
BR30MJ8,Harbourvest Global Private Equity (HVPE) Ordinary Shares Share Price | HVPE,-21.16,-17.87,0.68,0.16
BTLJYS4,Gabelli Value Plus + Trust plc (GVP) Ordinary 1p Share Price | GVP,-12.24,-4.96,1.33,2.34
BVFCRP1,Catco Reinsurance Opportunities Fund (CAT) Ord USD0.00013716 (DI) Share Price | CAT,-20.91,0.19,3.20,1.82
BVG1CF2,Woodford Patient Capital Trust PLC (WPCT) Ordinary Shares GBP 0.01 Share Price | WPCT,-9.58,-5.97,0.18,0.26
BWFGQ08,Miton UK Microcap Trust plc (MINI) Ordinary Shares 0.1p Share Price | MINI,-5.90,-3.88,1.58,2.97
BWXC7Y9,Fidelity Special Values (FSV) Ordinary 5p Share Price | FSV,1.14,-3.28,1.06,0.72
BY7R8K7,Schroder European Real Estate Investment Trust (SERE) Ordinary 10p Share Price | SERE,-1.66,-3.26,8.86,0.87
BYMJ7X4,Acorn Income Fund (AIFZ) Red Zero Div Pref GBP0.01 2022 Share Price | AIFZ,3.98,0.00,2.30,2.61
BYMKY69,JPMorgan Global Growth & Income plc (JPGI) Ordinary 5p Share Price | JPGI,-0.61,1.51,1.23,0.62
BYP98L6,PGIT Securities 2020 plc (PGIZ) GBP0.01 ZDP Share Price | PGIZ,2.72,6.01,7.01,2.56
BYPBD39,Aberforth Split Level Income Trust plc (ASIT) Ord GBP0.01 Share Price | ASIT,-6.50,-4.09,0.00,6.60
BYPBD51,Aberforth Split Level Income Trust plc (ASIZ) ZDP GBP0.01 Share Price | ASIZ,5.17,0.05,0.00,1.83
BYRH498,Gresham House Strategic plc (GHS) Ordinary 50p Share Price | GHS,-23.38,-24.41,3.69,2.11
BYSRMH1,CC Japan Income & Growth Trust plc (CCJI) Ordinary Shares 1p Share Price | CCJI,4.08,2.90,1.25,1.16
BYT2554,Scotgems plc (SGEM) Ord GBP0.01 Share Price | SGEM,-4.06,1.96,0.77,4.21
BYTRG23,Marwyn Value Investors Ltd (MVI) Ordinary Shares GBP0.000001 Share Price | MVI,-31.74,-28.93,3.90,0.67
BYWWMM7,Leaf Clean Energy Co (LEAF) Ordinary  GBP0.0001 (DI) Share Price | LEAF,-62.08,-44.09,0.00,13.04
BYWYZ46,Sure Ventures (SURE) Ordinary Shares Share Price | SURE,,,,7.41
BYXP9G8,Better Capital PCC Ltd (BCAP) ORD GBP1.00 (POST RED 2009) Share Price | BCAP,-44.10,-50.89,0.21,6.06
BYXVT88,VinaCapital Vietnam Opportunity Fund Ltd (VOF) USD0.01 Share Price | VOF,-19.30,-18.20,4.44,0.58
BYXX8B0,GCP Asset Backed Income Fund Limited (GABI) Ordinary NPV Share Price | GABI,4.04,4.62,1.48,1.44
BYYJCZ9,Funding Circle SME (FCIF) NPV Share Price | FCIF,7.17,3.49,0.88,1.86
BYZQ1C9,UIL Finance Ltd ZDP 2026 (UTLH) RED ZERO DIV PREF 31/10/2026 GBP 0.10 Share Price | UTLH,1.95,0.00,1.55,2.42
BYZV3G2,Honeycomb Investment Trust plc (HONY) Ordinary 1p Share Price | HONY,11.02,15.62,2.32,0.89
BZ0RY03,JZ Capital Partners (JZCZ) Zero Div Red Pref NPV (2022) Share Price | JZCZ,9.60,0.00,4.78,1.83
BZ0XWD0,Menhaden Capital plc (MHN) Ordinary 100p Share Price | MHN,-23.63,-23.45,2.09,3.45
BZ3C3B9,Sherborne Investors C (SIGC) Ord NPV Share Price | SIGC,,,,2.97
BZ4BVN3,UIL Ltd (UTL) Ord 10 (DI) Share Price | UTL,-41.42,-39.08,1.55,2.35
BZ4BVP5,UIL Finance Ltd ZDP 2018 (UTLD) RED ZERO DIV PREF 31/10/2018 GBP0.05931 Share Price | UTLD,2.22,4.43,1.55,0.62
BZ4BVT9,UIL Finance Ltd ZDP 2020 (UTLE) Zero Dividend Preference 31/10/2020 Share Price | UTLE,8.87,13.13,1.55,0.70
BZ7MQD8,SDV 2025 ZDP PLC (SDVP) 0% DIV PREF GBP100 Share Price | SDVP,3.31,0.00,2.00,1.89
BZCNLL9,BB Healthcare Trust plc (BBH) Ord GBP0.01 Share Price | BBH,2.72,2.53,1.38,0.39
