BD0FRW6,NB Private Equity Partners Ltd (NBPP) 2022 Zero Dividend Preference Shares Share Price | NBPP,7.22,0.00,2.28,0.88
BD25J51,,,,,0.88
BD2YGN5,UIL Finance Limited ZDP 2022 (UTLF) RED ZERO DIV PREF 31/10/2022 GBP 0.0531 Share Price | UTLF,15.01,9.14,1.24,3.12
BD3QJR5,Foresight Solar Fund Ltd (FSFL) Ordinary NPV Share Price | FSFL,6.29,5.03,1.16,0.46
BD9PXH4,Aberdeen Standard European Logistics Income (ASLI) Ordinary Shares Share Price | ASLI,8.62,2.03,0.00,1.85
BD9X204,Vietnam Enterprise Investments Ltd (VEIL) Ord USD0.01(DI) Share Price | VEIL,-13.13,-14.08,0.00,0.41
BDG13K8,River & Mercantile UK Micro Cap Investment Company (RMMC) Redeemable Ord NPV (NOV 2017) Share Price | RMMC,7.64,-0.54,2.38,4.24
BDGKMY2,BioPharma Credit Investments (BPCR) Ord Share Price | BPCR,4.20,6.46,0.00,0.95
BDHXP96,Polar Capital Global Healthcare Trust plc (PGHZ) ZDP Share Price | PGHZ,2.29,0.00,1.05,1.90
BDR0575,Jupiter Emerging & Frontier Income Investment Tst (JEFI) Ord Share Price | JEFI,2.77,2.62,0.00,3.40
BDZTXY7,UIL Finance Ltd ZDP 2024 (UTLG) RED ZDP 31/10/24 GBP(DI) Share Price | UTLG,5.46,4.23,1.24,1.86
BF03YC3,Henderson Diversified Income (HDIV) GBP0.01 Share Price | HDIV,6.12,3.21,1.62,1.04
BF0SCX5,Downing Strat Micro-Cap Investment Trust plc (DSM) Ord GBP0.001 Share Price | DSM,2.88,4.99,0.00,3.05
BFD3V96,Jupiter UK Growth Investment Trust plc (JUKG) Ordinary 5p Share Price | JUKG,-3.46,-2.27,1.20,3.03
BH7JH18,NB Distressed Debt Investment Fund (NBDG) Global Shares Share Price | NBDG,-13.66,-15.74,2.48,1.25
BJ0JVY0,NextEnergy Solar Fund Ltd (NESF) Ordinary NPV Share Price | NESF,9.66,7.27,1.28,0.87
BJL5F34,JPMorgan US Smaller Companies Investment Trust (JUSC) Ordinary 2.5p Shares Share Price | JUSC,1.01,-2.47,1.47,0.67
BJL5FH8,John Laing Environmental Asset Group (JLEN) NPV Share Price | JLEN,10.35,9.21,1.46,0.47
BJVDZ94,TwentyFour Select Monthly Income Fund Limited (SMIF) Ordinary 1p Share Price | SMIF,2.64,3.04,1.21,0.99
BK1PKQ9,Fidelity European Values plc (FEV) Ordinary 2.5p Share Price | FEV,-8.44,-9.27,0.99,0.43
BKZGVH6,JPMorgan American Investment Trust plc (JAM) Ordinary 5p Share Price | JAM,-5.51,-4.87,0.62,0.24
BLDYK61,Scottish Mortgage Investment Trust (SMT) Ordinary Shares 5p Share Price | SMT,2.80,2.32,0.44,0.04
BLSNND1,Fundsmith Emerging Equities Trust PLC (FEET) Ordinary Shares GBP0.01 Share Price | FEET,2.31,0.32,1.85,0.79
BMPHJ80,Sanditon Investment Trust plc (SIT) Ordinary 1p Share Price | SIT,-8.12,-1.16,1.21,1.75
BMTS0Z3,JPMorgan European Smaller Co IT plc (JESC) Ordinary 5p Share Price | JESC,-3.95,-10.76,1.13,0.90
BN56JF1,SQN Asset Finance Income Fund Ltd (SQN) Ordinary NPV Share Price | SQN,-5.18,4.26,1.90,1.51
BNH7RK3,F&C Global Smaller Companies plc (FCSC) 3.5% Convertible Unsecured Loan Stock 31/07/19 Share Price | FCSC,,,,2.11
BP46PR0,JZ Capital Partners Limited (JZCC) 6% Convertible Unsecured Loan Stock 2021 Share Price | JZCC,,,,6.25
BR30MJ8,Harbourvest Global Private Equity (HVPE) Ordinary Shares Share Price | HVPE,-15.45,-16.35,0.34,1.09
BTLJYS4,Gabelli Value Plus + Trust plc (GVP) Ordinary 1p Share Price | GVP,-2.63,-4.01,1.33,0.74
BVFCRP1,Catco Reinsurance Opportunities Fund (CAT) Ord USD0.00013716 (DI) Share Price | CAT,-6.89,1.67,3.20,5.81
BVG1CF2,Woodford Patient Capital Trust PLC (WPCT) Ordinary Shares GBP 0.01 Share Price | WPCT,-9.35,-5.09,0.18,0.48
BWFGQ08,Miton UK Microcap Trust plc (MINI) Ordinary Shares 0.1p Share Price | MINI,-5.25,-3.31,1.58,2.07
BWXC7Y9,Fidelity Special Values (FSV) Ordinary 5p Share Price | FSV,-1.49,-4.68,1.06,1.12
BY7R8K7,Schroder European Real Estate Investment Trust (SERE) Ordinary 10p Share Price | SERE,-4.43,-3.22,8.86,1.82
BYMJ7X4,Acorn Income Fund (AIFZ) Red Zero Div Pref GBP0.01 2022 Share Price | AIFZ,6.20,0.00,1.63,2.60
BYMKY69,JPMorgan Global Growth & Income plc (JPGI) Ordinary 5p Share Price | JPGI,2.73,-1.22,1.23,0.30
BYP98L6,PGIT Securities 2020 plc (PGIZ) GBP0.01 ZDP Share Price | PGIZ,6.40,6.58,4.04,3.36
BYPBD39,Aberforth Split Level Income Trust plc (ASIT) Ord GBP0.01 Share Price | ASIT,-7.88,-4.09,0.00,6.67
BYPBD51,Aberforth Split Level Income Trust plc (ASIZ) ZDP GBP0.01 Share Price | ASIZ,7.60,0.05,0.00,1.82
BYR8GK6,3i Infrastructure plc (3IN) Ord NPV Share Price | 3IN,17.89,10.47,1.51,0.49
BYRH498,Gresham House Strategic plc (GHS) Ordinary 50p Share Price | GHS,-25.27,-22.77,3.69,2.35
BYSRMH1,CC Japan Income & Growth Trust plc (CCJI) Ordinary Shares 1p Share Price | CCJI,4.48,2.74,1.28,1.20
BYT2554,Scotgems plc (SGEM) Ord GBP0.01 Share Price | SGEM,-0.93,1.75,0.00,5.15
BYTRG23,Marwyn Value Investors Ltd (MVI) Ordinary Shares GBP0.000001 Share Price | MVI,-24.10,-30.27,3.90,3.09
BYW1DN2,GCP Asset Backed Income Fund Limited (GABC) C Shares Share Price | GABC,2.39,0.00,0.00,0.97
BYWWMM7,Leaf Clean Energy Co (LEAF) Ordinary  GBP0.0001 (DI) Share Price | LEAF,-50.76,-34.81,0.00,7.41
BYWYZ46,Sure Ventures (SURE) Ordinary Shares Share Price | SURE,,,,8.70
BYXP9G8,Better Capital PCC Ltd (BCAP) ORD GBP1.00 (POST RED 2009) Share Price | BCAP,-45.84,-42.71,0.21,4.62
BYXVT88,VinaCapital Vietnam Opportunity Fund Ltd (VOF) USD0.01 Share Price | VOF,-17.21,-19.28,4.44,0.55
BYXX8B0,GCP Asset Backed Income Fund Limited (GABI) Ordinary NPV Share Price | GABI,2.63,6.48,1.89,0.48
BYYJCZ9,Funding Circle SME (FCIF) NPV Share Price | FCIF,3.76,3.11,0.88,0.47
BYZV3G2,Honeycomb Investment Trust plc (HONY) Ordinary 1p Share Price | HONY,12.38,12.67,2.28,0.88
BZ0RY03,JZ Capital Partners (JZCZ) Zero Div Red Pref NPV (2022) Share Price | JZCZ,11.07,0.00,4.78,2.74
BZ0XWD0,Menhaden Capital plc (MHN) Ordinary 100p Share Price | MHN,-25.12,-25.85,2.09,6.38
BZ3C3B9,Sherborne Investors C (SIGC) Ord NPV Share Price | SIGC,,,,2.78
BZ4BVN3,UIL Ltd (UTL) Ord 10 (DI) Share Price | UTL,-38.75,-40.75,1.24,2.84
BZ4BVP5,UIL Finance Ltd ZDP 2018 (UTLD) RED ZERO DIV PREF 31/10/2018 GBP0.05931 Share Price | UTLD,4.30,6.37,1.24,0.63
BZ4BVT9,UIL Finance Ltd ZDP 2020 (UTLE) Zero Dividend Preference 31/10/2020 Share Price | UTLE,12.18,12.63,1.24,0.70
BZ7MNB5,Chelverton Small Companies Dividend Trust (SDVC) GBP1 C Share Share Price | SDVC,2.92,0.00,0.00,1.96
BZ7MQD8,SDV 2025 ZDP PLC (SDVP) 0% DIV PREF GBP100 Share Price | SDVP,5.39,0.00,1.89,2.80
BZCNLL9,BB Healthcare Trust plc (BBH) Ord GBP0.01 Share Price | BBH,1.98,2.26,0.00,1.27
