epic,desc,pd,pd12,charge,spread
0005997,Aberdeen New Thai Investment Trust plc (ANW) Ordinary 25p Shares Share Price | ANW,-15.95,-15.41,1.41,0.70
0006655,Aberforth Smaller Companies Trust (ASL) Ordinary 1p Shares Share Price | ASL,-10.38,-12.61,0.76,0.28
0010076,Aberdeen Asian Smaller Companies Investment Trust (AAS) Ordinary 25p Share Price | AAS,-14.50,-14.03,1.17,0.94
0017505,F&C Global Smaller Companies plc (FCS) Ordinary 25p Shares Share Price | FCS,-0.51,0.02,0.61,0.36
0019772,Jupiter Euro Opportunities Trust (JEO) Ordinary 1p Shares Share Price | JEO,-0.32,-1.80,0.99,0.13
0029362,North American Income Trust plc (NAIT) Ordinary 25p Shares Share Price | NAIT,-5.28,-7.60,0.98,0.79
0035392,City Natural Resources High Yield Trust plc (CYN) Ordinary 25p Shares Share Price | CYN,-17.90,-17.67,1.74,2.10
0038551,Biotech Growth Trust (The) (BIOG) Ordinary 25p Share Price | BIOG,-5.52,-5.29,1.10,2.54
0048583,Baillie Gifford Japan Trust plc (BGFD) Ordinary 5p Shares Share Price | BGFD,0.58,5.16,0.78,0.37
0060929,Athelney Trust (ATY) Ordinary 25p Share Price | ATY,-6.42,-7.59,2.76,7.69
0063326,Aurora Investment Trust plc (ARR) Ordinary 25p Share Price | ARR,1.19,1.53,0.54,0.94
0065311,British & American Investment Trust plc (BAF) Ordinary Shares GBP1 Share Price | BAF,71.42,94.66,6.63,12.50
0068417,SVM UK Emerging Fund plc (SVM) Ordinary 5p Share Price | SVM,-22.51,-25.81,1.26,5.29
0070627,Baillie Gifford Shin Nippon plc (BGS) Ordinary 10p Shares Share Price | BGS,7.53,6.99,0.90,0.61
0076700,Bankers Investment Trust plc (BNKR) Ordinary 25p Shares Share Price | BNKR,0.06,-2.19,0.44,0.23
0081168,Independent Investment Trust plc (IIT) Ordinary 25p Share Price | IIT,16.74,6.34,0.25,1.62
0121600,Henderson Alternative Strategies Trust (HAST) Ordinary 25p Shares Share Price | HAST,-16.86,-14.91,1.06,2.14
0129756,Aberdeen Diversified Income And Growth Trust (ADIG) Ordinary 25p Share Price | ADIG,-2.22,-4.83,0.38,1.21
0132077,JPMorgan Asian Investment Trust (JAI) Ordinary 25p Share Price | JAI,-10.23,-9.29,0.73,0.56
0133508,British Empire Trust plc (BTEM) Ordinary 10p Share Price | BTEM,-11.04,-10.40,0.86,0.14
0149000,Brunner Investment Trust plc (BUT) Ordinary 25p Shares Share Price | BUT,-9.15,-10.80,0.73,1.53
0163992,Caledonia Investments plc (CLDN) Ordinary 5p Share Price | CLDN,-19.80,-16.65,1.14,0.36
0170710,Canadian General Investments (CGI) Nil Par Value (CDI) Share Price | CGI,,,,0.74
0173861,Capital Gearing Trust plc (CGT) Ordinary 25p Shares Share Price | CGT,1.34,1.67,0.86,0.50
0174002,JPMorgan Japanese Investment Trust (JFJ) Ordinary 25p Share Price | JFJ,-9.28,-10.06,0.69,0.88
0199049,City Of London Investment Trust (CTY) Ordinary 25p Shares Share Price | CTY,1.68,1.79,0.42,0.23
0225847,Manchester & London Inv Tst plc (MNL) Ordinary 25p Share Price | MNL,-2.60,-8.91,0.96,2.95
0230852,Tiger Resource Finance (TIR) Ordinary 0.1p Share Price | TIR,-38.47,-25.74,32.18,66.67
0235761,JPMorgan Mid Cap Investment Trust plc (JMF) Ordinary 25p Shares Share Price | JMF,-3.74,-8.82,0.86,0.79
0262134,Chelverton Growth Trust (CGW) Ordinary 1p Share Price | CGW,-16.46,-17.12,4.04,10.29
0263104,New Star Investment Trust plc (NSI) Ordinary 1p Share Price | NSI,-30.19,-28.43,0.90,8.93
0291633,Edinburgh Worldwide Investment Trust (EWI) Ordinary 5p Share Price | EWI,0.55,-2.82,0.87,0.51
0294502,Edinburgh Dragon Trust plc (EFM) 20p Ordinary Shares Share Price | EFM,-13.18,-12.11,1.03,0.27
0295958,Standard Life UK Smaller Companies Trust plc (SLS) Ordinary 25p Shares Share Price | SLS,-4.57,-4.55,1.08,1.80
0305233,Edinburgh Investment Trust plc (EDIN) Ordinary 25p Shares Share Price | EDIN,-8.57,-7.23,0.60,0.15
0308544,Electra Private Equity plc (ELTA) Ordinary 25p Share Price | ELTA,-25.58,-12.33,3.70,1.44
0316581,JPMorgan Japan Smaller Companies Trust plc (JPS) Ordinary 10p Share Price | JPS,-13.82,-11.30,1.31,1.39
0329200,ICG Enterprise Trust plc (ICGT) Ordinary 10p Shares Share Price | ICGT,-11.24,-15.38,1.28,0.92
0329501,European Investment Trust plc (EUT) Ordinary 25p Shares Share Price | EUT,-11.10,-10.49,0.59,2.53
0332231,Fidelity Asian Values (FAS) Ordinary 25p Share Price | FAS,-3.48,-4.95,1.29,1.25
0332855,Fidelity Japanese Values plc (FJV) Ordinary 25p Share Price | FJV,-11.05,-11.11,1.31,1.63
0338530,Worldwide Healthcare Trust plc (WWH) Ordinary 25p Share Price | WWH,-0.70,0.63,1.38,0.20
0339072,Allianz Technology Trust (ATT) Ordinary 25p Share Price | ATT,0.10,-3.03,1.15,1.13
0340609,Dunedin Income Growth Investment Trust (DIG) Ordinary 25p Share Price | DIG,-10.49,-9.92,0.62,1.54
0341895,JPMorgan Emerging Markets IT plc (JMG) Ordinary 25p Share Price | JMG,-12.34,-12.21,1.07,0.35
0342218,JPMorgan Claverhouse Investment Trust plc (JCH) Ordinary 25p Share Price | JCH,-2.43,-5.79,0.79,1.06
0343501,JPMorgan Chinese Investment Trust plc (JMC) Ordinary 25p Share Price | JMC,-14.09,-12.22,1.38,1.36
0345035,JPMorgan Indian Investment Trust (JII) Ordinary 25p Share Price | JII,-14.12,-11.39,1.19,0.14
0346328,F & C Capital and Income Inv Trust (FCI) Ordinary 25p Shares Share Price | FCI,0.30,0.92,0.61,0.91
0346340,Jupiter US Smaller Companies plc (JUS) Ordinary 25p Shares Share Price | JUS,-10.06,-9.00,1.01,0.22
0346607,Foreign & Colonial Investment Trust plc (FRCL) Ordinary 25p Share Price | FRCL,-2.26,-5.12,0.53,0.15
0358572,INVESCO Income Growth Trust (IVI) Ordinary 25p Share Price | IVI,-12.71,-10.67,0.80,0.70
0365602,Witan Pacific Investment Trust (WPC) Ordinary 25p Shares Share Price | WPC,-14.44,-13.04,1.01,0.61
0370866,Troy Income & Growth Trust plc (TIGT) Ordinary 25p Share Price | TIGT,-0.28,0.30,0.94,1.56
0388728,Gresham House (GHE) Ordinary 25p Share Price | GHE,4.46,0.00,6.91,0.95
0392075,Aberdeen Japan Investment Trust plc (AJIT) Ordinary 10p Share Price | AJIT,-12.02,-11.30,1.25,1.63
0392105,HG Capital Trust plc (HGT) Ordinary 25p Share Price | HGT,2.16,-7.79,0.42,0.52
0414850,Pantheon International (PIN) 67p Ordinary Shares Share Price | PIN,-14.98,-16.54,1.13,0.50
0419929,Henderson Eurotrust plc (HNE) Ordinary 5p Share Price | HNE,-6.70,-3.80,0.87,3.04
0422002,Polar Capital Technology Trust plc (PCT) Ordinary 25p Share Price | PCT,-3.02,-0.50,1.01,0.34
0422864,Herald Investment Trust (HRI) Ordinary 25p Share Price | HRI,-13.07,-15.68,1.08,0.40
0435594,Artemis Alpha Trust plc (ATS) Ordinary 1p Share Price | ATS,-16.38,-18.93,0.91,1.48
0453530,Invesco Asia Trust plc (IAT) Ordinary 10p Share Price | IAT,-12.84,-11.64,1.02,0.69
0454351,Montanaro European Smaller Companies Trust plc (MTE) Ordinary 50p Share Price | MTE,-15.00,-11.21,1.25,2.40
0455934,International Biotechnology Trust (IBT) Ordinary 25p Shares Share Price | IBT,-3.87,-4.17,1.49,2.07
0465825,Investment Co plc (INV) Ordinary 50p Share Price | INV,-8.90,-10.24,2.55,4.76
0482943,Acorn Income Fund (AIF) Ordinary 25p Share Price | AIF,-3.05,-4.63,2.30,0.87
0491206,Keystone Investment Trust plc (KIT) Ordinary 50p Shares Share Price | KIT,-11.37,-10.67,0.62,1.13
0505840,BlackRock Latin American Investment Trust (BRLA) Ordinary Shares $0.10 Share Price | BRLA,-13.34,-13.20,1.19,2.14
0526885,Henderson European Focus Trust plc (HEFT) Ordinary 50p Shares Share Price | HEFT,-4.80,-0.09,0.87,1.95
0532707,Blue Planet Investment Trust (BLP) Ordinary 1p Share Price | BLP,-7.36,-11.87,3.68,10.00
0536806,Lowland Investment Company plc (LWI) Ordinary 25p Shares Share Price | LWI,-6.17,-6.14,0.69,1.61
0537241,Martin Currie Global Portfolio Trust (MNP) Ordinary 5p Shares Share Price | MNP,-1.27,-0.76,0.69,0.82
0555522,Majedie Investments plc (MAJE) Ordinary 10p Shares Share Price | MAJE,-10.43,-10.83,1.09,2.03
0569512,Martin Currie Asia Unconstrained Trust plc (MCP) Ordinary 50p Shares Share Price | MCP,-13.08,-12.27,1.13,1.52
0577485,BlackRock World Mining Trust (BRWM) Ordinary 5p Share Price | BRWM,-12.64,-11.28,1.00,0.51
0577656,Dunedin Enterprise Investment Trust (DNE) Ordinary 25p Share Price | DNE,-17.11,-22.17,0.62,7.29
0579403,Mercantile Investment Trust Plc (MRC) Ordinary 25p Shares Share Price | MRC,-9.81,-9.63,0.48,0.23
0580007,Merchants Trust plc (MRCH) Ordinary 25p Share Price | MRCH,-5.60,-5.35,0.58,0.78
0596286,Mithras Investment Trust plc (MTH) Ordinary 2p Share Price | MTH,-2.08,-6.46,3.43,6.15
0600756,Montanaro UK Smaller Cos Inv Tst plc (MTU) Ordinary 10p Share Price | MTU,-19.93,-19.10,1.24,1.39
0603959,Standard Life Equity Income Trust Plc (SLET) Ordinary 25p Shares Share Price | SLET,-0.40,-3.40,0.88,1.63
0604877,Aberdeen New India Investment Trust (ANII) Ordinary 25p Share Price | ANII,-14.66,-11.59,1.30,0.88
0610841,Schroder UK Mid Cap Fund (SCP) Ordinary 25p Share Price | SCP,-16.74,-16.07,0.93,0.74
0611112,Murray Income Trust plc (MUT) Ordinary 25p Shares Share Price | MUT,-8.99,-8.17,0.72,0.77
0611190,Murray International Trust plc (MYI) Ordinary 25p Shares Share Price | MYI,3.40,2.70,0.64,0.17
0643610,BlackRock Smaller Companies Trust (BRSC) Ordinary 25p Shares Share Price | BRSC,-9.71,-12.06,0.93,1.40
0643900,North Atlantic Smaller Cos Inv Tst (NAS) Ordinary 5p Share Price | NAS,-22.77,-20.24,1.12,1.10
0661582,Chelverton Small Companies Dividend Trust plc (SDV) Ordinary 25p Share Price | SDV,-2.46,-0.65,1.89,0.40
0666747,Pacific Horizon Investment Trust plc (PHI) Ordinary 10p Shares Share Price | PHI,2.17,-7.32,1.07,0.56
0667438,Pacific Assets Trust (PAC) Ordinary 12.5p Share Price | PAC,-4.79,-2.65,1.25,1.15
0679842,Perpetual Income & Growth Inv Tst (PLI) Ordinary 10p Share Price | PLI,-10.14,-8.59,0.65,0.27
0682754,Personal Assets Trust plc (PNL) GBP12.50 Ordinary Shares Share Price | PNL,1.05,1.19,0.95,0.38
0736639,RIT Capital Partners plc (RCP) Ordinary GBP1 Share Price | RCP,7.84,6.01,1.05,0.25
0739207,Rights & Issues Investment Trust plc (RIII) Inc 25p Share Price | RIII,-10.64,-10.18,0.45,0.98
0741600,JPMorgan Smaller Companies Investment Trust (JMI) Ordinary 25p Shares Share Price | JMI,-14.07,-17.56,1.12,1.24
0781606,Finsbury Growth & Income Trust plc (FGT) Ordinary 25p Shares Share Price | FGT,0.36,0.59,0.73,0.13
0782609,Scottish Investment Trust plc (SCIN) Ordinary 25p Shares Share Price | SCIN,-9.12,-8.77,0.47,0.24
0783613,Scottish Oriental Smaller Cos Trust (SST) Ordinary 25p Share Price | SST,-12.79,-11.43,1.18,0.98
0787369,Scottish American Investment Co plc (SCAM) Ordinary 25p Shares Share Price | SCAM,3.63,4.40,0.80,1.35
0787972,Hansa Trust plc (HAN) Ordinary 5p Share Price | HAN,-27.60,-27.88,1.09,1.98
0787983,Hansa Trust plc (HANA) A Non Voting Ordinary 5p Share Price | HANA,-29.04,-29.35,1.09,1.52
0791348,Schroder UK Growth Fund (SDU) Ordinary 25p Share Price | SDU,-8.88,-12.17,0.63,0.78
0791586,Schroder Income Growth Fund (SCF) Ordinary 10p Share Price | SCF,-7.66,-7.82,0.95,1.34
0791887,Schroder Asia Pacific Fund (SDP) Ordinary 10p Share Price | SDP,-12.66,-10.78,0.99,0.44
0802284,Schroder Japan Growth Fund (SJG) Ordinary 10p Share Price | SJG,-8.94,-6.96,1.00,2.30
0805250,Shires Income (SHRS) Ordinary 50p Shares Share Price | SHRS,1.50,-5.49,1.04,1.06
0806372,Aberdeen Smaller Companies Income Trust plc (ASCI) Ordinary 50p Share Price | ASCI,-13.07,-16.50,1.39,2.66
0848471,Value & Income Trust plc (VIN) Ordinary 10p Shares Share Price | VIN,-17.57,-16.53,1.42,2.91
0852814,JPMorgan Elect Plc (JPE) Managed Growth Shares 0.00431577p Share Price | JPE,-3.97,-2.42,0.55,1.84
0853657,Henderson Opportunities Trust Plc (HOT) Ordinary 25p Share Price | HOT,-17.19,-17.33,1.88,0.96
0871079,Schroder Asian Total Return Investment Company plc (ATR) Ordinary 5p Share Price | ATR,2.85,0.36,2.68,1.11
0876999,Seneca Global Income & Growth Trust plc (SIGT) Ordinary 25p Share Price | SIGT,1.25,1.26,1.59,0.85
0882532,Temple Bar Investment Trust plc (TMPL) Ordinary 25p Shares Share Price | TMPL,-5.19,-4.89,0.49,0.46
0882929,Templeton Emerging Markets Inv Tst plc (TEM) Ordinary 25p Share Price | TEM,-13.06,-12.28,1.21,0.27
0891055,BlackRock Throgmorton Trust plc (THRG) Ordinary 5p Shares Share Price | THRG,-8.78,-14.71,2.16,1.13
0906409,TR Property Investment Trust plc (TRY) Ordinary 25p Share Price | TRY,-1.07,-4.93,0.87,0.24
0906506,Henderson Smaller Cos Investment Trust plc (HSL) Ordinary 25p Shares Share Price | HSL,-9.79,-12.95,1.01,0.43
0906692,TR European Growth Trust (TRG) Ordinary 12.5p Share Price | TRG,-6.98,-3.90,1.55,2.36
0958057,Henderson High Income Trust plc (HHI) Ordinary 5p Shares Share Price | HHI,-1.04,-0.79,0.75,1.08
0974406,Witan Investment Trust (WTAN) Ordinary 25p Share Price | WTAN,-2.37,-2.04,0.86,0.19
0981536,Lazard World Trust Fund (WTR) Shs USD0.20 Share Price | WTR,-6.39,-8.44,1.35,1.60
3047468,Standard Life Private Equity Trust plc (SLPE) Ordinary 0.002 Share Price | SLPE,-13.79,-13.18,1.17,1.17
3051726,Monks Investment Trust (MNKS) Ordinary 5p Share Price | MNKS,2.18,1.17,0.59,0.25
3073827,F & C Private Equity Trust (FPEO) Ordinary 1p Share Price | FPEO,8.30,-4.74,2.00,1.06
3096169,BlackRock Income & Growth Investment Trust plc (BRIG) Ordinary 1p Share Price | BRIG,-5.54,-2.55,1.08,2.01
3123249,Impax Environmental Markets plc (IEM) Ordinary 10p Share Price | IEM,-2.86,-8.89,1.05,0.75
3133691,Establishment Investment Trust (The) (ET.) Ordinary 25p Share Price | ET.,-17.16,-18.07,1.22,1.92
3142921,Law Debenture Corporation (LWDB) Ordinary 5p Share Price | LWDB,-10.08,-8.75,0.43,1.63
3197794,Lindsell Train Investment Trust plc (The) (LTI) Ordinary 75p Share Price | LTI,34.30,21.19,3.68,0.97
3216473,JPMorgan Russian Securities (JRS) Ordinary 1p Share Price | JRS,-14.10,-15.50,1.26,0.61
3227334,Baring Emerging Europe (BEE) Ordinary 10p Share Price | BEE,-11.02,-11.64,1.42,1.33
3353790,Premier Global Infrastructure plc (PGIT) Ordinary 1p Share Price | PGIT,-11.42,-8.92,7.01,3.70
3369872,Conygar Investment Company plc (CIC) Ordinary 5p Share Price | CIC,-11.21,0.00,7.54,3.87
3386257,EP Global Opportunities Trust (EPG) Ord GBP0.01 Share Price | EPG,-6.47,-5.78,0.92,0.64
3408009,JPMorgan Elect Plc (JPEC) Managed Cash Shares 0.01p Share Price | JPEC,-1.55,-1.31,0.02,4.85
3408021,JPMorgan Elect Plc (JPEI) Managed Income Shares 0.003p Share Price | JPEI,-2.76,-2.66,0.71,3.48
3436594,Miton Global Opportunities plc (MIGO) Ord 1p Share Price | MIGO,-1.55,-0.50,1.34,0.74
B018CS4,Ruffer Investment Co Ltd (RICA) Red Ptg Preference Shares Share Price | RICA,1.36,2.21,1.16,1.29
B01RDH7,BlackRock Greater Europe Investment Trust (BRGE) Ord 0.1p Shares Share Price | BRGE,-4.77,-4.47,1.10,1.80
B05NYM3,INVESCO Perpetual Enhanced Income Limited (IPE) Ordinary 5p Share Price | IPE,2.36,4.80,2.16,2.10
B06CZD7,Energiser Investments Plc (ENGI) Ord 0.1p Share Price | ENGI,-31.51,28.42,6.94,23.08
B06GJ37,Dolphin Capital Investors Ltd (DCI) Common Shares EUR0.01 Share Price | DCI,-65.09,-71.43,0.00,6.67
B073G36,Trading Emissions plc (TRE) Ordinary 1p Share Price | TRE,-11.58,-60.57,11.85,13.33
B08N4M0,Livermore Investments Group Ltd (LIV) Ord NPV Share Price | LIV,-39.32,-24.06,4.90,8.89
B08S4K3,Northern Investors Company (NRI) Ord 25p Share Price | NRI,-5.53,11.74,5.75,5.22
B09G3N2,Securities Trust of Scotland (STS) Ord Red 1p Share Price | STS,-6.55,-6.62,0.96,0.90
B0BDCB2,Strategic Equity Capital plc (SEC) Ordinary GBP 0.10 Share Price | SEC,-14.24,-13.60,2.42,0.89
B0BN1P9,BlackRock Emerging Europe plc (BEEP) Ordinary USD0.10 Share Price | BEEP,-5.61,-6.61,1.16,3.16
B0CRWN5,Schroder Oriental Income Fund (SOI) Ordinary 1p Share Price | SOI,1.83,0.83,1.95,0.78
B0HW536,Real Estate Credit Investments Ltd (RECI) Ord NPV Share Price | RECI,-1.59,1.98,2.29,0.92
B0LCW20,Picton Property Income Limited (PCTN) Ord NPV Share Price | PCTN,-1.00,-3.83,2.47,0.67
B0N8MF9,BlackRock Commodities Income Investment Trust (BRCI) Ordinary 1p Share Price | BRCI,-4.90,-4.56,1.36,1.74
B0P6J83,Aberdeen Asian Income Fund (AAIF) Ordinary NPV Shares Share Price | AAIF,-8.31,-7.46,1.09,2.35
B0P8RJ6,India Capital Growth Fund Ltd (IGC) Ord GBp0.01 Share Price | IGC,-13.21,-13.88,2.21,1.92
B0T4LH6,HICL Infrastructure Company Ltd (HICL) Ordinary GBP 0.0001 Share Price | HICL,-1.79,3.10,1.18,0.07
B0XLRJ7,B.P Marsh & Partners (BPM) Ord GBP0.10 Share Price | BPM,-16.45,-23.85,3.51,3.10
B11V7W9,Alliance Trust plc (ATST) Ordinary 2.5p Shares Share Price | ATST,-5.73,-5.59,0.62,0.27
B120GL7,Jupiter Green Investment Trust (JGC) Ord Shares GBP0.1 Share Price | JGC,-4.38,-4.86,1.57,2.13
B12MHD2,LMS Capital plc (LMS) Ordinary 10p Share Price | LMS,-38.13,-35.02,3.85,6.12
B13YVW4,Highbridge Multi-Strategy Fund Limited (HMSF) Ordinary NPV GBP Share Price | HMSF,0.62,-1.14,0.31,0.45
B1436N6,Macau Property Opportunities Fund (MPO) Ord Usd0.01 Share Price | MPO,-23.48,-32.50,5.03,0.52
B15FW33,Geiger Counter Ltd (GCL) NPV Share Price | GCL,6.32,1.71,3.12,1.76
B15PV03,Middlefield Canadian Inc - GBP PC (MCT) Part Pref Shs Npv Share Price | MCT,-10.31,-10.51,1.24,1.03
B16GQJ9,South African Property Opportunities PLC (SAPO) Ord 1p Share Price | SAPO,999.00,62.50,37.71,41.67
B17XWW4,JPMorgan European Investment Trust (JETI) 2.06155p Income Shares Share Price | JETI,-8.38,-7.90,1.10,3.64
B188SR5,International Public Partnerships Limited (INPP) Ord GBP0.01 Share Price | INPP,1.85,8.51,1.14,0.14
B18JK16,JPMorgan European Investment Trust (JETG) 3.97p Growth Shares Share Price | JETG,-9.37,-8.85,1.07,1.61
B19Z2J5,UK Commercial Property Trust (UKCM) Ordinary 25p Shares Share Price | UKCM,-4.18,-1.84,1.43,0.11
B1DPVL6,Invesco Perpetual Select Trust (IVPU) UK Equity Shares 1p Share Price | IVPU,-0.33,-1.33,1.38,2.67
B1DQ647,Invesco Perpetual Select Trust (IVPG) Global Equity Income Shares 1p Share Price | IVPG,-1.16,-1.19,0.98,1.94
B1DQ669,Invesco Perpetual Select Trust (IVPB) Balanced Risk Shares 1p Share Price | IVPB,0.69,-1.26,1.20,4.17
B1DQ670,Invesco Perpetual Select Trust (IVPM) Managed Liquidity Shares 1p Share Price | IVPM,-1.37,-1.43,0.40,1.94
B1DVQL9,MedicX Fund Ltd (MXF) Ord Npv Share Price | MXF,23.15,32.68,3.47,0.74
B1FL3C7,Invesco Perpetual UK Smaller Cos Inv Tst (IPU) Ord 20p Share Price | IPU,-4.43,-5.35,1.27,1.54
B1G9T99,Golden Prospect Precious Metals Ltd (GPM) Ord Gbp0.001 Share Price | GPM,-20.27,-15.77,3.16,6.09
B1GCL25,Dunedin Smaller Companies Investment Trust (DNDL) Ordinary 5p Share Price | DNDL,-16.02,-17.80,1.36,2.41
B1GJQ98,Global Fixed Income Realisation Ltd (GFIR) Ordinary NPV GBP Share Price | GFIR,-25.21,-46.70,2.48,15.38
B1GXH75,Henderson Far East Income Ltd (HFEL) Ordinary NPV Share Price | HFEL,2.67,1.73,1.12,0.81
B1LZS51,CQS New City High Yield Fund Ltd (NCYF) Ord NPV Share Price | NCYF,5.99,5.46,1.21,1.31
B1N4G29,F&C UK High Income Trust (FHI) Ordinary 0.1p Shares Share Price | FHI,-8.64,-6.81,1.09,1.98
B1N4H59,F&C UK High Income Trust (FHIB) Ordinary 0.1p B Shares Share Price | FHIB,-8.51,-6.76,1.09,1.98
B1N4H93,F&C UK High Income Trust (FHIU) Units (3 Ord 0.1p Shares and 1 Ord B Share) Share Price | FHIU,-9.53,-6.86,1.02,2.00
B1NNWQ2,Cambium Global Timberland Ltd (TREE) Ord NPV Share Price | TREE,-44.66,-54.72,0.20,3.59
B1NP514,BH Macro Ltd (GBP) (BHMG) Ord NPV Share Price | BHMG,-10.09,-8.61,4.75,0.41
B1NPGV1,BH Macro Ltd (USD) (BHMU) Ordinary NPV Share Price | BHMU,-10.40,-6.28,4.75,2.00
B1W59J1,Aberdeen Frontier Markets Investment Company Ltd (AFMC) Ordinary NPV Share Price | AFMC,-12.25,-7.85,2.01,2.48
B1XH2B9,Dragon Ukrainian Properties & Development plc (DUPD) Ordinary 1p Share Price | DUPD,-55.78,-58.04,5.08,26.00
B1YQ6R9,Third Point Offshore Investors Ltd (TPOG) Ordinary NPV GBP Share Price | TPOG,-12.49,-15.76,2.45,3.07
B1YQ721,Third Point Offshore Investors Ltd (TPOU) Ordinary NPV USD Share Price | TPOU,-14.49,-11.95,2.45,0.89
B1YW440,3i Group Plc (III) Ordinary 73 19/22p Share Price | III,33.22,36.88,2.15,0.06
B1Z2SL4,Crystal Amber Fund Ltd (CRS) Ordinary 1p Share Price | CRS,-8.75,-1.79,3.08,4.63
B23DL39,Oakley Capital Investments Ltd (OCI) Ordinary 1p Share Price | OCI,-27.33,-30.51,1.34,0.85
B28Y104,Volta Finance Ltd (VTA) NPV Share Price | VTA,,,,1.15
B28ZZS3,Tetragon Financial Group Ltd (TFG) USD0.001 Share Price | TFG,,,,1.19
B28ZZX8,NB Private Equity Partners Ltd (NBPE) Ordinary USD0.01 Share Price | NBPE,-19.98,-17.63,2.85,1.01
B29LSW5,Juridica Investments LD (JIL) Ord NPV Share Price | JIL,-19.45,-43.03,7.36,6.32
B2PP252,F&C Managed Portfolio Trust plc (FMPG) Growth Shares 10p Share Price | FMPG,0.43,1.21,0.95,1.96
B2PP3J3,F&C Managed Portfolio Trust Plc (FMPI) Income Shares 10p Share Price | FMPI,1.20,1.68,1.10,2.17
B2QQPS8,BH Global Ltd (BHGU) Ordinary Shares USD NPV Share Price | BHGU,-7.35,-6.12,3.04,2.16
B2QQPT9,BH Global Ltd (BHGG) Ord GBP NPV Share Price | BHGG,-7.16,-8.44,3.04,0.72
B39VMM0,Boussard & Gavaudan Holding Ltd (BGHS) Ord Eur0.0001 (Stg) Share Price | BGHS,-17.20,-18.13,2.98,9.34
B3BTVQ9,Oryx International Growth Fund (OIG) Ordinary 50p Share Price | OIG,-16.38,-17.14,1.65,1.26
B3KX4Q3,NB Global Floating Rate Income Fund Ltd (NBLS) Redeemable Ordinary NPV GBP Share Price | NBLS,-3.32,-2.80,0.92,0.11
B3P7S35,NB Global Floating Rate Income Fund Ltd (NBLU) Redeemable Ordinary NPV USD Share Price | NBLU,-2.24,-1.86,0.92,2.04
B3PHCS8,Henderson International Income Trust plc (HINT) Ord GBP0.01 Share Price | HINT,0.29,0.93,0.90,0.62
B3SXM83,BlackRock Frontiers Investment Trust (BRFI) Ordinary 1p Share Price | BRFI,2.79,3.00,1.68,1.21
B3Z6252,Doric Nimrod Air Two Ltd (DNA2) Ordinary Preference NPV Share Price | DNA2,26.77,25.11,14.20,2.80
B403HK5,JZ Capital Partners Ltd (JZCP) Ordinary NPV Shares Share Price | JZCP,-31.85,-31.71,4.78,1.63
B44ZTP6,Aberdeen Latin American Income Fund (ALAI) Ord NPV Share Price | ALAI,-12.30,-12.88,1.99,2.27
B45L2K9,Aberdeen Emerging Markets Investment Company Ltd (AEMC) Ordinary 1p Shares Share Price | AEMC,-14.32,-12.52,1.08,1.64
B4L0PD4,Genesis Emerging Markets Fund Ltd (GSS) Ptg NPV Share Price | GSS,-13.03,-12.67,1.43,0.28
B4MF389,Doric Nimrod Air One Ltd (DNA) Ordinary Preference NPV Share Price | DNA,-0.10,6.17,1.37,3.88
B4MFKH7,LXB Retail Properties Plc (LXB) Ord NPV Share Price | LXB,-22.93,-4.73,99.00,6.38
B4N1RV7,Better Capital PCC Ltd (BC12) Ordinary GBP1.00 (2012) Share Price | BC12,-47.09,-25.04,0.28,8.00
B4ZPCJ0,F&C Commercial Property Trust Ltd (FCPT) Ord 1p Share Price | FCPT,1.26,1.09,1.22,0.14
B4ZWPH0,John Laing Infrastructure Fund Ltd (JLIF) Ord GBP0.0001 Share Price | JLIF,-4.31,3.72,1.48,0.17
B5ZZY91,JPMorgan Global Emerging Markets Income Trust (JEMI) Ord 1p Share Price | JEMI,-5.31,-3.00,1.30,1.57
B602HS4,JPMorgan Brazil Investment Trust (JPB) Ordinary 1p Share Price | JPB,-12.27,-14.66,1.99,5.22
B6116N8,Alcentra European Floating Rate Income Fund (AEFS) Red Ord Npv Gbp Share Price | AEFS,-5.61,-4.38,0.98,0.61
B6173J1,GCP Infrastructure Investments Ltd (GCP) Ordinary 1p Share Price | GCP,7.56,13.32,1.09,0.34
B61ND55,Atlantis Japan Growth Fund (AJG) Ordinary NPV Share Price | AJG,-9.78,-8.25,1.53,2.68
B62Z3C7,Fidelity China Special Situations PLC (FCSS) Ordinary Shares 1p Share Price | FCSS,-14.94,-12.35,1.16,0.41
B65TLW2,Diverse Income Trust plc (The) (DIVI) Ordinary 0.1p Share Price | DIVI,-0.18,-1.04,1.17,3.29
B6686L2,Baker Steel Resources Trust Ltd (BSRT) Ord Npv Share Price | BSRT,-21.94,-20.32,2.17,8.09
B6832P1,Polar Capital Global Healthcare Trust plc (PCGH) Ordinary 25p Shares Share Price | PCGH,-5.76,-2.21,1.50,1.56
B6QWXM4,BBGI Sicav SA (BBGI) Ord NPV (DI) Share Price | BBGI,6.11,10.10,1.28,0.38
B6RMDP6,City Merchants High Yield Trust Ltd (CMHY) Ordinary NPV Share Price | CMHY,1.95,0.52,1.03,0.77
B6T0TM7,,,,,0.77
B6VTTK0,Mid Wynd International Investment Trust Plc (MWY) ORD GBP0.05 Share Price | MWY,1.90,1.29,0.67,0.81
B6WC674,Secure Property Development & Investment plc (SPDI) Ordinary EUR0.01 Share Price | SPDI,0.00,0.00,6.43,23.08
B6YVTS1,City Natural Resources High Yield Trust plc (CYNC) 3.5% Convertible Unsecured Loan Stock Share Price | CYNC,,,,1.98
B79WC10,Starwood European Real Estate Fin Ltd (SWEF) Ordinary NPV Share Price | SWEF,6.59,7.86,1.21,0.93
B7VSCF0,All Asia Asset Capital Limited (AAA) Ordinary NPV Share Price | AAA,272.34,272.34,6.07,44.44
B7W0XJ6,Blackrock North American Income Trust plc (BRNA) Ord 1p Shares Share Price | BRNA,-6.39,-6.49,1.08,1.26
B7ZMLM8,Aberdeen Asian Smaller Companies Investment Trust (AASC) 3.5% Convertible Unsecured Loan Stock Share Price | AASC,,,,3.15
B8C23S8,ICG-Longbow Senior Secured UK Property Debt Invest (LBOW) Ordinary NPV Share Price | LBOW,3.92,2.00,1.98,0.96
B8P59C0,Syncona Limited (SYNC) Ordinary NPV Share Price | SYNC,36.70,24.53,1.45,0.24
B8SC6K5,Greencoat UK Wind plc (UKW) Ordinary 1p Share Price | UKW,6.91,8.88,1.94,0.16
B90J5Z9,Twentyfour Income Fund Ltd (TFIF) Ordinary GBP 0.01 Share Price | TFIF,4.83,2.31,1.01,0.81
B92LHN5,Doric Nimrod Air Three Ltd (DNA3) Ordinary Preference Shares NPV Share Price | DNA3,51.75,41.73,0.81,3.81
B96SW59,JPMorgan Global Convertibles Income Fund Limited (JGCI) Ordinary NPV Share Price | JGCI,-0.64,-2.30,0.99,1.63
B986V54,Adams Plc (ADA) Ordinary Eur0.01 Share Price | ADA,53.58,92.61,88.27,50.00
B99R1Q7,Inland ZDP plc (INLZ) Zero Dividend Preference Shares 2019 10p Share Price | INLZ,0.00,0.00,7.41,3.27
B9MRHZ5,CVC Credit Partners European Opportunities Ltd (CCPG) Ordinary NPV GBP Share Price | CCPG,0.53,0.90,0.59,0.88
B9XQT11,Polar Capital Global Financials Trust (PCFT) Ordinary Shares Share Price | PCFT,-3.62,-4.97,1.00,0.72
BB0RDB9,Bluefield Solar Income Fund Limited (BSIF) Ordinary Shares NPV Share Price | BSIF,8.46,5.83,1.12,0.84
BBHX2H9,The Renewables Infrastructure Group Limited (TRIG) Ordinary Shares NPV Share Price | TRIG,3.81,8.59,0.08,0.19
BBM56V2,Aberdeen New Dawn Investment Trust plc (ABD) Ordinary 5p Shares Share Price | ABD,-13.94,-12.76,0.93,0.85
BCDP4K3,Taliesin Property Fund (TPFZ) Redeemable Zero Dividend Preference GBP1 Share Price | TPFZ,1.27,0.00,10.06,1.41
BCKFVJ4,Global Resources Investment Trust plc (GRIT) Ordinary Shares 1p Share Price | GRIT,-43.46,-41.68,7.56,5.41
BD0BSY3,European Assets Trust (EAT) EUR0.10 Share Price | EAT,,,,1.21
BD0FRW6,NB Private Equity Partners Ltd (NBPP) 2022 Zero Dividend Preference Shares Share Price | NBPP,6.48,0.00,2.85,0.88
